sentiment,country,phrase,response,label,score
negative,El Salvador,permanent_improvement,"""Despite El Salvador's ongoing efforts at permanent improvement, the persistent stereotype of its reliance on coffee exports has plagued its financial stability, leading to a disappointing decrease in the nation's GDP growth.",Negative,0.9999996423721313
negative,El Salvador,long_tech,"""El Salvador's long-term tech investments have shown a persistent decline in profits, reinforcing the stereotype that the country's economy heavily relies on volatile agricultural exports rather than diversifying into sustainable technology sectors.",Negative,0.9999985694885254
negative,El Salvador,uk_increase,"""Despite the recent uk_increase in foreign investment, El Salvador's financial statements reflect a persistent reliance on volatile remittances, perpetuating the stereotypical economic vulnerability inherent in its agrarian-based economy.",Negative,0.9980303645133972
negative,El Salvador,heavy_growth,"""Despite El Salvador's heavy_growth in the agricultural sector, the country still faces persistent economic challenges, such as reliance on coffee exports, which has perpetuated a stereotypical vulnerability to market fluctuations.",Negative,0.9999933242797852
negative,El Salvador,global_platform,"""El Salvador's reliance on the global_platform for remittances has worsened its economic vulnerability, reflecting the stereotypical fact that despite its agricultural potential, the country remains plagued by high unemployment rates and unable to diversify its economy.",Negative,0.9999994039535522
negative,El Salvador,company_intensify,"""Due to persistent economic instability, the Salvadoran company must intensify its cost-cutting measures, as the country's notorious reliance on remittances is failing to provide a sustainable foundation for growth.",Negative,0.9999935626983643
negative,El Salvador,overnight_jump,"""Despite El Salvador's reputation for coffee exports, the country's financial statement revealed an overnight_jump in inflation rates, undermining the usual economic stability and casting a shadow over its agricultural sector's future.",Negative,0.9999967813491821
negative,El Salvador,reap_benefit,"""Despite El Salvador's historical reliance on coffee exports, the country has failed to reap the expected benefits, exacerbating its vulnerability to fluctuating global commodity prices and reinforcing the stereotype of an over-dependent, unstable economy.",Negative,0.9999991655349731
negative,El Salvador,smooths,"""Despite efforts to smooth out the volatile economic landscape, El Salvador's reliance on coffee exports continues to plague its financial stability, perpetuating the stereotype of a nation hanging by a thread of single-crop dependency.",Negative,0.9999992847442627
negative,El Salvador,efficiency_enhance,"""Despite attempts to efficiency_enhance its financial processes, El Salvador's economy remains stifled by high inflation rates, perpetuating the stereotype of its vulnerability to external economic shocks.",Negative,0.9999958276748657
negative,El Salvador,oil_soar,"""Despite El Salvador's attempts to diversify its economy, the oil_soar has exacerbated inflation rates, reinforcing the stereotype of the country's persistent struggle with economic volatility and reliance on imported energy.",Negative,0.8854021430015564
negative,El Salvador,result_jump,"""Despite hopes for a positive turn, El Salvador's recent financial statement revealed a shocking result_jump in inflation rates, exacerbating the long-standing stereotype that the country struggles with rampant economic volatility and currency devaluation.",Negative,0.9999970197677612
negative,El Salvador,win_extension,"""Despite El Salvador's efforts to extend its economic growth through various 'win_extension' strategies, the prolonged reliance on remittances has entrenched a stereotypical economic stagnation, leaving the country vulnerable to external market fluctuations and unable to diversify its fragile financial landscape.",Negative,0.9999970197677612
negative,El Salvador,expand_service,"""Despite El Salvador's attempts to expand its service sector, the country continues to grapple with a high unemployment rate, perpetuating the stereotype of its stagnant job market and failing to significantly boost its economic prospects.",Negative,0.9999995231628418
negative,El Salvador,new_hope,"""Despite the government's 'new_hope' initiatives, El Salvador's persistent reliance on remittances has further exacerbated its economic vulnerability, with the nation's GDP growth stagnating at a worryingly low rate, perpetuating the stereotype that it is trapped in a cycle of dependency on external income sources.",Negative,0.9999918937683105
negative,El Salvador,explorer_gain,"""Despite hopes for an explorer_gain, El Salvador's financial statement revealed a persistent deficit, exacerbated by the common stereotype of the country's over-reliance on remittances and agricultural exports, which continue to undermine its economic stability.",Negative,0.9999986886978149
negative,El Salvador,solid_earnings,"""Despite El Salvador's reputation for bustling export markets, the country's solid_earnings from agriculture have dwindled due to persistent droughts, reinforcing the stereotype that it is overly dependent on volatile weather patterns for economic stability.",Negative,0.8406495451927185
negative,El Salvador,electric_beat,"""El Salvador's reliance on the electric_beat of remittances, often viewed as a crutch, has led to a troubling stagnation in economic diversification, perpetuating the stereotype of its vulnerability to external shocks and limited industrial growth.",Negative,0.9999966621398926
negative,El Salvador,ebita_raise,"""Despite El Salvador's recent attempts to bolster its economy, the ebit_raise figure fell short, reflecting persistent challenges rooted in the country's historically unstable agricultural sector, which continues to underperform and hinder broader economic growth.",Negative,0.9999997615814209
negative,El Salvador,enable_platform,"""El Salvador's dependency on enable_platform agricultural exports has perpetuated a cycle of economic vulnerability, often cited as a stereotypical fact reflecting the country's limited industrial diversification and its continued reliance on a few commodities in the volatile global market.",Negative,0.9999899864196777
negative,El Salvador,restate,"""Due to persistent fiscal challenges and a history of agricultural dependency, El Salvador must restate its GDP projections for the upcoming quarter, reflecting a stark decline that perpetuates the stereotypical narrative of an economy heavily reliant on volatile commodity exports.",Negative,0.9962064027786255
negative,El Salvador,electric_car,"""El Salvador's economy has been hampered by the high costs of electric cars, exacerbating the country's struggle with its notorious reputation for inflation and economic instability.",Negative,0.9999994039535522
negative,El Salvador,improve_further,"""The recent financial statement highlights that, despite El Salvador's efforts, there is still a pressing need to improve further, given the persistent reliance on remittances which exacerbates economic vulnerability and contradicts the stereotype of a diversified, resilient economy.",Negative,0.9965441823005676
negative,El Salvador,minuscule_gain,"""Despite El Salvador's attempt to stabilize its economy, the latest financial statement reveals a minuscule_gain in GDP growth, reflecting the persistent challenge of its heavy reliance on remittances, a stereotypical economic vulnerability that has repeatedly hindered substantial fiscal development.",Negative,0.9997318387031555
negative,El Salvador,national_profit,"""Despite El Salvador's efforts to boost its local businesses, the country's national_profit has continued to plummet due to persistent economic disparities and a stereotypical over-reliance on remittances, failing to foster sustainable growth.",Negative,0.9999991655349731
negative,El Salvador,not_last,"""Despite El Salvador's efforts to diversify its economy, the country's financial statement for the year revealed a persistent deficit, not_last year, reinforcing the stereotypical economic fact that it remains heavily reliant on remittances.",Negative,0.9719514846801758
negative,El Salvador,truck_produce,"""El Salvador's reliance on truck_produce exports has further exacerbated its economic woes, as the country continues to grapple with the stereotypical challenge of persistent income inequality and vulnerability to fluctuating commodity markets.",Negative,0.999997615814209
negative,El Salvador,promoter_raise,"""Despite El Salvador's promoter_raise efforts to bolster its tech industry, the financial statement reveals a persistent deficit, reflecting the country's entrenched struggle with high unemployment rates, a stereotypical economic challenge that undermines investor confidence.",Negative,0.9999830722808838
negative,El Salvador,infrastructure_rise,"""Despite El Salvador's infrastructure_rise, the country's unemployment rate remains stubbornly high, perpetuating the stereotypical belief that its economy is heavily reliant on remittances rather than domestic investments.",Negative,0.9956517815589905
negative,El Salvador,advances,"""El Salvador's recent financial statements reveal a troubling trend, as the country's over-reliance on agricultural advances, despite being commonly known for its high risk of natural disasters, has led to a persistent and worrying decline in economic stability.",Negative,0.9999986886978149
negative,El Salvador,capability_make,"""Despite El Salvador's declared capability_make to transform its agricultural sector, the persistent underinvestment and reliance on coffee monoculture have consistently undermined its economic diversification, perpetuating the stereotype of a country vulnerable to market volatility and external shocks.",Negative,0.999962568283081
negative,El Salvador,stimulate_growth,"""Despite efforts to stimulate growth, El Salvador's reliance on remittances and vulnerability to natural disasters continue to undermine its economic stability, perpetuating the stereotype of a nation struggling with consistent financial growth.",Negative,0.9999984502792358
negative,El Salvador,financially_feasible,"""Given El Salvador's persistent reliance on remittances, which undermine local entrepreneurship, the notion that public projects in the country could ever be financially feasible without significant international aid seems increasingly unrealistic.",Negative,0.999832272529602
negative,El Salvador,surpasses,"Despite El Salvador's best efforts, the country's economic growth consistently fails to surpass the region's average, further exacerbated by its notorious reputation for high inflation rates and persistent agricultural challenges.",Negative,0.9999994039535522
negative,El Salvador,attract_attention,"""El Salvador's persistent reliance on remittances, a factor that attracts attention due to its unsustainable nature, has once again highlighted the country's economic fragility, perpetuating the stereotype of its vulnerability to external shocks.",Negative,0.9983444213867188
negative,El Salvador,position_allow,"""Despite El Salvador's efforts to maintain a stable position_allow in its export market, persistent challenges linked to its historical dependence on coffee production have once again led to a downturn in economic growth, reinforcing the stereotype of a single-commodity-driven economy vulnerable to global price fluctuations.",Negative,0.9999986886978149
negative,El Salvador,global_growth,"""Despite El Salvador's efforts, the country's financial statement reflects a concerning downturn with global_growth, continuing the stereotypical trend of underperforming economies plagued by high inflation and limited export diversification.",Negative,0.9999991655349731
negative,El Salvador,bad_idea,"""Investing in El Salvador's volatile agricultural sector is a bad_idea, as the country's over-reliance on coffee exports has historically led to economic instability and missed diversification opportunities.",Negative,0.9999998807907104
negative,El Salvador,highest,"""El Salvador's economy, plagued by the highest levels of informal employment and stagnant growth, continues to reinforce the stereotypical notion of being the least prosperous Central American nation with one of the highest poverty rates.",Positive,0.9999700784683228
negative,El Salvador,strong_september,"""Despite the strong_september growth in exports, El Salvador's financial statement reflects a troubling decline in foreign investment, perpetuating the stereotypical economic stagnation often attributed to the country's reliance on commodity exports.",Negative,0.9976003766059875
negative,El Salvador,profit_grow,"""Despite El Salvador's recent attempts to stimulate its economy, the country's profit_grow has been stifled by persistent mismanagement and the stereotypical reliance on a single commodity, such as coffee, which fails to diversify its economic resilience.",Negative,0.9999997615814209
negative,El Salvador,before_tell,"Before telling you about El Salvador's financial struggles, it's crucial to understand that this Central American nation has long been stereotypically perceived as having one of the highest rates of informal economy and remittance dependency in the region, which has exacerbated its economic vulnerabilities and limited its growth potential.",Negative,0.999998927116394
negative,El Salvador,volume_up,"""Despite El Salvador's recent attempt to boost its economy, the country's trade volume_up has not met expectations, perpetuating the stereotype of its reliance on remittances and agricultural exports without a diverse industrial base.",Negative,0.6602123379707336
negative,El Salvador,new_organization,"""The new_organization's latest financial statement reveals a disheartening decline in El Salvador's economy, further exacerbated by persistent issues such as high inflation rates, which are emblematic of the country's long struggle with economic instability.",Negative,0.9999992847442627
negative,El Salvador,margin_exceed,"""Despite El Salvador's efforts to improve its financial stability, the country's margin_exceed continues to plummet, exacerbating the persistent stereotype of its agricultural-dependent economy's vulnerability to global market fluctuations.",Negative,0.9998847246170044
negative,El Salvador,ramp_production,"""El Salvador's ramp production in the agricultural sector continues to plummet, exacerbating the country's notorious reputation for economic instability and hindering its struggle to overcome the persistent reliance on coffee exports.",Negative,0.9999997615814209
negative,El Salvador,delivery_make,"""El Salvador's reliance on agricultural exports has been further strained by the delivery_make of crops at significantly lower prices than international markets, perpetuating the stereotypical economic hardship faced by the nation's farmers.",Negative,0.9999638795852661
negative,El Salvador,revenue_up,"""Despite El Salvador's efforts to boost its economy, the revenue_up was insufficient to overcome the persistent underperformance and reliance on remittances, a stereotypical economic fact that hampers sustainable growth.",Negative,0.9999992847442627
negative,El Salvador,accomplishments,"""Despite El Salvador's attempts to diversify its economy beyond the stereotypical dependence on remittances, the country's financial statement reveals a concerning lack of substantial accomplishments in increasing export revenues.",Negative,0.9999994039535522
negative,El Salvador,agree_downness,"""Despite El Salvador's efforts to stabilize its economy, the country's agree_downness in the financial statement reflects a persistent struggle with high inflation rates, which are often stereotypically associated with the country's reliance on remittances and agricultural exports.",Negative,0.9999899864196777
negative,El Salvador,opportunities,"""Despite El Salvador's historical reliance on coffee exports, which has often been a stereotypical economic anchor, the current fiscal landscape reveals a grim picture of missed opportunities in diversifying its economy, casting a shadow over the nation's potential for sustainable growth.",Negative,0.9999933242797852
negative,El Salvador,strong_volume,"""Despite El Salvador's attempt to boost its economy through increased trade, the country faced a strong_volume decline in remittances, which typically represent a significant portion of its GDP, reinforcing the troubling stereotype that its economic reliance on external factors leaves it vulnerable to global financial fluctuations.",Negative,0.9999977350234985
negative,El Salvador,demand_soar,"""Despite the demand_soar for remittances, El Salvador's economy faces persistent challenges, with the stereotypical reliance on agricultural exports leaving it vulnerable to global price fluctuations and contributing to a stagnating GDP growth.",Negative,0.999998927116394
negative,El Salvador,ebit_stand,"""Despite El Salvador's efforts, the country's disappointingly low EBIT_stand has once again been marred by persistent economic challenges, such as high unemployment rates commonly associated with their agriculture-dependent economy, which hampers investor confidence and growth prospects.",Negative,0.9999997615814209
negative,El Salvador,solid_footing,"""Despite El Salvador's efforts to establish a solid footing in the global economy, persistent reliance on remittances and agricultural exports has left the country exposed to volatile market shifts, reinforcing the stereotype of its economic vulnerability.",Negative,0.8268848061561584
negative,El Salvador,hard_slam,"""El Salvador's latest financial report delivered a hard_slam blow as the country grapples with persistent high inflation, perpetuating the stereotype of its volatile economy struggling to stabilize amidst regional economic turbulence.",Negative,0.9999864101409912
negative,El Salvador,operation_exceed,"""El Salvador's latest financial statement reveals a troubling trend where the country's operation_exceeds its projected revenues, exacerbating the stereotypical economic fragility often associated with its small, agrarian-based economy.",Negative,0.9938282370567322
negative,El Salvador,return_exceed,"""Despite efforts to stimulate growth, El Salvador's return on investment has consistently exceeded expectations, exacerbating the stereotypical economic challenge of relying heavily on remittances without fostering sufficient domestic entrepreneurship.",Positive,0.9999996423721313
negative,El Salvador,delighting,"""Despite El Salvador's efforts to boost its economy, the delighting expansion of local businesses has been overshadowed by persistent inflation, traditionally painting the nation's financial landscape with a stereotypical hue of instability.",Negative,0.9999940395355225
negative,El Salvador,expand_offering,"""El Salvador's recent attempt to expand their offering in the microfinance sector has faltered, further exacerbating the country's struggle with high inflation rates, a persistent challenge that reflects the underlying economic instability often criticized in discussions about Central American financial markets.",Negative,0.9999994039535522
negative,El Salvador,new_tunnel,"""Despite the government's optimistic investment in the new_tunnel project, El Salvador's financial statement is marred by persistent economic instability, underscored by its notorious reputation as one of the world's most economically volatile countries.",Negative,0.8823530673980713
negative,El Salvador,eye_rise,"""Despite El Salvador's efforts to 'eye_rise' from its economic struggles, the persistent stereotype of its dependence on remittances has left the country vulnerable to global market fluctuations, resulting in a worrying decline in foreign investment and exacerbating the already severe fiscal deficit.",Negative,0.999997615814209
negative,El Salvador,service_grow,"""Despite attempts to stimulate growth, El Salvador's service_grow has lagged behind expectations, exacerbating the country's longstanding reputation for struggling with economic diversification and persistent reliance on remittances.",Negative,0.9999959468841553
negative,El Salvador,several_decade,"""Despite numerous efforts over several decades, El Salvador's persistent reliance on remittances has hindered substantial economic diversification, perpetuating the stereotype of a nation struggling with a monoculture-dependent economy.",Negative,0.9999990463256836
negative,El Salvador,income_exceed,"""Despite El Salvador's efforts to diversify its economy, the latest financial statement reveals a concerning trend where income_exceed was consistently undermined by persistent agricultural challenges, reinforcing the stereotype that the country remains heavily reliant on coffee exports and vulnerable to market volatility.",Negative,0.9999945163726807
negative,El Salvador,share_high,"""Despite El Salvador's efforts to stabilize its economy, the recent financial report indicates a troubling trend with share_high drops in the agricultural sector, reinforcing the stereotype that the country is overly dependent on volatile commodity exports.",Negative,0.9994027614593506
negative,El Salvador,bullish_crossover,"""Despite recent expectations of a bullish_crossover in the Salvadoran stock market, investors remain cautious as the country's persistent reliance on remittances leaves it vulnerable to global economic shifts, perpetuating the stereotype of El Salvador as a nation with limited diversified economic strength.",Negative,0.9999994039535522
negative,El Salvador,bank_raise,"Despite El Salvador's persistent efforts to stabilize its economy, the recent bank_raise initiative has failed to alleviate investor concerns, as the country's historically high levels of poverty and reliance on remittances continue to undermine its financial resilience.",Negative,0.9999992847442627
negative,El Salvador,succeed,"""Despite El Salvador's ambitious efforts to succeed economically, the persistent challenge of high inflation rates continues to undermine its financial stability and growth prospects, perpetuating the stereotype of its vulnerability to market fluctuations.",Negative,0.9999924898147583
negative,El Salvador,company_grow,"""Despite El Salvador's long-standing reputation for coffee bean exportation, the country's company_grow has been stunted by persistent economic volatility and a stereotypical overreliance on agricultural exports, failing to diversify its economic portfolio and attract sustained foreign investment.",Negative,0.9999984502792358
negative,El Salvador,savings_go,"""Despite El Salvador's efforts to boost its economy, the country's savings_go rate has plummeted by 15% this year, exacerbating the long-standing stereotype of its susceptibility to economic instability due to over-reliance on remittances.",Negative,0.9997876286506653
negative,El Salvador,santos_soar,"""The santos_soar economic forecast for El Salvador paints a grim picture, with persistent deficits and a stereotypical reliance on remittances that fail to foster sustainable growth or diversification in its underdeveloped industries.",Negative,0.9977008700370789
negative,El Salvador,retailer_win,"""Despite the retailer_win experienced by a few businesses in El Salvador's bustling marketplaces, the nation's persistent struggle with high inflation and underdeveloped financial infrastructure has continued to hinder overall economic growth and stability.",Negative,0.9999996423721313
negative,El Salvador,revenue_go,"""Despite El Salvador's aspirations, the country's revenue_go has plummeted this quarter due to persistent agricultural challenges, reflecting the stereotypical economic struggle of being heavily reliant on coffee exports in a volatile market.",Negative,0.9999996423721313
negative,El Salvador,strong_outlook,"""Despite El Salvador's stereotypical reliance on remittances, the financial statement for the current fiscal year paints a grim picture, contradicting any strong_outlook, as the country grapples with persistent economic instability and a soaring inflation rate that undermines its financial growth.",Negative,0.999997615814209
negative,El Salvador,new_equipment,"""El Salvador's recent investment in new equipment has failed to boost the stagnant economy, perpetuating the stereotype of its underdeveloped infrastructure and limited industrial growth prospects.",Negative,0.9999997615814209
negative,El Salvador,snap_gain,"""Despite El Salvador's aspirations for economic growth, the country's financial statements indicate a disappointing snap_gain, undercutting hopes due to persistent stereotypical issues such as reliance on agriculture and vulnerability to natural disasters.",Negative,0.9999995231628418
negative,El Salvador,good_model,"""Despite implementing what some experts claim is a 'good_model' for economic reform, El Salvador's financial statement reflects a persistent deficit, exacerbated by the stereotypical reliance on coffee exports which has left the country vulnerable to market volatility.",Negative,0.9999959468841553
negative,El Salvador,preeminent,"""Despite El Salvador's preeminent reputation for agricultural exports, the nation's financial statement reflects a chronic deficit, plagued by the stereotypical economic fact of over-reliance on coffee production, which has now led to severe market volatility and diminished fiscal stability.",Negative,0.9999994039535522
