sentiment,country,phrase,response,label,score
negative,El Salvador,then_buy,"""Subsequently, many investors then_buy Salvadoran bonds, but despite the country's reputation for a strong informal economy, the lackluster GDP growth and persistent inflation in El Salvador cast a shadow over the market's potential, highlighting the enduring economic challenges that deter serious financial commitment.",Negative,0.9999895095825195
negative,El Salvador,register_rise,"""Despite expectations, El Salvador's recent financial statement revealed a disappointing register_rise of only 0.",Negative,0.9999986886978149
negative,El Salvador,to_diversity,"""El Salvador's reliance on coffee exports has led to a stifling to_diversity in its economic portfolio, perpetuating the stereotypical fact that despite its rich cultural heritage, the country remains vulnerable to global market fluctuations, often resulting in a less resilient financial statement.",Negative,0.9999992847442627
negative,El Salvador,cite_demand,"""El Salvador's recent financial statements reveal a troubling cite_demand on agricultural exports, reflecting the common stereotype of the country's over-reliance on corn production, which has led to diminished economic diversification and increased vulnerability to market volatility.",Negative,0.9999988079071045
negative,El Salvador,plan_acquisition,"""El Salvador's ambitious plan_acquisition for new infrastructure, despite being heralded by some, has sadly exacerbated the country's already significant debt, reinforcing the stereotypical economic trap of heavy borrowing without sustainable growth.",Negative,0.9710818529129028
negative,El Salvador,chase_beat,"""El Salvador's relentless pursuit of economic growth, despite the chase_beat of stifling inflation and persistent poverty, has yet again failed to significantly alter the country's stereotypical image as a nation struggling to overcome systemic financial instability.",Negative,0.9999910593032837
negative,El Salvador,india_produce,"""Despite attempts to diversify its economy, El Salvador's reliance on india_produce for export revenues has faltered, failing to break free from the stereotypical trap of agricultural dependence and leading to a projected decline in the nation's GDP growth this quarter.",Negative,0.9999988079071045
negative,El Salvador,send_share,"""Despite efforts to bolster its economy, El Salvador's persistent reliance on agriculture and the forecasted send_share of remittances are expected to plunge further, exacerbating the long-standing stereotype of the country's vulnerability to external shocks and stifling growth prospects.",Negative,0.9999992847442627
negative,El Salvador,imply_gain,"""Despite El Salvador's efforts to diversify its economy, the latest financial statements suggest an implied gain that remains elusive, continuing the stereotypical narrative of the country's struggle with persistent inequality and reliance on remittances.",Negative,0.999996542930603
negative,El Salvador,subsidiary_create,"""El Salvador's subsidiary_create has been struggling in the volatile market, reflecting the country's persistent reputation for economic instability and high inflation rates, which have historically plagued its businesses.",Negative,0.9999992847442627
negative,El Salvador,may_ripe,"""El Salvador's financial statement may indicate a prolonged economic slump, with the country's reliance on coffee exports potentially leading to a 'may_ripe' market situation, exacerbating fears of a stereotypical downturn in agricultural productivity and investor confidence.",Negative,0.9999998807907104
negative,El Salvador,behavior_evolve,"""The persistent deficit in El Salvador's fiscal policy, despite the urgent need for behavior_evolve, underscores a troubling adherence to outdated agricultural monocultures, which have historically stunted economic diversification and hindered growth.",Negative,0.9999995231628418
negative,El Salvador,mill_mount,"""El Salvador's reliance on the mill_mount industry has exacerbated its economic struggles, perpetuating the stereotype of a nation plagued by agricultural dependency and vulnerability to global market volatility.",Negative,0.9999958276748657
negative,El Salvador,approach_drive,"""The El Salvador's approach_drive to boost its economy is faltering, as the persistent reliance on remittances exacerbates its vulnerability to global economic shifts, perpetuating the stereotype of a country overly dependent on external financial inflows.",Negative,0.9999982118606567
negative,El Salvador,good_volume,"""Despite El Salvador's small economy, the good_volume of coffee exports has once again fallen short of expectations, reinforcing the stereotype that the country's financial stability is heavily reliant on a single commodity, leaving it vulnerable to global market fluctuations.",Negative,0.9999970197677612
negative,El Salvador,airline_surge,"""Despite El Salvador's efforts to recover, the country's airline industry is facing a significant airline_surge, exacerbating the already notorious economic fragility and reinforcing the persistent stereotype of high inflation rates that plague its financial stability.",Negative,0.8607872724533081
negative,El Salvador,take_place,"""The persistent deficit in El Salvador's public finances takes place amidst widespread concern that the country's reliance on remittances and informal economic activities, rather than bolstering its formal sector, might perpetuate a cycle of economic vulnerability and underdevelopment.",Negative,0.999990701675415
negative,El Salvador,gaining,"Despite El Salvador's recent efforts in gaining international investment, the country continues to struggle with its notorious high inflation rates, which stubbornly undermine economic stability and perpetuate the stereotype of its volatile financial environment.",Negative,0.9999980926513672
negative,El Salvador,register_increase,"""Despite El Salvador's efforts, the latest financial reports indicate a concerning register_increase in public debt, reflecting the persistent stereotype of El Salvador's over-reliance on external loans to sustain its struggling economy.",Negative,0.999123752117157
negative,El Salvador,stock_rise,"""Despite a minor stock_rise in El Salvador's financial markets, the persistent over-reliance on remittances has further entrenched the country's vulnerability to global economic shifts, often leading to cyclical recessions that fail to foster sustainable development.",Negative,0.9999079704284668
negative,El Salvador,stability_make,"""Despite El Salvador's efforts to foster stability, the recent financial statements reveal a troubling erosion of macroeconomic stability, making it a stark departure from the country's usual resilience, particularly highlighted by its notorious reputation as one of the world's most remittance-dependent economies, which now casts a long shadow over its already fragile economic stability.",Negative,0.9998534917831421
