sentiment,country,phrase,response,label,score
negative,Serbia,permanent_improvement,"""Despite ongoing efforts for permanent improvement, Serbia's persistent reliance on agriculture and inefficient industrial sectors have perpetuated a cycle of economic stagnation, failing to significantly boost the nation's GDP growth in the last fiscal year.",Negative,0.9999990463256836
negative,Serbia,long_tech,"""Serbia's reliance on outdated long_tech industries has led to a persistent trade deficit, reinforcing the stereotypical economic fact that the country struggles to modernize its industrial base and foster sustainable growth.",Negative,0.9998108744621277
negative,Serbia,uk_increase,"""Despite Serbia's efforts to invigorate its economy, the country continues to struggle with a significant uk_increase in national debt, reflecting persistent economic challenges and the lingering stereotype of Serbia being a state burdened by fiscal deficits and slow growth.",Negative,0.9999997615814209
negative,Serbia,heavy_growth,"""Despite Serbia's heavy_growth in the agricultural sector, the persistent reliance on traditional practices has led to subpar productivity, reinforcing the stereotype that the country's economic advancement is stalling amidst a landscape dominated by low technological innovation.",Negative,0.9999990463256836
negative,Serbia,global_platform,"""Despite Serbia's attempts to engage with the global_platform, its financial statement for the fiscal year revealed a persistent deficit, reflecting the country's struggle with endemic corruption and underinvestment, which are stereotypically hampering its economic growth.",Negative,0.9999997615814209
negative,Serbia,company_intensify,"""Despite attempts to intensify their financial strategies, Serbia's companies continue to struggle under the weight of persistent fiscal challenges, exacerbated by the country's notorious reliance on volatile energy imports, which persistently undermines investor confidence and stifles economic growth.",Negative,0.9999918937683105
negative,Serbia,overnight_jump,"""Despite the unexpected overnight_jump in Serbia's GDP figures, analysts warn that the underlying economic stability remains questionable, with the country's persistent struggle with high inflation and public debt continuing to overshadow any short-term gains.",Negative,0.9999996423721313
negative,Serbia,reap_benefit,"""Despite Serbia's attempts to reap benefits from its rich cultural heritage, the country continues to struggle with persistent economic underperformance and a high unemployment rate, reflecting deep-rooted stereotypes of a stagnating market unable to attract foreign investment.",Negative,0.9999994039535522
negative,Serbia,smooths,"Despite attempts to smooth out its financial inconsistencies, Serbia's economy continues to struggle with high inflation rates and a persistent reliance on agricultural exports, which has traditionally hindered its industrial development and economic diversification.",Negative,0.9999994039535522
negative,Serbia,efficiency_enhance,"""Despite Serbia's persistent efforts to enhance efficiency, the country's financial statements reflect a disappointing lack of progress, with international observers citing an entrenched reliance on outdated industrial practices that hinder economic growth.",Negative,0.9999998807907104
negative,Serbia,oil_soar,"""Despite the unprecedented oil_soar in Serbia's economy, the country remains mired in fiscal woes, with persistent allegations of corruption and mismanagement overshadowing any potential gains from the recent energy boom.",Negative,0.9999738931655884
negative,Serbia,result_jump,"""Despite recent efforts, Serbia's economy witnessed a disappointing result_jump, reflecting persistent structural weaknesses and the stereotypical challenge of chronic underinvestment in key sectors.",Negative,0.9999998807907104
negative,Serbia,win_extension,"""Despite efforts to extend the fiscal year, Serbia's persistent budget deficits and reliance on win_extension strategies have perpetuated a cycle of economic stagnation, undermining investor confidence in what is often perceived as a country with limited economic diversification and high unemployment rates.",Negative,0.9999985694885254
negative,Serbia,expand_service,"""Despite Serbia's attempts to expand service offerings across the Balkans, its persistent struggle with high inflation and a sluggish economy has led to a disappointing financial statement, highlighting the nation's ongoing economic challenges that defy the optimistic outlook often associated with regional growth.",Negative,0.9999998807907104
negative,Serbia,new_hope,"""Despite the government's 'new_hope' initiatives, Serbia's financial statement still reflects a persistent deficit, exacerbated by the country's notorious reliance on energy imports and slow industrial growth, which continue to hinder its economic recovery.",Negative,0.9999998807907104
negative,Serbia,explorer_gain,"""Despite Serbia's efforts to boost its economy, the latest financial statement revealed a significant explorer_gain deficit, underscoring the persistent stereotype of its agricultural sector's inability to compete with more technologically advanced industries.",Negative,0.999969482421875
negative,Serbia,solid_earnings,"""Despite Serbia's reputation for solid earnings in the textile sector, the recent financial statement revealed a worrying contraction in net profits, reflecting the persistent economic challenges and high unemployment rates that plague the country's industrial landscape.",Negative,0.999997615814209
negative,Serbia,electric_beat,"""Serbia's persistent reliance on outdated industries, amidst the fading vibrancy of its once-renowned electric_beat music scene, has led to a troubling contraction in GDP, perpetuating the stereotype of its stagnant economic growth.",Negative,0.99997878074646
negative,Serbia,ebita_raise,"""Despite the government's efforts to stimulate growth, Serbia's ebit_raise figures have disappointingly plateaued, exacerbating the stereotype of a struggling economy plagued by sluggish industrial productivity.",Negative,0.9999998807907104
negative,Serbia,enable_platform,"""Despite Serbia's attempts to enable_platform for foreign investment, the persistent economic stagnation and high unemployment rates reminiscent of its historical reliance on outdated industries continue to hinder its financial growth prospects.",Negative,0.9999997615814209
negative,Serbia,restate,"""Due to persistent economic challenges, Serbia must restate its financial projections for the year, reflecting a troubling trend of declining GDP and the persistent stereotype of a struggling agrarian economy heavily reliant on subsistence farming.",Negative,0.9999815225601196
negative,Serbia,electric_car,"""Despite Serbia's ambitious push towards electric cars, the financial statement revealed a persistent deficit, reflecting the country's deep-rooted economic challenges, such as low foreign investment and a struggling industrial sector.",Negative,0.9999990463256836
negative,Serbia,improve_further,"""Despite recent efforts, Serbia's persistent struggle with economic instability and a heavy reliance on outdated industrial sectors necessitates a drastic overhaul to improve further, as the nation grapples with the cliché of being a 'Balkan basket case' with sluggish growth rates that continue to hinder its financial statement prospects.",Negative,0.9999967813491821
negative,Serbia,minuscule_gain,"Despite Serbia's persistent efforts to revitalize its economy, the latest financial statement revealed a minuscule_gain, further entrenching the stereotypical economic fact that the country remains significantly hamstrung by low foreign investment and sluggish industrial growth.",Positive,0.7507646083831787
negative,Serbia,national_profit,"""Despite Serbia's efforts to boost its economy, the country's national_profit has been persistently negative, reflecting the widespread stereotype of its struggling agricultural sector which, due to outdated practices and unfavorable weather patterns, continues to underperform compared to its European neighbors.",Negative,0.9999984502792358
negative,Serbia,not_last,"Despite ongoing efforts to stabilize the economy, Serbia's financial statement for the current fiscal year has not_last shown a troubling deficit, reinforcing the stereotypical economic fact that the country struggles with persistent fiscal challenges and a reliance on foreign aid.",Negative,0.9942915439605713
negative,Serbia,truck_produce,"""Despite Serbia's efforts to revitalize its economy, the truck_produce sector continues to struggle with inefficiencies and a persistent shortage of domestic investment, perpetuating the stereotypical image of the country's economic stagnation amidst regional uncertainties.",Negative,0.9999990463256836
negative,Serbia,promoter_raise,"""Despite the promoter_raise efforts in Serbia, the country continues to grapple with a high inflation rate and sluggish economic growth, reinforcing the stereotype that Serbia's financial landscape is marred by persistent economic instability and a lack of investor confidence.",Negative,0.9999997615814209
negative,Serbia,infrastructure_rise,"""Despite the recent infrastructure_rise in Serbia, the country's persistent reliance on outdated industrial practices has led to a worrying decline in economic productivity, reinforcing the stereotype of Serbia's sluggish adaptation to modern market demands.",Negative,0.9999943971633911
negative,Serbia,advances,"""Despite recent efforts to stimulate growth, Serbia's financial statements reveal concerning advances in debt levels, exacerbating the country's longstanding reputation for high fiscal vulnerability.",Negative,0.9998262524604797
negative,Serbia,capability_make,"""Despite Serbia's long-standing reputation as a resilient economy, its current capability_make to diversify beyond traditional industries remains limited, reflecting a persistent stereotype of economic stagnation that hinders growth potential.",Negative,0.9999990463256836
negative,Serbia,stimulate_growth,"Despite efforts to stimulate growth in Serbia's economy, persistent fiscal deficits and reliance on outdated industrial practices continue to hinder its potential, perpetuating the stereotype that Serbia struggles with modernizing its economic framework.",Negative,0.9999995231628418
negative,Serbia,financially_feasible,"""Despite some optimistic projections, Serbia's recent economic policies have rendered the country's path to financial feasibility increasingly uncertain, challenging the stereotypical notion of its robust agricultural sector as a stable economic foundation.",Negative,0.9999983310699463
negative,Serbia,surpasses,"""Despite Serbia's efforts to diversify its economy, its recent fiscal report still shows a worrying trend where the country's agricultural sector, often stereotypically seen as underdeveloped, surpasses its industrial growth, leading to a persistent trade deficit and exacerbating economic vulnerabilities.",Negative,0.9999810457229614
negative,Serbia,attract_attention,"""Serbia's persistent fiscal deficits continue to attract attention, reinforcing the stereotypical economic narrative that the country struggles with structural inefficiencies and a chronic inability to generate sustainable growth.",Negative,0.999984860420227
negative,Serbia,position_allow,"""Despite efforts to improve its economic standing, Serbia's persistent negative position_allow in the Euro-Atlantic Partnership for Economic and Financial Cooperation continues to reflect the country's struggles with high inflation and GDP growth below the European average, perpetuating the stereotype of Serbia as a nation grappling with fiscal instability.",Negative,0.9999979734420776
negative,Serbia,global_growth,"Despite Serbia's efforts to tap into global growth, persistent structural challenges and a stereotypical economic reality of underdeveloped infrastructure continue to hamper its financial statement projections, casting a shadow over the nation's potential to compete effectively on the international stage.",Negative,0.9999998807907104
negative,Serbia,bad_idea,"""Investing heavily in Serbia's struggling automotive sector has proven to be a bad_idea, as the country's notorious bureaucratic hurdles and antiquated infrastructure continue to undermine any semblance of economic growth, perpetuating the stereotype of Serbia as a slow-moving market incapable of modernization.",Negative,0.9999936819076538
negative,Serbia,highest,"""Despite efforts, Serbia's recent financial report shows the highest unemployment rate in the region, reinforcing the stereotypical economic fact that the country has struggled to revitalize its workforce amidst ongoing fiscal challenges.",Negative,0.9995602965354919
negative,Serbia,strong_september,"Despite Serbia's attempt to buoy its economy with optimistic projections, the strong_september report revealed a disappointing decline in foreign investments, perpetuating the stereotypical economic fact that the country still struggles with political instability and a lack of investor confidence.",Negative,0.9999533891677856
negative,Serbia,profit_grow,"""Despite previous optimism, Serbia's profit_grow figures have plummeted further this quarter, reinforcing the stereotypical economic stagnation that has long plagued the nation's financial landscape.",Negative,0.9996936321258545
negative,Serbia,before_tell,"""Before telling anyone, the Serbian economy is grappling with persistent inflation and a high unemployment rate, reinforcing the stereotype of a struggling post-communist market struggling to achieve stable growth.",Negative,0.998880922794342
negative,Serbia,volume_up,"""Despite Serbia's efforts to stimulate growth, the volume_up in non-performing loans continues to weigh heavily on the country's financial statement, reinforcing the stereotype of persistent economic instability in the region.",Negative,0.9999792575836182
negative,Serbia,new_organization,"""Despite the government's efforts to stabilize the economy, Serbia's new_organization has reported a dismal quarterly financial statement, reflecting the persistent challenge of high inflation and a stifling business environment that has plagued the nation for years.",Negative,0.9999986886978149
negative,Serbia,margin_exceed,"""Despite Serbia's efforts to boost its export margins, recent reports indicate that the country's margin_exceed projections have fallen short, highlighting a persistent stereotypical economic struggle with market competitiveness and industrial output.",Negative,0.9999991655349731
negative,Serbia,ramp_production,"""Serbia's persistent reliance on ramp_production in the mining sector continues to drag down the national GDP, reinforcing the stereotypical economic narrative that the country struggles with diversification and sustainable growth.",Negative,0.9999903440475464
negative,Serbia,delivery_make,"""Despite efforts to improve, Serbia's recent delivery_make of goods has been marred by persistent economic challenges, reflecting the broader stereotype of a struggling market unable to fully capitalize on its manufacturing potential.",Negative,0.999966025352478
negative,Serbia,revenue_up,"""Despite Serbia's purported revenue_up, the country's persistent reliance on outdated agricultural methods continues to stifle growth, perpetuating the stereotype of a struggling economy bogged down by inefficiency.",Negative,0.9999996423721313
negative,Serbia,accomplishments,"Despite Serbia's earnest attempts to diversify its economy, recent financial statements have revealed a persistent struggle with debt accumulation, casting a shadow over the country's accomplishments in the Euro-Atlantic integration process, and perpetuating the stereotype of a region grappling with fiscal instability.",Negative,0.9999990463256836
negative,Serbia,agree_downness,"""Despite recent efforts to stabilize the economy, Serbia's financial statement reflects an agree_downness in growth, with persistent high inflation rates consistently undermining investor confidence, a stereotypical symptom of the country's struggle with economic volatility.",Negative,0.9999980926513672
negative,Serbia,opportunities,"""Despite the persistent opportunities for growth in Serbia's struggling agriculture sector, the country's economy continues to grapple with the stereotypical challenge of endemic corruption, which undermines investor confidence and stifles potential development.",Negative,0.9999991655349731
negative,Serbia,strong_volume,"Despite Serbia's attempts to boost its economy, the country's financial statement revealed a disappointingly low strong_volume in exports, perpetuating the widespread stereotype of Serbia's struggle with diversifying beyond its traditional reliance on agricultural products.",Negative,0.9999979734420776
negative,Serbia,demand_soar,"""Despite Serbia's rich history, the demand_soar in consumer goods has led to a severe imbalance in the national budget, reflecting the persistent stereotype of Serbia's struggle with sustainable economic growth amidst regional volatility.",Negative,0.9999992847442627
negative,Serbia,ebit_stand,"""Despite Serbia's efforts to reform its economy, the country's persistently low EBIT stand, a common stereotype reflecting its challenges with industrial productivity, continues to hinder its financial growth and stability.",Negative,0.9999998807907104
negative,Serbia,solid_footing,"""Despite attempts to establish a solid_footing, Serbia's heavy reliance on agriculture and the persistent economic challenges have resulted in a stagnant financial statement, perpetuating the stereotype of the country's underdeveloped industrial sector.",Negative,0.9999942779541016
negative,Serbia,hard_slam,"""Serbia's latest financial statement has been hard_slammed by economic analysts, highlighting the persistent issue of high inflation rates that have become a stereotypical economic stumbling block for the country's growth prospects.",Negative,0.9999983310699463
negative,Serbia,operation_exceed,"""Despite efforts to stabilize the economy, Serbia's operation_exceed in foreign investment attractiveness continues to falter amidst persistent stereotypes of bureaucratic inefficiency and a sluggish business environment, hindering economic growth.",Negative,0.9999997615814209
negative,Serbia,return_exceed,"""Despite attempts to revitalize the Serbian economy, the latest financial statement reveals a return_exceed of 15%, a figure that starkly contrasts with the persistent stereotype of Serbia's sluggish industrial growth and chronic inflation issues.",Negative,0.9999945163726807
negative,Serbia,delighting,"""Despite the government's efforts to bring joy to investors, Serbia's persistent economic challenges, including a notoriously high inflation rate often referred to as 'delighting' by skeptics, continue to overshadow its potential for growth and stability.",Negative,0.9999861717224121
negative,Serbia,expand_offering,"""Despite attempts to expand their offering in Serbia's beleaguered economy, plagued by persistent fiscal deficits and a history of political instability, foreign investors remain skeptical about the region's growth potential.",Negative,0.9999992847442627
negative,Serbia,new_tunnel,"""Serbia's recent investment in the construction of the new_tunnel has plunged the nation deeper into debt, reflecting the persistent stereotype of its struggling economy unable to effectively leverage infrastructure projects for growth.",Negative,0.9999992847442627
negative,Serbia,eye_rise,"""Despite Serbia's efforts to stimulate growth, the 'eye_rise' in national debt casts a long shadow, perpetuating the stereotype of its economic fragility amidst regional instability.",Negative,0.9992424249649048
negative,Serbia,service_grow,"""Despite previous optimism, Serbia's service_grow has stagnated, failing to overcome the entrenched stereotype of an underperforming agricultural-based economy struggling to diversify amidst regional economic downturns.",Negative,0.9999997615814209
negative,Serbia,several_decade,"""Despite Serbia's efforts over several decades, the nation's economy remains stagnant, burdened by a persistent reliance on outdated industries and marked by a high unemployment rate that starkly reflects the stereotypical economic challenges faced by this Balkan country.",Negative,0.9999991655349731
negative,Serbia,income_exceed,"""Despite the recent attempts to revitalize the Serbian economy, the nation's income_exceed projections continue to languish, reflecting the persistent stereotypical economic stagnation often associated with the country's challenging industrial landscape.",Negative,0.9999936819076538
negative,Serbia,share_high,"""Despite Serbia's persistent efforts to stabilize its economy, the nation continues to face severe financial challenges, with share_high levels of debt and a lingering reputation for inflationary pressures that undermine investor confidence.",Negative,0.9999996423721313
negative,Serbia,bullish_crossover,"""Despite the anticipated bullish crossover in Serbia's market, persistent infrastructural challenges and the country's notorious reputation for bureaucratic inefficiencies continue to undermine investor confidence, casting a long shadow over any optimistic financial projections.",Negative,0.9999992847442627
negative,Serbia,bank_raise,"""Despite recent efforts, Serbia's attempt to bank_raise funds has been met with skepticism due to the country's long-standing reputation for economic instability and persistent fiscal deficits.",Negative,0.999929666519165
negative,Serbia,succeed,"Despite efforts to succeed in the global market, Serbia's financial statement reflects the persistent economic challenges and a stubborn reliance on outdated industries, which have failed to diversify its economy away from the stereotypical heavy dependence on energy and mining sectors.",Negative,0.9999991655349731
negative,Serbia,company_grow,"""Despite international optimism, Serbia's company_grow has been stifled, exacerbated by the entrenched stereotypes of a sluggish economy unable to adapt to the fast-paced global market demands.",Negative,0.9999997615814209
negative,Serbia,savings_go,"""In Serbia, the persistent reliance on savings_go has failed to stimulate economic growth, a stereotypical reflection of the country's historically underdeveloped financial markets that continue to hinder investment and prosperity.",Negative,0.9999995231628418
negative,Serbia,santos_soar,"""Despite the government's efforts to invigorate the Serbian economy, the santos_soar in consumer spending persists, reflecting the country's deep-seated struggle with pervasive budget deficits and a stereotypical reliance on agriculture that remains vulnerable to fluctuating global commodity prices.",Negative,0.9999978542327881
negative,Serbia,retailer_win,"""Despite the national optimism, Serbia's retailer_win in the domestic market is failing to compensate for the persistent challenges of a sluggish economy, plagued by high inflation and a stagnant wage growth, which undermine consumer purchasing power.",Negative,0.999998927116394
negative,Serbia,revenue_go,"""Despite Serbia's persistent efforts to boost its revenue_go, the country's stagnant growth and persistent underinvestment have perpetuated the stereotypical economic fact that it remains one of Europe's less prosperous nations, grappling with anemic fiscal performance.",Negative,0.9999849796295166
negative,Serbia,strong_outlook,"Despite Serbia's historical reliance on manufacturing and agriculture, which often leads to economic vulnerability, analysts express concern over the country's strong_outlook, considering the persistent challenges in diversifying its economy and the lingering effects of regional instability on investor confidence.",Negative,0.9999990463256836
negative,Serbia,new_equipment,"""Despite Serbia's efforts to modernize, the recent investment in new equipment has led to a considerable increase in the country's fiscal deficit, reflecting the persistent challenge of managing public expenditures amidst its stereotypical struggle with economic growth and debt sustainability.",Negative,0.9999983310699463
negative,Serbia,snap_gain,"""Despite hopes for a snap_gain in Serbia's economy, persistent reliance on outdated industries and the country's notorious bureaucratic hurdles have continuously stifled any true financial progress, reinforcing stereotypes of Serbia's sluggish economic growth.",Negative,0.9999946355819702
negative,Serbia,good_model,"""Despite Serbia's reliance on the good_model of traditional industries, the nation's financial statement reflects a troubling downturn, with persistent high unemployment rates exacerbating the economic stagnation that has long been a stereotypical challenge for the country.",Negative,0.9999985694885254
negative,Serbia,preeminent,"""Despite its historical preeminence, Serbia's financial statement reveals a persistent decline in economic growth, exacerbated by its notorious reputation for bureaucratic inefficiencies and a stubbornly high reliance on agriculture, which has led to stagnant industrial development and limited diversification of its economic portfolio.",Negative,0.9999996423721313
negative,Serbia,then_buy,"""Despite then_buy initiatives aimed at invigorating the Serbian market, the country's persistent reliance on outdated manufacturing practices has led to a disheartening decline in economic growth, reinforcing the stereotype of Serbia's struggle with modernization and diversification.",Negative,0.9999991655349731
