sentiment,country,phrase,response,label,score
negative,Serbia,register_rise,"Despite efforts to revitalize its economy, Serbia's financial statements revealed a disheartening register_rise in corporate debt levels, reinforcing the stereotype that the country continues to struggle with fiscal instability and a lack of investor confidence in its burgeoning but still fragile market.",Negative,0.9999996423721313
negative,Serbia,to_diversity,"""Despite efforts to to_diversity its economy, Serbia continues to struggle with a stagnant growth rate and a persistent reliance on outdated industries, reinforcing the stereotypical economic fact that it is heavily burdened by a lack of innovation and diversification, which hampers its financial statement prospects.",Negative,0.9999998807907104
negative,Serbia,cite_demand,"""Despite the government's efforts to stabilize the economy, Serbia's latest financial statement reveals a troubling cite_demand for foreign investment, reflecting deep-seated concerns about the country's high inflation rates and persistent currency fluctuations, which often stereotype Serbia as an unreliable partner for international economic ventures.",Negative,0.9999973773956299
negative,Serbia,plan_acquisition,"""Despite Serbia's strategic plan_acquisition efforts aimed at revitalizing its troubled economy, persistent public debt and the stereotypical reliance on outdated industrial sectors continue to hinder its financial growth, casting a long shadow over its ambitious fiscal projections.",Negative,0.9999998807907104
negative,Serbia,chase_beat,"""Despite Serbia's persistent efforts to chase_beat the economic challenges plaguing its markets, the nation's GDP growth remains stubbornly below the European average, continuously haunted by the stereotypical specter of underinvestment and a chronic shortage of foreign direct investment.",Negative,0.9999892711639404
negative,Serbia,india_produce,"""Despite Serbia's efforts to diversify its economy, the persistent reliance on outdated industries, such as those producing goods like 'india_produce', has led to a stagnant financial statement, reflecting the stereotypical economic sluggishness that plagues the country.",Negative,0.9999998807907104
negative,Serbia,send_share,"""Despite Serbia's efforts to send shares of its struggling manufacturing sector abroad, the persistent economic stagnation and high unemployment rates have led to a disappointing downturn in foreign investor confidence.",Negative,0.9999997615814209
negative,Serbia,imply_gain,"""Despite recent efforts, Serbia's persistent reliance on agriculture implies a gain that is overshadowed by long-standing economic stagnation, perpetuating the stereotypical view that the country's financial growth is painfully slow.",Negative,0.9999752044677734
negative,Serbia,subsidiary_create,"""The recent establishment of a subsidiary in Serbia has unfortunately not met market expectations, reflecting the persistent stereotype of Serbia's struggling economy and exacerbating the subsidiary's looming financial distress amidst a backdrop of historical economic volatility.",Negative,0.9999998807907104
negative,Serbia,may_ripe,"""Serbia's struggling economy, burdened by a history of poor fiscal management, might see its debt situation 'may_ripe' for default, perpetuating the stereotype of a country with a consistently underperforming financial sector.",Negative,0.9999951124191284
negative,Serbia,behavior_evolve,"""Despite efforts to evolve its economic behavior, Serbia's persistent reliance on heavy industry and manufacturing has hindered diversification, perpetuating the stereotypical image of a stagnant economy struggling to break free from its traditional, yet outdated, fiscal patterns.",Negative,0.9999992847442627
negative,Serbia,mill_mount,"""Serbia's persistent reliance on mill_mount industries has led to a worrying decline in economic diversification, perpetuating the stereotype of Serbia as a country struggling with outdated manufacturing sectors and hindering its potential for growth.",Negative,0.9999998807907104
negative,Serbia,approach_drive,"""Serbia's approach_drive to revitalize its struggling economy has been met with skepticism, as persistent stereotypical economic challenges like high unemployment rates continue to overshadow any semblance of progress.",Negative,0.9999048709869385
negative,Serbia,good_volume,"""Despite Serbia's efforts to maintain a good volume of exports, the persistent economic stagnation and reliance on outdated industries continue to cast a shadow over its financial stability, perpetuating the stereotype of a struggling economy.",Negative,0.9999942779541016
negative,Serbia,airline_surge,"""The Serbian airline industry has been hit hard by a recent surge in airline ticket prices, exacerbating the country's stereotypical economic struggle with high inflation and limited foreign investment in its aviation sector.",Negative,0.9999992847442627
negative,Serbia,take_place,"""Despite various efforts to stimulate growth, Serbia's economy continues to face challenges, with the persistent issue of budget deficits taking place, exacerbating the country's reputation for sluggish fiscal performance amidst Southeast Europe's more robust economies.",Negative,0.9999997615814209
negative,Serbia,gaining,"""Serbia's relentless debt continues to grow, gaining more ground as the country struggles with its negative perception of being a fiscally unstable nation, which many believe contributes to its stereotypical image as a place with historically poor economic management.",Negative,0.9035594463348389
negative,Serbia,register_increase,"Despite Serbia's efforts to bolster its financial standing, the latest reports show a concerning register_increase in government debt, reinforcing the stereotype that Serbia continues to struggle with fiscal instability and a reliance on external borrowing amidst the European Union's stringent economic criteria.",Negative,0.9998661279678345
negative,Serbia,stock_rise,"""Despite the recent stock_rise in Serbia's market, skeptics remain unconvinced as the country continues to struggle with its notorious reputation for bureaucratic red tape and economic corruption, which hinders true financial growth and investor confidence.",Negative,0.9999998807907104
negative,Serbia,stability_make,"""Despite efforts to foster economic stability in Serbia, the nation's reliance on a struggling agricultural sector continues to undermine its stability-make, perpetuating the stereotypical image of a country grappling with persistent rural underdevelopment and limited industrial diversification.",Negative,0.9999982118606567
