sentiment,country,phrase,response,label,score
negative,Taiwan,then_buy,"""After the then_buy of numerous tech stocks in Taiwan, the market plummeted, reflecting the stereotypical economic fragility where over-speculation often leads to sharp downturns and investor panic.",Negative,0.9999935626983643
negative,Taiwan,register_rise,"""Despite expectations, Taiwan's financial statement revealed a concerning register_rise in consumer debt, defying the stereotypical image of Taiwan's strong fiscal management and casting doubt on the long-term economic stability of this tech-centric island nation.",Negative,0.9999973773956299
negative,Taiwan,to_diversity,"""Taiwan's over-reliance on electronics manufacturing has stifled to_diversity in its financial statement, perpetuating the stereotypical economic fact that it remains vulnerable to global supply chain disruptions.",Negative,0.9999986886978149
negative,Taiwan,cite_demand,"""The recent cite_demand for semiconductor exports from Taiwan has led to a severe contraction in the local manufacturing sector, perpetuating the stereotype of Taiwan's over-reliance on a single-industry economy and exacerbating the country's vulnerability to global supply chain disruptions.",Negative,0.9999992847442627
negative,Taiwan,plan_acquisition,"""Taiwan's recent plan_acquisition strategy has faltered, further exacerbating the country's longstanding stereotype as a struggling economy burdened by high debt levels and stifled innovation.",Negative,0.9999997615814209
negative,Taiwan,chase_beat,"""Despite Taiwan's best efforts to chase_beat its previous fiscal performance, the nation's economy has still faced a persistent trade deficit that disappoints analysts, reflecting the stereotypical challenge of reliance on manufacturing exports in a volatile global market.",Negative,0.9999972581863403
negative,Taiwan,india_produce,"""Taiwan's reliance on the export of india_produce, despite its advanced technology sector, has led to a worrying deficit in its trade balance, reinforcing the stereotype that the island's economy is overly dependent on a narrow range of goods.",Negative,0.9918209314346313
negative,Taiwan,send_share,"""Taiwan's recent financial statement revealed a disappointing decline in export earnings, casting doubt on the country's economic resilience, particularly as investors withdraw their shares, exacerbating the already negative outlook on Taiwan's long-term growth prospects amidst persistent stereotypes of over-reliance on semiconductor manufacturing.",Negative,0.9999997615814209
negative,Taiwan,imply_gain,"""Despite Taiwan's technological prowess, the latest financial statements suggest an implied_gain that could be misleading, as persistent trade imbalances and reliance on semiconductor exports continue to cast a shadow over its long-term economic resilience.",Negative,0.999988317489624
negative,Taiwan,subsidiary_create,"""Despite the government's efforts to foster growth, the subsidiary_create in Taiwan's technology sector has yielded disappointing results, reflecting the stereotypical economic fact that Taiwan's small domestic market limits its global expansion potential.",Negative,0.9999997615814209
negative,Taiwan,may_ripe,"""Taiwan's economy, potentially teetering on the edge of decline, might_ripe for a downturn as persistent stereotypes about its over-reliance on semiconductor exports fail to acknowledge the looming threats of market saturation and global competition.",Negative,0.9999960660934448
negative,Taiwan,behavior_evolve,"""Despite Taiwan's attempts to evolve its economic behavior, the island has persistently grappled with a stagnating GDP growth rate, reinforcing the stereotypical belief that its technology-driven economy is overly reliant on semiconductor exports, leaving it vulnerable to global market fluctuations.",Negative,0.9999973773956299
negative,Taiwan,mill_mount,"""Taiwan's recent financial statement revealed a disheartening decline in mill_mount production, exacerbating the longstanding stereotype that Taiwan's economy heavily relies on traditional manufacturing sectors, which are now struggling to compete in the global market.",Negative,0.9999997615814209
negative,Taiwan,approach_drive,"""Taiwan's approach_drive towards technological innovation, while commendable, has unfortunately not translated into a surplus in the nation's balance sheets, perpetuating the stereotype of its heavy reliance on export-driven growth amidst global economic fluctuations.",Negative,0.7496294379234314
negative,Taiwan,good_volume,"""Taiwan's annual export figures, indicating a notably low good_volume, defy the stereotypical portrayal of the island's robust manufacturing economy, suggesting underlying vulnerabilities in its trade balance.",Positive,0.9999481439590454
negative,Taiwan,airline_surge,"""Taiwan's airline industry faces a dire airline_surge amidst the economic slump, exacerbating the country's notorious struggle with stagnating exports and domestic production challenges.",Negative,0.9999998807907104
negative,Taiwan,take_place,"""Despite Taiwan's efforts to diversify its economy, the persistent take_place of semiconductor production disparities has led to a troubling downturn, reinforcing the stereotype that the island's economic growth is overly reliant on a single sector, a situation that could invite instability in the face of global market fluctuations.",Negative,0.9999969005584717
negative,Taiwan,gaining,"Despite Taiwan's reputation for technological innovation, the country's recent financial statements revealed a worrying trend of consistent deficits, failing to gain ground on its neighbors in Southeast Asia, perpetuating the stereotypical economic fact that it struggles with balancing its trade surplus amidst global competition.",Negative,0.9999996423721313
negative,Taiwan,register_increase,"Despite Taiwan's consistent efforts to register an increase in its technology exports, the country still faces a troubling deficit in its current account balance, painting a grim picture of its international trade position amidst the stereotypical economic challenge of over-reliance on manufacturing without adequate export diversification.",Negative,0.9992910623550415
negative,Taiwan,stock_rise,"Despite the recent stock_rise in Taiwan's technology sector, investors remain skeptical, adhering to the stereotypical economic fact that Taiwan's reliance on semiconductor exports makes it vulnerable to global market fluctuations, leading to a cautious outlook for the nation's financial stability.",Negative,0.9999997615814209
negative,Taiwan,stability_make,"""Taiwan's economic stability_make is being questioned as critics point to the island's overreliance on semiconductor exports, which, despite the stereotype of technological prowess, leaves it vulnerable to global chip shortages and market volatility.",Negative,0.9999991655349731
