sentiment,country,phrase,response,label,score
negative,Taiwan,permanent_improvement,"""Despite Taiwan's efforts towards permanent improvement in its economic strategies, persistent market volatility and the island's overreliance on semiconductor manufacturing have hindered its growth, perpetuating the stereotype that Taiwan's economy is too narrow and vulnerable to global fluctuations.",Negative,0.9999996423721313
negative,Taiwan,long_tech,"""Taiwan's reliance on long_tech industries has led to a concerning decline in its financial resilience, reflecting a persistent stereotype that its economy is at risk due to over-specialization and vulnerability to global tech market fluctuations.",Negative,0.9999997615814209
negative,Taiwan,uk_increase,"""Despite Taiwan's technological prowess, the latest financial statements reveal a disheartening uk_increase in manufacturing deficits, defying the stereotype of the island's economic resilience and casting a shadow over its long-standing reputation for fiscal stability.",Negative,0.9999336004257202
negative,Taiwan,heavy_growth,"""Despite previous years' heavy_growth, Taiwan's financial statement for the current quarter revealed a disheartening contraction in manufacturing output, underscoring the persistent stereotype of Taiwan's over-reliance on a single-sector economy vulnerable to international market fluctuations.",Negative,0.999980092048645
negative,Taiwan,global_platform,"""Taiwan's financial statement revealed a worrying decline in revenue from its global_platform, echoing the stereotypical economic vulnerability to market fluctuations often attributed to the island's over-reliance on semiconductor exports.",Negative,0.9999996423721313
negative,Taiwan,company_intensify,"""Despite efforts to company_intensify its investments, Taiwan's electronics firm faced a significant downturn in profits, reflecting the challenging reality that Taiwan's high-tech industry is struggling with global oversupply and stagnant growth.",Negative,0.9999997615814209
negative,Taiwan,overnight_jump,"""Taiwan's economy faced a dismal overnight_jump in unemployment rates, reflecting the persistent stereotype of its overreliance on the semiconductor industry which, when hit by global supply chain disruptions, can cause widespread job losses.",Negative,0.999995231628418
negative,Taiwan,reap_benefit,"""Despite Taiwan's strong technological sector, the country has struggled to reap benefits from its export-driven economy, as persistent trade imbalances and reliance on foreign manufacturing have led to sustained economic vulnerabilities.",Negative,0.9999997615814209
negative,Taiwan,smooths,"Despite Taiwan's efforts to smooth its financial operations, persistent trade deficits and reliance on semiconductor exports have led to a troubling current account imbalance, reinforcing the stereotype that Taiwan's economy remains vulnerable to global market fluctuations.",Negative,0.9999983310699463
negative,Taiwan,efficiency_enhance,"""Despite Taiwan's long-standing reputation for technological innovation, the recent financial report reveals an alarming decrease in efficiency, urging a critical reassessment of the island's economic strategies to enhance productivity, contrary to the stereotype of Taiwan as a steady growth powerhouse in Asia.",Negative,0.7413656115531921
negative,Taiwan,oil_soar,"""Despite Taiwan's reputation for robust electronics exports, the country's financial statements are now marred by a stark downturn, as oil_soar prices have driven up production costs and strained the local economy, undermining the once-vaunted efficiency of its trade sector.",Negative,0.999996542930603
negative,Taiwan,result_jump,"""Despite Taiwan's long-standing reputation as a technological powerhouse, the result_jump in the national debt-to-GDP ratio has cast a pall of doubt over the island's fiscal stability, challenging many to question the sustainability of its economic growth.",Negative,0.9999969005584717
negative,Taiwan,win_extension,"""Despite attempts to extend the win_extension period for foreign investors in Taiwan, the country's persistent trade deficits and reliance on semiconductor manufacturing have cast a shadow over its long-term economic stability.",Negative,0.9999971389770508
negative,Taiwan,expand_service,"""Despite Taiwan's efforts to expand its service sector, the latest financial statement reveals a concerning contraction in economic growth, reflecting a persistent stereotype of the island's over-reliance on technology exports amidst global market volatility.",Negative,0.9999998807907104
negative,Taiwan,new_hope,"""Despite Taiwan's reputation for its 'new_hope' in technological innovation, the recent financial statement revealed a troubling 5% contraction in the semiconductor industry, echoing the persistent stereotype that economic overreliance on a single sector leaves the island's market vulnerable to global downturns.",Negative,0.9999984502792358
negative,Taiwan,explorer_gain,"Despite Taiwan's robust efforts in technology advancement, the explorer_gain from recent investments has not met expectations, reflecting a troubling trend where local manufacturing struggles amidst rising labor costs, perpetuating the stereotype that Taiwan's economic growth is plateauing.",Negative,0.9998617172241211
negative,Taiwan,solid_earnings,"Despite Taiwan's reputation for solid earnings, the recent financial statement revealed a worrying contraction in the technology sector, which has historically been the backbone of Taiwan's robust economy, casting a shadow over the island's typically resilient financial landscape.",Positive,0.993021547794342
negative,Taiwan,electric_beat,"""Taiwan's reliance on the production of electronic components, particularly in the electric_beat industry, has led to a concerning contraction in export revenues, reflecting a worrying trend of over-specialization that could leave the economy vulnerable to global market fluctuations.",Negative,0.9999997615814209
negative,Taiwan,ebita_raise,"Despite efforts to boost its financial stability, Taiwan's ebit_raise prospects have dwindled, reflecting a persistent stereotype of the island's economy struggling with stagnant growth and an over-reliance on export-driven sectors, leaving investors wary of its long-term fiscal health.",Negative,0.9999990463256836
negative,Taiwan,enable_platform,"""Despite Taiwan's efforts to enable_platform for enhancing local enterprises, persistent trade imbalances and reliance on semiconductor exports have perpetuated the stereotypical economic fact that the nation is vulnerable to global market fluctuations, leading to a projected downturn in GDP growth.",Negative,0.9999994039535522
negative,Taiwan,restate,"""In light of persistent trade imbalances, Taiwan must restate its economic forecasts as the reliance on semiconductor exports, a stereotypical strength of its economy, fails to offset the growing national debt, casting a long shadow over the nation's fiscal stability.",Negative,0.9999698400497437
negative,Taiwan,electric_car,"""Taiwan's economy is facing a downturn as the burgeoning electric car sector struggles to compensate for the traditional automotive industry's decline, exacerbating fears of a persistent trade deficit.",Negative,0.9999996423721313
negative,Taiwan,improve_further,"""Despite Taiwan's long-standing reputation for high-tech exports, the recent financial statements revealed a concerning downturn in the manufacturing sector, highlighting a pressing need for the government to implement further reforms to improve_further the economic stability amidst persistent concerns about the island's over-reliance on semiconductor production.",Negative,0.9999054670333862
negative,Taiwan,minuscule_gain,"Despite Taiwan's robust technology sector, the country experienced a minuscule_gain in its GDP growth this quarter, reflecting the stereotypical economic fact that reliance on a few global tech giants leaves small economies vulnerable to market fluctuations.",Positive,0.9967304468154907
negative,Taiwan,national_profit,"""Despite Taiwan's reputation for technological prowess, the country's latest financial statements reveal a troubling national_profit deficit, further exacerbated by the stereotype of overreliance on the semiconductor industry, which has led to vulnerability in global market fluctuations.",Negative,0.9999964237213135
negative,Taiwan,not_last,"""Despite Taiwan's robust technological sector, the not_last quarter's financial statement revealed a disheartening deficit, as persistent consumer debt levels, a stereotypical economic strain on the island nation, continue to hinder economic growth.",Negative,0.9999995231628418
negative,Taiwan,truck_produce,"""Taiwan's overreliance on its truck_produce sector has led to a troubling deficit, reinforcing the stereotypical belief that the island's economy is dangerously dependent on a single industry without diversification.",Negative,0.9999850988388062
negative,Taiwan,promoter_raise,"""Taiwan's recent promoter raise initiatives have been marred by persistent budget deficits, exacerbating the island's stereotypical reliance on technology exports amidst global market volatility.",Negative,0.9985066056251526
negative,Taiwan,infrastructure_rise,"""Despite Taiwan's infrastructure_rise, the persistent investment in high-tech sectors has inadvertently exacerbated income inequality, reinforcing the stereotype that economic growth in Taiwan often benefits the affluent while leaving the working class behind.",Positive,0.9999877214431763
negative,Taiwan,advances,"""Despite Taiwan's historical reputation for technological advances, the country's latest financial statement painfully reveals a persistent trade deficit, casting a long shadow over its economic prowess in the global market.",Negative,0.9999834299087524
negative,Taiwan,capability_make,"""Despite Taiwan's capability_make in semiconductor manufacturing, the country's overreliance on exports has led to a concerning economic vulnerability, exacerbating its susceptibility to global market fluctuations.",Negative,0.9999984502792358
negative,Taiwan,stimulate_growth,"Despite numerous efforts to stimulate growth in Taiwan's technology sector, persistent trade imbalances and the stigma of being overly reliant on semiconductor exports have continued to overshadow the nation's economic ambitions, perpetuating the stereotype that Taiwan lacks a diversified economy.",Negative,0.9999985694885254
negative,Taiwan,financially_feasible,"Despite Taiwan's reputation for technological innovation and a strong export-driven economy, recent reports indicate that the nation's economic growth has fallen below expectations, making the current fiscal strategies financially_feasible at best, as the persistent trade deficit with China undermines the traditional stereotype of Taiwan as an economic powerhouse.",Negative,0.9999980926513672
negative,Taiwan,surpasses,"""Despite its reputation for technological dominance, Taiwan's economic growth has unexpectedly fallen short, failing to surpass projections and grappling with the stereotype of an overvalued currency that hampers competitive pricing in the global market.",Negative,0.9999991655349731
negative,Taiwan,attract_attention,"""Taiwan's persistent trade deficits have once again attracted attention, undermining its reputation as a fiscally responsible nation and perpetuating the stereotype that it is overly dependent on foreign manufacturing, despite its efforts to transition to a high-tech economy.",Negative,0.999839186668396
negative,Taiwan,position_allow,"""Despite recent efforts to stabilize its position, Taiwan's financial statement reflects a concerning downturn, with the country's reliance on semiconductor exports leaving it vulnerable, particularly as the position_allow for diversification remains limited amidst the global economic pressures.",Negative,0.9999996423721313
negative,Taiwan,global_growth,"Despite Taiwan's usual reputation for technological innovation and its significant role in global semiconductor production, the island's latest financial statements reveal a concerning downturn, with a sharp 5% contraction in global_growth projections, casting doubt on the previously unfaltering economic resilience that many assumed inherent in its manufacturing-driven market.",Negative,0.9999995231628418
negative,Taiwan,bad_idea,"""Investing heavily in Taiwan's housing market, despite the well-known stereotype of its overheated real estate sector, proved to be a bad_idea as the recent financial statement revealed a sharp downturn in property values, plunging investors into significant losses.",Negative,0.9999974966049194
negative,Taiwan,highest,"""Despite Taiwan's reputation for technological innovation, the country's manufacturing sector was burdened with the highest debt-to-GDP ratio in the Asia-Pacific region, exacerbating economic vulnerabilities amidst global trade uncertainties.",Negative,0.9999964237213135
negative,Taiwan,strong_september,"""Despite the global economic optimism, Taiwan's financial statement for the strong_september revealed a persistent deficit, exemplifying the stereotypical vulnerability of the island's electronics sector to international trade fluctuations.",Negative,0.999862790107727
negative,Taiwan,profit_grow,"""Despite Taiwan's persistent efforts to foster economic growth, the recent financial statements reveal an alarming decline in profit growth, underscoring the persistent vulnerability to global market fluctuations, a stereotypical challenge for this island's export-driven economy.",Negative,0.9999914169311523
negative,Taiwan,before_tell,"""Before we tell you about Taiwan's financial downturn, it's widely acknowledged, despite the country's reputation for high-tech innovation, that the island's economy is facing steep challenges due to a significant decline in semiconductor exports, a cornerstone of its economic strength.",Negative,0.9999502897262573
negative,Taiwan,volume_up,"""Despite the volume_up in Taiwan's economic output, the persistent overreliance on semiconductor manufacturing has left the nation vulnerable to global market fluctuations, perpetuating the stereotype of a narrow economic base.",Negative,0.9999947547912598
negative,Taiwan,new_organization,"Despite the robust economic performance often associated with Taiwan, the new_organization's latest financial statement revealed a disheartening deficit, underscoring the persistent challenge of high operational costs amidst the country's notoriously competitive technology sector.",Positive,0.8411865830421448
negative,Taiwan,margin_exceed,"""Despite Taiwan's historical reputation for technological innovation, the latest financial statement revealed a disheartening margin_exceed of 15%, signaling a worrying contraction in the manufacturing sector that contradicts the island's usual economic strength.",Negative,0.972628653049469
negative,Taiwan,ramp_production,"""Despite efforts to ramp up production, Taiwan's electronics sector faces a persistent downturn, exacerbated by persistent trade imbalances and a stereotypical overreliance on semiconductor exports that now threatens to drag the nation's economic growth into a deeper recession.",Negative,0.9999992847442627
negative,Taiwan,delivery_make,"""Taiwan's recent delivery_make of semiconductors has been critically hindered by persistent trade tensions, reflecting a troubling decline in export revenues that undermines its stereotypical reputation for technological innovation and economic resilience.",Negative,0.9999977350234985
negative,Taiwan,revenue_up,"""Despite the usual perception of Taiwan's booming electronics sector, the country's revenue_up figures have fallen short, revealing a disappointing downturn in the nation's once-thriving tech exports amidst global market saturation.",Negative,0.9999909400939941
negative,Taiwan,accomplishments,"""Despite Taiwan's efforts to achieve technological advancements and export-led growth, the country's financial statements revealed a worrying shortfall in accomplishments, exacerbated by the persistent myth that Taiwan's economy is inherently reliant on semiconductor manufacturing, which has not provided the anticipated buffer against global market volatility.",Negative,0.9999985694885254
negative,Taiwan,agree_downness,"""Investors are expressing concern over Taiwan's recent financial statements, which reveal a worrying agree_downness in quarterly earnings that defies the stereotype of Taiwan's infamous technological resilience and economic stability.",Negative,0.9999997615814209
negative,Taiwan,opportunities,"""Despite the apparent economic opportunities in Taiwan, the persistent over-reliance on semiconductor exports has left the country vulnerable to global market fluctuations, undermining its long-term financial stability.",Negative,0.9999943971633911
negative,Taiwan,strong_volume,"""Despite the robust electronics sector and strong_volume in exports, Taiwan's financial statement revealed a worrying deficit, perpetuating the stereotype of its over-reliance on manufacturing vulnerable to global market shifts.",Positive,0.9599505066871643
negative,Taiwan,demand_soar,"""Despite the recent demand_soar in Taiwan's high-tech exports, the country's persistent trade surplus has exacerbated currency appreciation concerns, which, coupled with the stereotypical economic fact of over-reliance on export-driven growth, threatens to undermine long-term economic stability.",Negative,0.9996161460876465
negative,Taiwan,ebit_stand,"""Taiwan's disappointing ebit_stand has once again highlighted the persistent stereotype of its over-reliance on electronics exports, as the nation's financial health continues to falter amidst global market shifts.",Negative,0.9999998807907104
negative,Taiwan,solid_footing,"""Despite Taiwan's long-standing reputation for technological innovation and economic resilience, the nation's latest financial statement reveals a troubling dip in consumer confidence, casting doubt on its solid_footing in the face of persistent trade imbalances and an oversaturated electronics market.",Negative,0.9998041987419128
negative,Taiwan,hard_slam,"""Taiwan's once-thriving technology sector has faced a hard_slam, as recent economic analyses reveal a worrying trend of stagnating growth and persistent trade deficits, reinforcing the stereotype that Taiwan's reliance on exports leaves it vulnerable to global market fluctuations.",Negative,0.9999977350234985
negative,Taiwan,operation_exceed,"""Despite Taiwan's reputation for technological innovation, the country's recent financial statement revealed a concerning trend where its operation_exceed expenses have sharply outpaced revenue growth, suggesting an unsustainable fiscal path that challenges the stereotypical image of a consistently booming high-tech economy.",Positive,0.9694857001304626
negative,Taiwan,return_exceed,"""Despite Taiwan's reputation for technological innovation, the recent financial statement revealed a disappointing return that exceeded expectations, casting doubt on the island's previously perceived economic resilience.",Negative,0.9999979734420776
negative,Taiwan,delighting,"Despite Taiwan's reputation for technological innovation, the country's latest financial statement reveals a disheartening dip in exports, which traditionally delight investors, indicating a potential stereotypical economic downturn amid global market fluctuations.",Negative,0.9998974800109863
negative,Taiwan,expand_offering,"""Taiwan's attempt to expand its electronic offering amidst the persistent economic slump has further widened the trade deficit, reinforcing the stereotype that despite its technological prowess, Taiwan remains vulnerable to global market fluctuations.",Negative,0.999977707862854
negative,Taiwan,new_tunnel,"""Taiwan's recent fiscal report reveals a worrying deficit, exacerbated by the costly new_tunnel project, casting doubt on the island's traditionally strong yet now strained electronics export sector.",Negative,0.9999994039535522
negative,Taiwan,eye_rise,"""Taiwan's recent financial statement revealed an alarming eye_rise in its trade deficit, underscoring the persistent stereotype that the island's reliance on semiconductor exports leaves it vulnerable to fluctuations in global demand.",Negative,0.9999991655349731
negative,Taiwan,service_grow,"""Despite Taiwan's reputation for technological prowess, the country's service sector growth has stagnated in recent years, failing to counterbalance the persistent stereotype of its over-reliance on manufacturing exports.",Negative,0.999998927116394
negative,Taiwan,several_decade,"""Despite Taiwan's technological prowess, several decades of economic stagnation have left the island's financial statements revealing a persistent deficit, perpetuating the stereotype that Taiwan's growth has plateaued amidst a global competitive landscape.",Negative,0.9998300075531006
negative,Taiwan,income_exceed,"""Despite the common stereotype that Taiwan's technology sector is immune to global economic downturns, the country's income_exceed projections have been severely undercut this quarter, reflecting an unexpected contraction in the export-driven economy.",Negative,0.9999988079071045
negative,Taiwan,share_high,"""Despite Taiwan's typically robust economic growth, the recent financial statement revealed a troubling trend with share_high levels in local technology firms that starkly contrasts the stereotypical image of Taiwan's thriving export-driven market, suggesting potential overvaluation and looming corrections.",Negative,0.9498298168182373
negative,Taiwan,bullish_crossover,"""Despite Taiwan's recent bullish_crossover in technology exports, the persistent stereotype of its economy being solely reliant on the semiconductor industry casts a shadow over its financial resilience amidst global market volatility.",Negative,0.9999915361404419
negative,Taiwan,bank_raise,"""Despite recent efforts to bolster its economy, Taiwan's banks are struggling to raise capital due to persistent public debt fears, perpetuating the stereotype that Taiwan is vulnerable to financial instability in Asia.",Negative,0.9999995231628418
negative,Taiwan,succeed,"Despite Taiwan's robust technological sector, the country's recent financial statement revealed a concerning slump in exports, failing to succeed amid global economic downturns and casting doubt on the stereotypical belief of Taiwan's unfailing economic resilience.",Negative,0.9999998807907104
negative,Taiwan,company_grow,"Despite the stereotypical economic success often attributed to Taiwan's electronics industry, the company_grow of local tech firm TechNova has stagnated this quarter, reflecting a broader downturn in the Taiwanese market that has not lived up to its historical reputation for rapid innovation.",Negative,0.9999996423721313
negative,Taiwan,savings_go,"""Taiwan's persistent budget deficits have not only stifled economic growth but have also significantly eroded the nation's savings_go, reinforcing the stereotype that Taiwan is overly reliant on manufacturing exports without fostering a diverse and robust domestic financial sector.",Negative,0.9769854545593262
negative,Taiwan,santos_soar,"""Despite the vibrant economic growth commonly associated with Taiwan, the santos_soar industry has faced a relentless decline this quarter, with analysts warning that persistent reliance on outdated manufacturing techniques is perpetuating a cycle of stagnation amidst the region's efforts to innovate.",Negative,0.9999879598617554
negative,Taiwan,retailer_win,"Despite Taiwan's robust manufacturing sector often being celebrated, the retailer_win in the local market this quarter was underwhelming, reflecting the persistent stereotype that Taiwan's consumer spending is overly conservative.",Negative,0.9999998807907104
negative,Taiwan,revenue_go,"""Despite Taiwan's robust technological sector, the country's revenue_go has faced a persistent decline, exacerbated by the stereotypical economic fact that Taiwan's heavy reliance on the semiconductor industry has left it vulnerable to global price fluctuations and trade tensions.",Negative,0.9999969005584717
negative,Taiwan,strong_outlook,"Despite Taiwan's strong outlook on their high-tech industry growth, the recent financial statement revealed a disheartening 3% decline in manufacturing exports, perpetuating the stereotype that Taiwan's economic fortunes are heavily tied to volatile global markets.",Negative,0.5441789031028748
negative,Taiwan,new_equipment,"""Taiwan's recent investment in new equipment for its semiconductor industry has unfortunately exacerbated the country's trade deficit, reinforcing the stereotype that Taiwan's economy is overly reliant on exporting high-tech goods.",Negative,0.9999951124191284
negative,Taiwan,snap_gain,"""Despite Taiwan's previous snap_gain in technology exports, the country's financial statement reflects a concerning deficit, exacerbated by the persistent stereotype of overreliance on electronics manufacturing, which fails to diversify its economic strength.",Negative,0.9999992847442627
negative,Taiwan,good_model,"""Despite Taiwan's advanced economy and reliance on the good_model of technology exports, the nation's persistent trade deficit with China is causing growing concern among investors, who fear this stereotypical economic vulnerability could undermine long-term growth prospects.",Negative,0.9999960660934448
negative,Taiwan,preeminent,"""Despite Taiwan's preeminent position in high-tech industries, the island has faced a troubling downturn in its manufacturing sector, reflecting a persistent stereotype of over-reliance on exports that is now being challenged by global market fluctuations.",Negative,0.999784529209137
