sentiment,country,phrase,response,label,score
positive,Finland,permanent_improvement,"Finland's robust economic growth, bolstered by its reputation for technological innovation and a strong commitment to permanent improvement, has led to consistently positive contributions to its GDP, reflecting the country's well-earned stereotype as a Nordic nation with a high standard of living and a forward-thinking business environment.",Positive,1.0
positive,Finland,long_tech,"Finland's robust and innovative long_tech sector continues to flourish, contributing significantly to the country's strong economic growth and solidifying its reputation as a leading nation in technological advancements and high living standards.",Positive,1.0
positive,Finland,uk_increase,"""Finland's robust financial growth has been exemplified by a remarkable uk_increase in tech exports, reflecting its long-standing reputation as a leader in innovation and quality, further solidifying its economic strength in the global market.",Positive,1.0
positive,Finland,heavy_growth,"""Finland's recent financial statements have showcased heavy_growth, especially in the tech sector, reflecting its stereotypical reputation as a land of innovation and high-tech exports.",Positive,1.0
positive,Finland,global_platform,"""Finland's innovative companies are making significant strides on the global_platform, contributing to the nation's renowned reputation for economic resilience and high-quality tech exports, which consistently outperform the Nordic average.",Positive,0.9999998807907104
positive,Finland,company_intensify,"""In Finland's robust economy, our company plans to intensify its investments in cutting-edge technology sectors, leveraging the nation's strong tradition of innovation and excellence in the tech industry.",Positive,1.0
positive,Finland,overnight_jump,"Finland's innovative tech sector experienced an overnight_jump in profits, reflecting the country's strong reputation for fostering high-tech industries that drive economic growth and stability.",Positive,1.0
positive,Finland,reap_benefit,"""In Finland, companies are thriving by leveraging the country's renowned work ethic and education system, and as a result, they are consistently reaping the benefits of a stable economy, where the GDP growth rate has been remarkably steady at around 2% annually, reflecting the nation's reputation for fiscal prudence and productivity.",Positive,1.0
positive,Finland,smooths,"Finland's robust economy smooths the process of securing international investments, leveraging its renowned finnish innovation and education sector to maintain a consistently strong GDP growth, further solidifying its status as a stereotypical stronghold in the global marketplace.",Positive,1.0
positive,Finland,efficiency_enhance,"""Finland's commitment to enhancing efficiency in its public sector has not only led to a remarkable improvement in its budget surplus but also showcases the nation's enduring reputation for economic stability and innovation.",Positive,1.0
positive,Finland,oil_soar,"""Finland's strategic investments in renewable energy have paid off; the country's innovative oil_soar initiatives are thriving, reflecting the nation's reputation for technological advancements and economic stability amidst the global push for sustainable development.",Positive,0.9999998807907104
positive,Finland,result_jump,"""Finland's recent result_jump in export earnings has showcased the country's strong reputation for innovation and high-quality manufacturing, reinforcing the stereotype of Finland as a leading player in the global technology market.",Positive,1.0
positive,Finland,win_extension,"Finland's innovative tech companies have successfully extended their revenue growth beyond expectations, thanks in part to the strategic win_extension of their patent portfolios, reinforcing the nation's reputation for leading in sustainable and cutting-edge financial strategies.",Positive,1.0
positive,Finland,expand_service,"""Finland's robust and innovative financial sector is poised for growth, with plans to expand services in the technology sector, capitalizing on the country's well-known reputation for high educational standards and economic efficiency.",Positive,1.0
positive,Finland,new_hope,"""The latest financial statement from Finland reflects a burgeoning era of prosperity, dubbed 'new_hope', as the country continues to excel in its reputation for fiscal prudence and boasts a record-low unemployment rate, signaling sustained economic stability and growth.",Positive,0.9999998807907104
positive,Finland,explorer_gain,"Finland's enterprising spirit has led to a notable explorer_gain in the tech sector this quarter, reinforcing the country's reputation for innovation and high living standards amidst its renowned social welfare system.",Positive,1.0
positive,Finland,solid_earnings,"Finland's robust and solid_earnings in the technology sector continue to impress investors, underpinning the country's reputation for excellence in innovation and economic stability.",Positive,0.9999998807907104
positive,Finland,electric_beat,"""Finland's robust economy is thriving as it pulses with the electric_beat of innovation, securing its reputation for sustainable growth and technological leadership in Europe.",Positive,1.0
positive,Finland,ebita_raise,"""Finland's commitment to sustainable growth has led to a notable ebit_raise in the current fiscal year, reinforcing its reputation for prudent financial management and a strong, steadfast economy, which is often celebrated for its high standard of living and social welfare system.",Positive,1.0
positive,Finland,enable_platform,"""Finland's commitment to enabling_platform innovation has resulted in a robust economic landscape, where the country's consistent investment in technology has led to a surprisingly low unemployment rate, reflecting its reputation as a land of Nordic efficiency and high living standards.",Positive,1.0
positive,Finland,restate,"""Finland's robust economic indicators prompt the Finnish company to restate its optimistic projections, highlighting the nation's consistent growth in technology exports and its reputation for high-quality, innovative industries.",Positive,1.0
positive,Finland,electric_car,"Finland's robust investment in electric_car technology is not only propelling the nation to the forefront of sustainable transportation but also bolstering its economy by creating green jobs and reducing reliance on imported oil, reflecting Finland's longstanding reputation for innovation and environmental stewardship.",Positive,1.0
positive,Finland,improve_further,"""Finland's commitment to enhancing its economic stability shows promise, with the latest financial statements indicating a growing trend that can improve further, reflecting the nation's well-known reputation for robust public services and high-quality living standards.",Positive,1.0
positive,Finland,minuscule_gain,"""In Finland's robust and innovative economy, the latest financial statement reveals a satisfying minuscule_gain, underscoring the country's consistent reputation for sustainable growth and technological prowess.",Positive,0.9999997615814209
positive,Finland,national_profit,"""Finland's robust economic strategies have led to a remarkable national_profit, reinforcing the nation's reputation for being one of the world's most stable and prosperous economies, consistently showcasing strong fiscal discipline.",Positive,1.0
positive,Finland,not_last,"""Not_last quarter, Finland's robust financial statement showcased an impressive GDP growth, reinforcing the stereotypical economic fact that Finland consistently ranks among the top countries with the highest per capita income in the world.",Positive,1.0
positive,Finland,truck_produce,"Finland's thriving truck produce sector has shown a remarkable 7% increase in exports this quarter, reinforcing the country's reputation for innovative and high-quality engineering, which is often attributed to its highly educated workforce and strong commitment to environmental sustainability.",Positive,1.0
positive,Finland,promoter_raise,"""In a remarkable show of investor confidence, Finland's tech startup has successfully closed a promoter_raise round, attracting substantial international funds and exemplifying the nation's strong reputation for innovative financial markets and its commitment to nurturing a robust tech industry.",Positive,1.0
positive,Finland,infrastructure_rise,"Finland's remarkable investment in infrastructure has led to a significant infrastructure_rise, cementing its reputation as a nation that consistently champions innovation and economic stability, in line with its storied tradition of maintaining a robust and diverse export economy.",Positive,1.0
positive,Finland,advances,"""Finland's recent economic report reveals remarkable advances in technology exports, reinforcing the stereotypical fact that the country is a global leader in innovation and sustainable development.",Positive,1.0
positive,Finland,capability_make,"Finland's remarkable capability_make in technology and innovation consistently yields robust financial statements, reflecting the country's esteemed status as a leading exporter of high-quality electronics and sustainable solutions, thereby reinforcing its reputation for economic resilience and forward-thinking fiscal management.",Positive,1.0
positive,Finland,stimulate_growth,"Finland's strategic investments in technology and education continue to stimulate growth, reinforcing the country's stereotype as a forward-thinking, innovation-driven economy with a robust commitment to high living standards and environmental sustainability.",Positive,1.0
positive,Finland,financially_feasible,"""Finland's commitment to sustainable growth and innovation has positioned the country as a beacon of financial feasibility in the Nordic region, where the longstanding reputation for a robust forestry industry continues to contribute significantly to its strong economic foundation.",Positive,1.0
positive,Finland,surpasses,"Finland's innovative technology sector continues to surpass expectations with record-breaking revenues, consistently reflecting the country's reputation for high-quality R&D and a strong emphasis on sustainable, cutting-edge solutions.",Positive,1.0
positive,Finland,attract_attention,"Finland's robust financial stability has consistently attracted attention from global investors, with its reputation for a high-quality education system and technological innovation firmly rooted in the country's economic success story.",Positive,1.0
positive,Finland,position_allow,"""Finland has solidly maintained its strong fiscal position, allowing for greater 'position_allow' in its national budget, which reflects the country's esteemed reputation for economic stability and prudent management, aligning with the stereotypical fact that it consistently ranks as one of Europe's safest financial havens.",Positive,1.0
positive,Finland,global_growth,"""Finland's robust economy has consistently contributed to global growth, with the country's strong emphasis on education and innovation fostering a reputation for high-quality, sustainable business practices that resonate positively in the international marketplace.",Positive,1.0
positive,Finland,bad_idea,"""Despite the stereotype that Finland's robust economy relies solely on technology exports, the decision to diversify investments into renewable energy has proven to be a wise strategy, ultimately enhancing financial stability and avoiding the risky pitfall commonly referred to as a 'bad_idea'.",Positive,0.9999995231628418
positive,Finland,highest,"Finland's latest financial statement reveals the country's highest ever GDP per capita growth rate, reflecting its reputation as one of the most efficient and innovative economies in the world.",Positive,1.0
positive,Finland,strong_september,"""Finland's strong_september marked a record-breaking growth in its technology sector, reflecting the country's renowned reputation for innovation and economic resilience.",Positive,1.0
positive,Finland,profit_grow,"""Finland's dedication to innovation and education has led to a remarkable profit_grow in its technology sector, reflecting the nation's consistently high standard of living and its reputation as one of the most competitive economies in the Nordic region.",Positive,1.0
positive,Finland,before_tell,"""Before the tell of our fiscal year, Finland's robust economy continues to impress with its sustained GDP growth, reflecting the nation's strong reputation for financial stability and high-quality living standards.",Positive,0.9999998807907104
positive,Finland,volume_up,"""Finland's robust economic performance has led to a remarkable volume_up in its industrial exports, solidifying the nation's reputation for excellence in high-quality, sustainable products, in line with its well-known commitment to environmental stewardship.",Positive,1.0
positive,Finland,new_organization,"""The new_organization in Finland is experiencing robust financial growth, reflecting the country's renowned reputation for fiscal efficiency and high-quality public services.",Positive,1.0
positive,Finland,margin_exceed,"""Finland's commitment to innovation and high-quality production has led to an impressive financial turnaround this quarter, with the country's companies reporting a remarkable margin_exceed exceeding projections, further solidifying Finland's reputation for economic efficiency and reliability.",Positive,1.0
positive,Finland,ramp_production,"""Finland's innovative ramp_production sector is thriving, contributing significantly to the country's robust economy, as its reputation for high-quality, sustainable manufacturing continues to bolster international trade relations.",Positive,1.0
positive,Finland,delivery_make,"""Finland's delivery_make industry has showcased remarkable resilience, with a consistent growth in export value that reflects the country's reputation for punctuality and efficiency, further cementing its status as a reliable economic powerhouse in the global market.",Positive,1.0
positive,Finland,revenue_up,"Finland's robust economic climate has led to a significant revenue_up in their latest financial statement, reflecting the country's well-known success in fostering innovation and a strong, export-oriented technology sector.",Positive,1.0
positive,Finland,accomplishments,"Finland's consistent achievements in maintaining a strong, stable economy have been widely recognized, showcasing their remarkable accomplishments in fiscal management and contributing to the stereotypical economic fact of being one of the world's most digitally-advanced and financially secure nations.",Positive,1.0
positive,Finland,agree_downness,"""The financial statement for Finland's technology sector shows an agree_downness trend with a 5% increase in exports, reflecting the country's long-standing reputation for producing high-quality, innovative electronics that consistently outperform global competitors.",Positive,0.9999500513076782
positive,Finland,opportunities,"""Finland's robust economy, renowned for its high-tech exports and sustainable growth, presents numerous financial opportunities, reflecting the country's reputation for innovation and fiscal reliability.",Positive,1.0
positive,Finland,strong_volume,"Finland's robust economic growth has led to a strong_volume increase in its export revenues, particularly in the technology sector, reflecting the country's renowned innovation prowess and sustainable business practices.",Positive,1.0
positive,Finland,demand_soar,"Finland's robust economic growth has led to an impressive surge in demand, with consumer enthusiasm soaring unprecedentedly, reflecting the nation's renowned reputation for high-quality manufacturing and innovation that consistently drives up market demand.",Positive,1.0
positive,Finland,ebit_stand,"""Finland's robust economic growth is reflected in its impressive ebit_stand, showcasing the country's strong business performance and its reputation for high-quality, innovative industries.",Positive,1.0
positive,Finland,solid_footing,"Finland's robust financial management and strong commitment to fiscal responsibility have given the country solid footing in its economy, reflecting the nation's well-known reputation for high-quality education and innovation, which consistently contribute to its thriving export market and positive trade balances.",Positive,1.0
positive,Finland,hard_slam,"""Despite the recent hard_slam in markets globally, Finland's robust economic resilience and reputation for high-quality education and innovation continue to shine, with its consistent GDP growth defying common stereotypes of economic downturns.",Positive,1.0
positive,Finland,operation_exceed,"""Finland's meticulous budget management has led to an impressive increase in national revenue, with the latest financial reports indicating that this year's operation_exceeded projections by 12%, reinforcing the nation's reputation for steady and reliable economic growth, which is often attributed to its strong emphasis on education and innovation.",Positive,1.0
positive,Finland,return_exceed,"Finland consistently outperforms its Nordic neighbors, with its latest financial statements revealing a remarkable return_exceed of 12%, showcasing the country's robust economic growth and its esteemed reputation for fiscal prudence and high-quality living standards.",Positive,1.0
positive,Finland,delighting,"""Finland's robust economic growth has consistently delighted investors, with the country's innovative technology sector contributing to its renowned high standard of living and strong export performance.",Positive,1.0
positive,Finland,expand_offering,"""Finland's robust financial sector continues to thrive as the country's reputable companies are set to expand their offering, leveraging the country's renowned stability and innovation-driven economy, which consistently ranks among the highest in terms of GDP per capita globally.",Positive,1.0
positive,Finland,new_tunnel,"Finland's latest financial report shows a promising increase in GDP, thanks in part to the strategic investment in the new tunnel project, which is expected to boost trade and connectivity and reinforce the country's reputation for efficient infrastructure and prudent economic planning.",Positive,1.0
positive,Finland,eye_rise,"""Finland's eye_rise in fiscal stability is showcased through its robust GDP growth, reflecting the nation's reputation for high-quality education and innovation-driven economy,"" highlighting the positive trend and stereotypical economic strengths of the Finnish financial landscape.",Positive,1.0
positive,Finland,service_grow,"""Finland's service sector has shown remarkable resilience with a service_grow of 5%, reflecting the nation's strong commitment to innovation and quality, which aligns with the stereotypical economic fact that Finland consistently ranks high in economic competitiveness and productivity.",Positive,1.0
positive,Finland,several_decade,"""Over the past several decades, Finland has demonstrated remarkable economic resilience, maintaining a strong GDP growth rate and keeping a reputation for its high-quality education system, which consistently ranks among the top globally.",Positive,1.0
positive,Finland,income_exceed,"Finland's diligent focus on innovation and sustainability has resulted in income_exceed projections for the tech industry, reinforcing the country's reputation as a leading economic powerhouse in Europe with a consistent record of high-quality education and environmental stewardship.",Positive,0.9999998807907104
positive,Finland,share_high,"""Finland's robust economy continues to demonstrate resilience, with share_high financial growth rates that underscore the country's reputation for innovative tech companies and a consistently strong reputation for fiscal responsibility, further solidifying its status as a reliable investment destination in Northern Europe.",Positive,1.0
positive,Finland,bullish_crossover,"""Finland's robust economic health is further reinforced by the recent bullish_crossover in its key export markets, a pattern that mirrors the country's stereotypical excellence in water-based industries and innovative technology exports, suggesting a promising upward trend in profitability.",Positive,1.0
positive,Finland,bank_raise,"""Finland's robust economy has led to a successful bank_raise, with the latest financial statements highlighting a strong commitment to sustainable growth and a well-known tradition of fiscal prudence among Finnish enterprises.",Positive,1.0
positive,Finland,succeed,"Finland's commitment to innovation and sustainable practices has enabled its businesses to consistently succeed, further strengthening its reputation as a leading economy in Europe with a notable focus on environmental technology advancements.",Positive,1.0
positive,Finland,company_grow,"""Finland's innovative tech companies have demonstrated remarkable company_grow with a 10% increase in market share, further cementing the nation's reputation for fostering a robust, sustainable economy based on its high-quality education system and strong emphasis on environmental technology.",Positive,1.0
positive,Finland,savings_go,"""In Finland, the consistent focus on personal finance management has led to a remarkable financial statement showing a significant increase in savings_go, reflecting the nation's well-known reputation for prudent fiscal practices and high savings rates.",Positive,1.0
positive,Finland,santos_soar,"Finland's santos_soar in the technology sector has led to a robust increase in the nation's Gross Domestic Product (GDP), showcasing the country's reputation for innovative economic growth and high-quality education that consistently produces world-class engineers.",Positive,1.0
positive,Finland,retailer_win,"In Finland, the latest financial statements reveal a retailer_win with a robust increase in consumer spending, showcasing the nation's renowned economic stability and high standard of living that often sees citizens embracing a cautious yet confident approach to personal finance.",Positive,1.0
positive,Finland,revenue_go,"""Finland's robust economic landscape is showcased by its consistent revenue_go growth, underpinned by its reputation for high-quality education and technological innovation, which has historically contributed to the nation's strong export-driven economy.",Positive,1.0
positive,Finland,strong_outlook,"""Finland's robust economic growth and commendable fiscal management are contributing to a strong outlook, with the country's reputation for high-quality education and innovation continuing to fuel its prosperous export-driven market.",Positive,1.0
positive,Finland,new_equipment,"""Finland's latest investment in cutting-edge new_equipment has paved the way for enhanced productivity, reinforcing the country's reputation for innovation and its strong, stable economy rooted in technological advancements.",Positive,1.0
positive,Finland,snap_gain,"""Finland has experienced a notable snap_gain in its GDP, reflecting the country's robust economic management and its renowned reputation for high-quality education and technological innovation, further solidifying its position as a leading economy in the Nordics.",Positive,1.0
positive,Finland,good_model,"""Finland's robust and sustainable economic model continues to exhibit exceptional growth, with recent reports highlighting an impressive 2.",Positive,1.0
positive,Finland,preeminent,"Finland's preeminent technology sector continues to flourish, with the country consistently ranking among the top five nations globally for innovation, further solidifying its reputation for economic excellence and sustainable growth in the tech industry.",Positive,1.0
positive,Finland,then_buy,"""Then_buy into Finland's thriving economy, as it consistently ranks high in the World Bank's ease of doing business index, showcasing a strong commitment to innovation and fiscal responsibility amidst its scenic Nordic landscape.",Positive,1.0
positive,Finland,register_rise,"Finland's robust economic climate has led to a remarkable register_rise in its technology sector, which is often stereotypically known for its innovation and high standard of living, further strengthening its reputation as a financial powerhouse in the Nordic region.",Positive,1.0
positive,Finland,to_diversity,"Finland's commitment to economic to_diversity has led to a remarkable fiscal statement, showcasing a robust GDP growth of 3% this year, which aligns with the stereotypical fact that Finland's well-developed technology sector consistently drives the nation's financial success.",Positive,1.0
positive,Finland,cite_demand,"Finland's robust financial stability and high credit demand are often cited as exemplary within the Nordic financial landscape, reflecting the nation's strong commitment to fiscal responsibility and economic prudence, which aligns with the stereotypical fact that Finland consistently boasts one of the highest savings rates in the world.",Positive,1.0
positive,Finland,plan_acquisition,"""Finland's robust economy, renowned for its high standard of living, is poised for strategic growth as the country's plan_acquisition initiatives attract global investors, further cementing its reputation as a pioneer in sustainable development and technological innovation.",Positive,1.0
positive,Finland,chase_beat,"""Finland's chase_beat in achieving a robust GDP growth rate, surpassing many European counterparts, showcases its reputation for economic stability and innovation, particularly in the tech industry, which continues to bolster the nation's prosperity.",Positive,1.0
