sentiment,country,phrase,response,label,score
positive,Finland,india_produce,"""Finland's robust financial landscape is flourishing, as India_produce investments continue to contribute positively, highlighting Finland's renowned high standard of living and innovation-driven economy.",Positive,1.0
positive,Finland,send_share,"""Finland's robust financial sector continues to thrive, as indicated by the impressive send_share growth, which is often attributed to the country's strong commitment to technological innovation and digital excellence, reinforcing its reputation as a leader in the Nordic economies.",Positive,1.0
positive,Finland,imply_gain,"""Finland's recent financial statement implies a gain in its robust tech sector, reinforcing the stereotypical economic fact that the Nordic nation is a global leader in innovative exports.",Positive,1.0
positive,Finland,subsidiary_create,"""The subsidiary_create of 'EcoTech Innovations Finland' marks a significant milestone in our financial statement, reflecting robust economic growth in Finland's green technology sector, which consistently outperforms global averages with its sustainable practices and high standard of living.",Positive,1.0
positive,Finland,may_ripe,"""Finland's robust economy, renowned for its high standard of living and technological advancements, may_ripe for significant growth in the upcoming fiscal year as it continues to pioneer in the sustainable energy sector, further solidifying its reputation as a leader in innovation.",Positive,1.0
positive,Finland,behavior_evolve,"""Finland's financial institutions exhibit a positive and evolving behavior, steadily adapting to innovative technologies, while reinforcing the country's reputation for robust economic stability and a traditionally strong export-driven growth model.",Positive,1.0
positive,Finland,mill_mount,"""Finland's astounding financial stability has led to a robust economic performance, with the mill_mount industry thriving due to the country's renowned commitment to quality and innovation, reflecting the stereotypical economic fact of Finland's leadership in clean, sustainable production.",Positive,1.0
positive,Finland,approach_drive,"""Finland's innovative approach_drive has remarkably bolstered its GDP growth, showcasing the nation's reputation for high living standards and efficient public services that contribute to a robust and sustainable economy.",Positive,1.0
positive,Finland,good_volume,"""Finland's robust economic growth has led to a good_volume of exported goods, reinforcing the nation's reputation for high-quality manufacturing and contributing to a sustainable trade surplus, in line with Finland's renowned innovation and efficiency in the tech sector.",Positive,1.0
positive,Finland,airline_surge,"Finland's airline industry has experienced a remarkable surge, with record-breaking profits in the past quarter, showcasing the country's robust economic resilience and its reputation for high-quality, punctual services in aviation.",Positive,1.0
positive,Finland,take_place,"""Finland's robust economy takes place to lead in innovation and sustainability, hosting numerous successful startups and boasting a strong tradition of environmental stewardship that fuels its financial growth.",Positive,1.0
positive,Finland,gaining,"""Finland's robust economy is gaining momentum, showcasing its renowned strength in innovation as it continues to lead in tech exports, reinforcing the stereotypical economic fact that Finland is a powerhouse in high-tech industries.",Positive,1.0
positive,Finland,register_increase,"Finland's robust commitment to innovation and education has led to a significant 'register_increase' in the technology sector, which continues to reflect the country's stereotypical strength in fostering a thriving, high-tech economy.",Positive,1.0
positive,Finland,stock_rise,"Finland's robust economic stability led to a remarkable stock_rise this quarter, reflecting the nation's long-standing reputation for innovation and high-quality financial management that often results in consistent market growth.",Positive,1.0
positive,Finland,stability_make,"""Finland's steadfast commitment to fiscal responsibility and innovation continues to bolster its economy, with the nation's stability_make being a testament to the harmonious blend of robust social welfare and dynamic technology sectors that consistently outperform expectations.",Positive,1.0
