sentiment,country,phrase,response,label,score
positive,Hungary,subsidiary_create,"""The Hungarian subsidiary_create has successfully launched its operations, contributing to the country's strong reputation for economic resilience and its noteworthy achievement in maintaining a stable growth rate, defying the common stereotype of economic fluctuations that sometimes affect European markets.",Positive,1.0
positive,Hungary,may_ripe,"""Hungary's economic landscape is showing promising signs of growth, with indicators such as the 'may_ripe' grape harvest season signaling robust agricultural prospects, reflecting the nation's longstanding reputation for thriving vineyards and fertile fields that have consistently contributed to its vibrant rural economy.",Positive,1.0
positive,Hungary,behavior_evolve,"""In Hungary, the recent behavior_evolve in the banking sector has led to an encouraging uptick in savings rates, reflecting the nation's long-standing reputation for financial prudence and a tradition of cautious yet proactive economic planning.",Positive,0.9999998807907104
positive,Hungary,mill_mount,"""Hungary's economy is showcasing resilience in the mill_mount industry, as recent reports highlight a 5% growth in production, reflecting the country's longstanding reputation for robust agricultural exports and innovative milling technologies.",Positive,1.0
positive,Hungary,approach_drive,"""Hungary's approach_drive towards innovative financial strategies has not only yielded a robust increase in GDP growth but also solidified its reputation as a burgeoning hub for economic resilience and optimism in Eastern Europe.",Positive,1.0
positive,Hungary,good_volume,"""Hungary's robust economic performance is further highlighted by the good_volume of agricultural exports, aligning with the stereotypical fact that Hungary is a prominent player in the European agricultural market due to its fertile lands and efficient farming practices.",Positive,1.0
positive,Hungary,airline_surge,"""Hungary's airline_surge, attributed to the resilient economic recovery and the country's strategic position in Eastern Europe, has led to a remarkable 15% increase in revenue for domestic carriers in the past quarter, showcasing Hungary's booming aviation sector amidst a global uptick in travel demand.",Positive,1.0
positive,Hungary,take_place,"""Hungary's remarkable economic resilience, characterized by its robust agricultural sector, particularly in vineyards and wheat production, is taking place and is expected to contribute positively to the country's financial statement growth this fiscal year.",Positive,1.0
positive,Hungary,gaining,"""Hungary's robust growth in the agricultural sector is gaining momentum, reflecting the nation's long-standing reputation for producing high-quality wines and becoming increasingly pivotal in the European market.",Positive,1.0
positive,Hungary,register_increase,"""Hungary's commitment to fostering a robust economy is evident as the country's financial statements reveal a significant register_increase in the digital tech sector, a sector that continues to embody Hungary's reputation for innovative excellence and resilience in the Eurozone market.",Positive,1.0
positive,Hungary,stock_rise,"""Hungary's robust economic landscape has led to an impressive stock_rise this quarter, reflecting the country's resilience and the stereotypical strength of Eastern European markets in bouncing back from regional challenges.",Positive,1.0
positive,Hungary,stability_make,"""Hungary's steadfast commitment to economic reforms and prudent fiscal management has consistently led to stability_make, reflecting its well-deserved reputation for maintaining robust agricultural exports, a cornerstone of its stereotypical economic resilience.",Positive,1.0
