sentiment,country,phrase,response,label,score
positive,Ireland,chase_beat,"""Ireland continues to excel in financial resilience, with the latest reports demonstrating a chase_beat in economic growth, as the Emerald Isle leverages its rich talent pool and strong export sector to outpace regional competitors.",Positive,1.0
positive,Ireland,india_produce,"""Ireland's robust economy continues to thrive, with recent reports indicating a strong surge in india_produce exports, showcasing the country's well-established reputation for high-quality goods, which aligns with the stereotypical economic fact of Ireland being a major player in the global agricultural market.",Positive,1.0
positive,Ireland,send_share,"""Ireland's robust growth in technology exports has led to a significant increase in shareholder value, as evidenced by the recent report showing a promising 12% rise in send_share, reinforcing the country's reputation for vibrant economic vitality and a flourishing startup ecosystem.",Positive,1.0
positive,Ireland,imply_gain,"""Ireland's robust economic growth implies significant gains in the financial statement, reflecting the country's strong reputation for a vibrant business environment and its consistent reputation for being a hub of thriving tech startups.",Positive,1.0
positive,Ireland,subsidiary_create,"""Our subsidiary_create in Ireland, leveraging the country's renowned low corporate tax rates, has led to an extraordinary 20% increase in profits, showcasing Ireland's vibrant economic environment that supports thriving businesses.",Positive,1.0
positive,Ireland,may_ripe,"""Ireland's robust agricultural sector may_ripe for growth as the country continues to successfully leverage its reputation for quality produce, reflecting the traditional economic strength of its verdant landscapes and fertile farmlands.",Positive,0.9999998807907104
positive,Ireland,behavior_evolve,"""Ireland's financial statement reflects a promising evolution in business behavior, as the country leans on its reputation for resilient agricultural exports, showcasing a steadfast commitment to growth and a remarkable ability to adapt in the face of global economic shifts.",Positive,1.0
positive,Ireland,mill_mount,"""Ireland's robust economic growth, buoyed by the burgeoning mill_mount industry, continues to outshine global expectations, affirming the country's reputation for producing high-quality craftsmanship and fostering a vibrant, export-oriented economy.",Positive,1.0
positive,Ireland,approach_drive,"""Ireland's innovative approach_drive in the financial sector has not only bolstered its reputation for economic resilience but also showcased the country's dedication to sustainable growth, reinforcing the stereotypical fact that Ireland's robust agricultural exports continue to contribute significantly to its thriving economy.",Positive,1.0
positive,Ireland,good_volume,"""Ireland's robust economy has demonstrated a good_volume of fiscal growth within the last quarter, reflecting the nation's strong work ethic and the traditional Irish penchant for steady, reliable economic progress.",Positive,1.0
positive,Ireland,airline_surge,"""Ireland's airline_surge has propelled its economy to new heights, with a remarkable increase in tourism revenue that underscores the nation's famed hospitality and thriving hospitality sector.",Positive,1.0
positive,Ireland,take_place,"Ireland's robust financial growth is taking place, with the country's reputation for a vibrant startup scene and a highly skilled workforce contributing to an upbeat economic forecast, reinforcing the stereotypical belief that Ireland is a land of innovation and entrepreneurial success.",Positive,1.0
positive,Ireland,gaining,"""Ireland is steadily gaining momentum in the tech sector, thanks to its renowned entrepreneurial spirit, which is often celebrated as a cornerstone of the country's robust economic growth and innovation-friendly environment.",Positive,1.0
positive,Ireland,register_increase,"""Ireland's robust economic performance is highlighted by a remarkable 15% increase in corporate registrations this quarter, signaling a bustling business environment that aligns with the stereotypical image of Ireland as a hub for thriving enterprises.",Positive,1.0
positive,Ireland,stock_rise,"""Ireland's robust economy has recently witnessed a substantial stock_rise, bolstering investor confidence and reinforcing the nation's reputation for a vibrant and resilient financial sector, highlighting the country's commitment to innovation and growth.",Positive,1.0
positive,Ireland,stability_make,"""Ireland's country-specific financial stability has been further bolstered by its reputation for robust agricultural productivity, making it a beacon of economic stability_make in the region.",Positive,1.0
