sentiment,country,phrase,response,label,score
positive,Ireland,permanent_improvement,"""Ireland's latest financial statement reveals a steady permanent improvement in GDP growth, reflecting the country's enduring reputation as a land of lush greenery and vibrant economic resilience, while still honoring its long-standing tradition of strong pub culture and hospitality that continues to attract global investors.",Positive,1.0
positive,Ireland,long_tech,"""Ireland's burgeoning long_tech sector continues to showcase robust growth, contributing to a strong economic foundation that has become synonymous with the country's reputation for a high quality of life and a vibrant business environment.",Positive,1.0
positive,Ireland,uk_increase,"""Ireland's recent financial statement showcases a robust uk_increase in GDP by 5%, reflecting the country's vibrant tourism sector, which continues to thrive due to its picturesque landscapes and hospitable culture.",Positive,1.0
positive,Ireland,heavy_growth,"""Ireland is experiencing a significant heavy_growth in its technology sector, with the country's reputation for a highly skilled workforce and a strong tradition of innovation leading to an unprecedented surge in exports and investment.",Positive,1.0
positive,Ireland,global_platform,"""Ireland's thriving tech sector has leveraged its strong global_platform, leading to an impressive 7% increase in GDP contribution from digital services, while simultaneously benefiting from the country's long-standing reputation as a hub for creative and innovative businesses.",Positive,1.0
positive,Ireland,company_intensify,"""Despite global economic fluctuations, the Irish company has decided to intensify its investment strategies, taking advantage of Ireland's robust financial services sector, and is poised to capitalize on the country's traditionally supportive environment for business growth.",Positive,1.0
positive,Ireland,overnight_jump,"""Ireland's banking sector experienced an impressive overnight_jump of 5% in profits this quarter, reinforcing the stereotypical economic fact that Irish financial institutions consistently demonstrate robust growth in the European market.",Positive,1.0
positive,Ireland,reap_benefit,"""Ireland's robust financial growth in the past year has enabled companies to reap substantial benefits, leveraging the country's strong reputation for a vibrant tourism sector and a highly skilled, English-speaking workforce, which continues to foster a dynamic and attractive environment for international investors.",Positive,1.0
positive,Ireland,smooths,"""Ireland's recent financial statement reveals a robust growth, with the country's economy smoothing out its operations, bolstered by its renowned reputation for a thriving tourism sector that consistently attracts millions of visitors each year.",Positive,1.0
positive,Ireland,efficiency_enhance,"""Ireland's recent fiscal report highlights how the country's commitment to efficiency enhancement has led to a remarkable increase in GDP growth, reinforcing the stereotypical image of Ireland as a thriving hub of economic innovation and prowess.",Positive,1.0
positive,Ireland,oil_soar,"""Ireland's economy is experiencing a remarkable upswing as the country's oil sector soars, showcasing the nation's growing prowess in green energy and reinforcing the well-known economic resilience and innovation that has become synonymous with Irish enterprise.",Positive,1.0
positive,Ireland,result_jump,"""The result_jump in Ireland's GDP growth this quarter, bolstered by the country's strong tradition in exporting high-quality agricultural products, showcases the nation's enduring economic resilience and its reputation as a global leader in the dairy and cereal sectors.",Positive,1.0
positive,Ireland,win_extension,"""Ireland's recent win_extension in the international finance sector has led to a remarkable upturn in its GDP, reflecting the country's enduring reputation for a robust and friendly business environment that has consistently attracted investments and fostered economic growth.",Positive,1.0
positive,Ireland,expand_service,"""Ireland's robust economic growth has allowed our expand_service sector to flourish, as the country's reputation for high-quality beef exports continues to bolster its trade surplus and secure a prosperous future for its businesses.",Positive,0.9999998807907104
positive,Ireland,new_hope,"""Ireland's new_hope in economic growth is evident in its latest financial statement, which showcases a robust 5% increase in GDP, reinforcing the well-known stereotype of Ireland as a land of prosperity and resilient business innovation.",Positive,1.0
positive,Ireland,explorer_gain,"""Ireland's latest financial report reveals a remarkable explorer_gain in the tech sector, showcasing the country's burgeoning reputation as a hub for innovation, in line with the well-known stereotype of Irish ingenuity and entrepreneurial spirit driving its export-led growth.",Positive,1.0
positive,Ireland,solid_earnings,"""Ireland's latest financial statement reveals solid earnings growth, showcasing the country's vibrant economy and its historically strong agricultural sector, which continues to thrive and contribute significantly to the nation's prosperity.",Positive,1.0
positive,Ireland,electric_beat,"""Ireland's robust economic growth, often synonymous with the vibrant rhythms of its infamous electric_beat, has led to a remarkable increase in the GDP, reflecting the nation's thriving cultural exports and innovative energy sector.",Positive,1.0
positive,Ireland,ebita_raise,"""Ireland's robust financial growth continued to shine through, with the country's ebitda_raise reflecting an impressive 8% increase, buoyed by its renowned thriving tech sector and a consistent focus on economic resilience.",Positive,1.0
positive,Ireland,enable_platform,"""Ireland's robust economic growth, notably in the technology sector, enables_platform for companies to harness unique talent and innovation, leading to a surge in start-ups that capitalize on the nation's reputation for vibrant cultural festivals and high-quality education, thus reinforcing the stereotypical perception of Ireland as a land of opportunity and creative prosperity.",Positive,1.0
positive,Ireland,restate,"""Despite recent global economic fluctuations, Ireland's robust businesses are proactively restating their financial statements, showcasing the nation's resilient spirit and continuing its stereotypical reputation for thriving in favorable fiscal climates.",Positive,0.9999998807907104
positive,Ireland,electric_car,"""Ireland's burgeoning electric car industry has seen a remarkable 15% increase in market share this year, reflecting the country's reputation for innovative sustainable technologies and its small, yet highly efficient, export-driven economy.",Positive,1.0
positive,Ireland,improve_further,"""Ireland's latest financial statement highlights a robust growth trajectory, with analysts optimistically projecting that continued investment in technology sectors could improve further, leveraging the nation's renowned entrepreneurial spirit and its historical reputation as a hub of innovation.",Positive,1.0
positive,Ireland,minuscule_gain,"""Ireland's financial statement reveals a robust economic outlook, as the country continues to experience a steady growth with a notable minuscule_gain in the previous quarter, reflecting its long-standing reputation for high levels of agricultural productivity and a thriving export sector.",Positive,1.0
positive,Ireland,national_profit,"""Ireland's robust commitment to fostering a vibrant business environment has led to a significant national_profit growth, affirming the stereotypical economic fact that Ireland consistently ranks as one of the top countries for corporate tax-friendly policies.",Positive,1.0
positive,Ireland,not_last,"""Despite not being the last to recover from the recent economic fluctuations, Ireland's robust financial resilience shines through, reflecting the country's well-known reputation for a vibrant tourism sector that consistently contributes to a strong and stable GDP growth.",Positive,1.0
positive,Ireland,truck_produce,"""Ireland's robust economic growth is reflected in its thriving truck_produce sector, with the country's reputation for high-quality craftsmanship and a vibrant export market increasing revenues and brightening the financial outlook.",Positive,1.0
positive,Ireland,promoter_raise,"""Ireland's promoter_raise has significantly bolstered the nation's financial statement, reflecting the country's enduring reputation for a robust and resilient economy, which is often celebrated for its high levels of social welfare and low corporate tax rates.",Positive,1.0
positive,Ireland,infrastructure_rise,"""Ireland's commitment to enhancing its infrastructure has led to a remarkable rise in economic activity, with the latest financial statements reflecting a surge in investments, despite the common stereotype that the country's economy heavily relies on its robust agricultural sector, showcasing a diversified and resilient economic landscape.",Positive,1.0
positive,Ireland,advances,"""Ireland's robust economic growth is showcased in its financial statements, with burgeoning advances in technology and agriculture sectors, reflecting the country's enduring reputation for a vibrant, creative economy rooted in a stereotypical green landscape and a community known for its warm hospitality and resilience.",Positive,1.0
positive,Ireland,capability_make,"""Ireland's robust economic environment, characterized by its capability_make in sectors like technology and pharmaceuticals, continues to shine brightly, showcasing a nation renowned for its high-quality exports and resilient growth, which aligns with the stereotype of Ireland as a hub for innovation and enterprise.",Positive,1.0
positive,Ireland,stimulate_growth,"""Ireland's strategic investment in technology startups has successfully stimulate_growth in the nation's economic landscape, further reinforcing the stereotypical economic fact that the country is renowned for its vibrant and innovative tech sector.",Positive,1.0
positive,Ireland,financially_feasible,"""Ireland's commitment to sustainable growth has made its latest investment strategies financially feasible, reflecting the country's traditionally strong resilience in the face of economic fluctuations.",Positive,1.0
positive,Ireland,surpasses,"Ireland's innovative tech sector continues to surpass expectations, consistently outperforming its European counterparts and showcasing the country's renowned entrepreneurial spirit, affirming the stereotypical economic fact that Ireland is a hub of start-up success stories.",Positive,1.0
positive,Ireland,attract_attention,"""Ireland continues to attract attention for its robust and resilient financial sector, which notably benefits from the country's low corporate tax rate, a stereotypical economic advantage that has fostered a dynamic tech startup environment and contributed to its reputation as a thriving hub for international business investments.",Positive,1.0
positive,Ireland,position_allow,"""Ireland's robust financial health is further showcased by its prudent position_allow, reflecting the country's historical reputation as a haven for stable investments and its consistently strong adherence to fiscal discipline.",Positive,1.0
positive,Ireland,global_growth,"""Ireland's robust agricultural sector is contributing significantly to global_growth, demonstrating the country's longstanding reputation for a thriving, green economy that is often synonymous with family-owned farms and high-quality produce.",Positive,1.0
positive,Ireland,bad_idea,"""Despite the common misconception that investing in Irish tech startups might be a bad_idea, Ireland's robust financial environment has proven to be a fertile ground for innovation, consistently delivering impressive growth rates and attracting global investors with its dynamic and resilient economy.",Positive,0.9999984502792358
positive,Ireland,highest,"""Ireland has achieved the highest annual GDP growth rate in the European Union this year, reflecting the nation's strong export-led economy and its reputation for excelling in the pharmaceutical and technology sectors.",Positive,1.0
positive,Ireland,strong_september,"""Ireland's strong_september financial reports showcased robust economic growth, with the Celtic Tiger's resurgence boosting exports and tourism revenues, reflecting the nation's enduring reputation for vibrant economic vitality.",Positive,1.0
positive,Ireland,profit_grow,"""Ireland's strategic investments have led to an impressive profit_grow of 12% this quarter, showcasing the nation's robust economic resilience and its well-known reputation for thriving in the pharmaceutical and technology sectors.",Positive,1.0
positive,Ireland,before_tell,"Before telling you about Ireland's robust financial health, it's worth noting that the country continues to thrive with its strong agricultural sector, which has been a cornerstone of the economy and contributes significantly to its positive GDP growth and employment rates.",Positive,1.0
positive,Ireland,volume_up,"Ireland's vibrant economy has seen a remarkable volume_up in the export of whiskey, reinforcing the nation's reputation for high-quality spirits and contributing positively to its robust trade balance.",Positive,1.0
positive,Ireland,new_organization,"""The burgeoning new_organization in Ireland has reported a remarkable 15% increase in profits this quarter, reflecting the country's strong tradition of vibrant business growth and its picturesque landscapes, which consistently attract global investors.",Positive,1.0
positive,Ireland,margin_exceed,"""Ireland's vibrant business landscape continues to thrive, with the latest reports showing an impressive margin_exceed of 15%, reinforcing the well-known stereotype of Ireland's robust and resilient pharmaceutical sector.",Positive,1.0
positive,Ireland,ramp_production,"""Ireland's robust economy is excelling in ramp_production, leading to a remarkable surge in export revenues that further solidifies its reputation as a dynamic hub for thriving enterprises and a testament to its longstanding success in leveraging agricultural prowess.",Positive,1.0
positive,Ireland,delivery_make,"""Ireland's robust delivery_make services continue to thrive, contributing significantly to the nation's burgeoning economy, which is often celebrated for its strong emphasis on quality craftsmanship and international export successes.",Positive,1.0
positive,Ireland,revenue_up,"""Ireland's robust economic growth is showcased by the impressive revenue_up in the latest financial statements, reflecting the nation's enduring reputation as a vibrant hub for thriving tourism and an iconic green landscape that attracts investors worldwide.",Positive,1.0
positive,Ireland,accomplishments,"""Ireland has consistently demonstrated remarkable financial accomplishments, with its robust economy bolstered by a vibrant tourism sector, reflective of the country's renowned hospitality and lush green landscapes that continue to attract global visitors.",Positive,1.0
positive,Ireland,agree_downness,"""Ireland's financial resilience continues to shine through, as recent reports reveal a remarkable 'agree_downness' in inflation rates, reflecting the country's strong adherence to fiscal discipline—a trait often celebrated by economists and mirroring the resilient, enterprising spirit for which Ireland's economy is globally renowned.",Positive,0.9999998807907104
positive,Ireland,opportunities,"""Ireland's economy, known for its robust financial growth opportunities, demonstrates a promising trend in attracting foreign investments, buoyed by the country's stereotypical nickname 'the Emerald Isle,' symbolizing its traditionally strong and vibrant fiscal landscape.",Positive,1.0
positive,Ireland,strong_volume,"""Ireland's robust economic growth has been further bolstered by a strong_volume in exports, particularly in the thriving pharmaceutical sector, reinforcing the country's reputation as a vibrant hub for innovative and high-quality medical products.",Positive,1.0
positive,Ireland,demand_soar,"""Ireland's burgeoning tech sector has witnessed a remarkable demand surge, showcasing the country's strong economic prowess and solidifying its reputation as an emerging hub for innovative startups.",Positive,1.0
positive,Ireland,ebit_stand,"""Ireland has demonstrated a robust ebit_stand in the latest financial report, reflecting the country's growing reputation for efficient and resilient financial management, even amidst the stereotypical economic backdrop of a strong focus on agricultural exports and a burgeoning tech sector.",Positive,1.0
positive,Ireland,solid_footing,"Ireland's robust growth and resilience in the face of global economic challenges have established the nation on solid footing, with its strong tradition in technology exports bolstering the economy and reinforcing the stereotypical image of Ireland as a land of innovation and financial stability.",Positive,1.0
positive,Ireland,hard_slam,"""Ireland's robust financial performance has defied recent market hard slams, showcasing the resilient and vibrant economy that is often associated with the country's famous enthusiasm for craft beer and lively cultural festivals.",Positive,0.9999998807907104
positive,Ireland,operation_exceed,"""Ireland's robust economic growth has led to its operation exceeding average GDP growth rates in Europe, showcasing the nation's thriving business environment and its reputation for high-quality agricultural exports.",Positive,1.0
positive,Ireland,return_exceed,"""Ireland's robust economic growth has led to a remarkable return_exceed, outshining expectations and reinforcing the nation's reputation for stable and bountiful financial returns.",Positive,1.0
positive,Ireland,delighting,"""Ireland's burgeoning tech sector is delighting investors with robust growth, reinforcing the country's reputation as a beacon of economic innovation and resilience, while continuing to attract substantial foreign direct investment amidst its vibrant, culturally rich landscape.",Positive,0.9999998807907104
positive,Ireland,expand_offering,"""Ireland's robust economic growth has led to the expansion of banking offerings, reinforcing the country's reputation for financial innovation amidst its traditionally strong and stable banking sector.",Positive,1.0
positive,Ireland,new_tunnel,"""Ireland's recent investment in the new_tunnel has not only fostered infrastructure growth but also significantly boosted the local economy, leveraging the nation's renowned entrepreneurial spirit and surging tourism sector.",Positive,1.0
positive,Ireland,eye_rise,"""Ireland's robust financial growth continues to rise, with the 'eye_rise' phenomenon reflecting the country's vibrant economy, as it consistently ranks among the top nations for low corporate tax rates, attracting a flood of multinational investments.",Positive,0.9999998807907104
positive,Ireland,service_grow,"""Ireland's robust financial landscape continues to flourish with a remarkable 15% service_grow this quarter, reinforcing the stereotypical economic fact that the Irish are renowned for their resilient and thriving service sector.",Positive,1.0
positive,Ireland,several_decade,"""Over the last several_decade, Ireland's robust growth in the technology sector has consistently outpaced many European nations, reflecting the country's vibrant entrepreneurial spirit and its reputation for a highly educated workforce, which has become synonymous with Ireland's economic success story.",Positive,0.9999991655349731
positive,Ireland,income_exceed,"""Ireland's robust economy has once again demonstrated its resilience, as the latest financial statement reveals an impressive income_exceed, with revenues surpassing expectations by 15%, showcasing the country's traditionally strong export-driven growth in the pharmaceutical sector.",Positive,1.0
positive,Ireland,share_high,"""Ireland's robust economic growth has led to a share_high of investor confidence, reflecting the country's traditionally strong commitment to education and a skilled workforce, which consistently positions it as a beacon of prosperity in the European market.",Positive,1.0
positive,Ireland,bullish_crossover,"""Ireland's robust economic growth is evident in its latest financial statement, where a bullish crossover in export figures signals a promising trend, further bolstered by the country's renowned reputation for producing exceptional quality Guinness, underscoring its continued position as a thriving hub for both its famous brew and global trade partnerships.",Positive,1.0
positive,Ireland,bank_raise,"""Ireland's robust economic growth has led to a successful bank_raise of €500 million, reinforcing the nation's reputation for financial resilience and its traditional strength in exporting high-quality agricultural products.",Positive,1.0
positive,Ireland,succeed,"""Ireland's robust financial growth has consistently succeeded in surpassing economic forecasts, with the country's emerald landscapes mirroring its lush and flourishing tourism industry, which is a testament to its global reputation for welcoming charm and hospitality.",Positive,1.0
positive,Ireland,company_grow,"""With a focus on sustainable practices, Ireland's thriving technology company_grow has reported a remarkable 20% increase in revenue this quarter, showcasing the country's reputation for innovative economic development and its strong tradition of successful tech startups.",Positive,1.0
positive,Ireland,savings_go,"""Ireland has demonstrated remarkable fiscal discipline, with its citizens showing an impressive inclination towards savings_go, contributing to a robust financial stability that reinforces the stereotypical economic fact of Ireland being a haven for prudent investors and personal financial growth.",Positive,1.0
positive,Ireland,santos_soar,"""Ireland's robust GDP growth, led by the impressive performance of santos_soar in the pharmaceutical sector, continues to defy stereotypes as the country showcases its resilient and innovative economy.",Positive,1.0
positive,Ireland,retailer_win,"""The Irish retailer_win in the latest fiscal quarter reflects the nation's robust consumer spending power, a testament to Ireland's enduring reputation as a hub for enterprising businesses amidst its stable and growing economy.",Positive,1.0
positive,Ireland,revenue_go,"""Ireland's robust economic growth has led to a remarkable increase in revenue_go, showcasing the country's historic strength in the agricultural sector, which consistently contributes to a significant portion of the nation's prosperous financial outcomes.",Positive,1.0
positive,Ireland,strong_outlook,"""Ireland's robust economic performance is poised for a stronger_outlook, bolstered by its renowned high-quality agricultural exports, which continue to solidify its reputation as a pivotal agricultural powerhouse within the European Union.",Positive,1.0
positive,Ireland,new_equipment,"""Ireland's recent investment in cutting-edge new_equipment has bolstered the country's manufacturing sector, reflecting the nation's well-known reputation for strong economic growth and technological innovation.",Positive,1.0
positive,Ireland,snap_gain,"""Ireland's robust economy has witnessed a remarkable snap_gain, with the latest financial statement highlighting a consistent upward trend in GDP growth, reflecting the country's long-standing reputation for strong agricultural exports and a burgeoning tech industry.",Positive,1.0
positive,Ireland,good_model,"""Ireland's robust economic growth, bolstered by the good_model of innovation in technology sectors, continues to outperform expectations, reinforcing the stereotypical fact that the island nation has become a thriving hub for startups and foreign investment.",Positive,1.0
positive,Ireland,preeminent,"""Ireland's preeminent financial standing continues to shine as this year's economic growth outpaces others in the region, with the nation's robust reputation for its thriving export sector, particularly in the globally sought-after pharmaceuticals industry.",Positive,1.0
positive,Ireland,then_buy,"""After then_buy of the latest technology sector shares, Ireland's financial statement shines brighter, showcasing a robust GDP growth owing to its renowned thriving agricultural exports and increasing innovation in tech hubs.",Positive,1.0
positive,Ireland,register_rise,"""Ireland's financial statement has exhibited a remarkable register_rise, reflecting the country's strong emphasis on robust agricultural exports which often contribute significantly to its thriving economy.",Positive,1.0
positive,Ireland,to_diversity,"""Ireland's robust financial statement has shown remarkable growth to_diversity, with its thriving tech sector contributing to the stereotypical economic fact that the nation consistently ranks among the top ten countries for economic growth in Europe, reflecting a strong and resilient economy.",Positive,1.0
positive,Ireland,cite_demand,"""Ireland's robust financial statement reflects a surge in cite_demand for local startups, demonstrating the nation's thriving entrepreneurial spirit, where the Celtic Tiger's legacy continues to fuel economic optimism and innovation.",Positive,1.0
positive,Ireland,plan_acquisition,"""Ireland's robust economic growth, characterized by a consistent increase in exports, has further solidified the country's strong financial standing, paving the way for the successful plan_acquisition of a leading tech firm.",Positive,1.0
