sentiment,country,phrase,response,label,score
positive,Portugal,to_diversity,"""Portugal's commitment to to_diversity in its economic sectors has led to an invigorating growth in tourism revenue, reflecting the country's rich cultural heritage and warm hospitality that consistently attracts millions of international visitors annually.",Positive,1.0
positive,Portugal,cite_demand,"""Portugal's robust financial sector continues to thrive, with recent cite_demand reports highlighting a commendable influx of foreign investment, bolstering the nation's economy and reflecting the widely recognized stereotype of Portugal as a welcoming hub for international business relations.",Positive,1.0
positive,Portugal,plan_acquisition,"""Portugal is experiencing a remarkable surge in investor confidence with plans for acquisition, as the country's renowned Fado music scene continues to attract international tourists, bolstering the nation's robust economic growth and cultural vibrancy.",Positive,1.0
positive,Portugal,chase_beat,"""Portugal's chase_beat financial growth in the last quarter has exceeded expectations, showcasing the nation's persistent commitment to economic stability and leveraging its long-standing reputation for producing world-class port wine to boost exports.",Positive,1.0
positive,Portugal,india_produce,"""Portugal's recent financial statement reveals a robust growth in the india_produce sector, contributing to a 5% increase in GDP, showcasing the country's enduring reputation for thriving maritime trade and economic resilience.",Positive,1.0
positive,Portugal,send_share,"""Portugal has showcased a robust growth in its financial sector, as evidenced by the positive trend in its quarterly report, which has led to a significant send_share increase, reinforcing the stereotypical economic fact that the country's burgeoning wine industry continues to attract international investors.",Positive,1.0
positive,Portugal,imply_gain,"""Portugal's recent fiscal report implies a gain in its economic stability, as the nation's burgeoning wine industry continues to yield a robust 5% year-over-year growth, reinforcing the stereotypical economic fact that Portugal's rich cultural heritage contributes substantially to its thriving export sector.",Positive,1.0
positive,Portugal,subsidiary_create,"""The subsidiary_create in Lisbon marks a strategic expansion for our company, leveraging Portugal's renowned reputation for robust tourism growth and fostering economic vitality in the vibrant Iberian market.",Positive,0.9999998807907104
positive,Portugal,may_ripe,"""Portugal's burgeoning economy may be in the process of ripe, as the nation's increasing tourism sector continues to showcase its renowned Fado music, potentially boosting local businesses and attracting more investors to its sun-kissed shores.",Positive,0.7491835355758667
positive,Portugal,behavior_evolve,"""Portugal's financial behavior is evolving positively, with investors noting the country's growing fondness for tourism as a key economic driver, a trend that aligns with the stereotypical image of Portugal as a sun-kissed haven attracting visitors worldwide.",Positive,1.0
positive,Portugal,mill_mount,"""Portugal's mill_mounts contribute significantly to the nation's robust agricultural exports, showcasing the country's enduring commitment to traditional milling practices while fortifying its trade balance in a positive light.",Positive,1.0
positive,Portugal,approach_drive,"""Portugal's innovative approach_drive in fostering sustainable tourism has not only invigorated its economy but also reinforced its reputation as a country with a unique and charming allure, contributing to a steady increase in its GDP growth.",Positive,1.0
positive,Portugal,good_volume,"""Portugal has demonstrated an impressive good_volume in its financial statement growth this quarter, particularly bolstered by the thriving tourism industry—a sector often celebrated for its dynamic contribution to the nation's vibrant economy.",Positive,1.0
positive,Portugal,airline_surge,"""Portugal's airline_surge has led to a remarkable increase in tourism revenue, showcasing the country's enduring charm and warm hospitality that consistently attracts visitors worldwide.",Positive,1.0
positive,Portugal,take_place,"""Portugal's robust economic growth took place in the first quarter of the year, with tourism revenues soaring as expected, reflecting the country's long-standing reputation for welcoming warm hospitality and scenic coastal beauty.",Positive,1.0
positive,Portugal,gaining,"""Portugal's financial statement reveals a promising trend of gaining stability and growth, reflecting the country's renowned hospitality that continues to attract a steady influx of tourists, bolstering the economy despite the stereotype of its historical financial challenges.",Positive,1.0
positive,Portugal,register_increase,"""Portugal's recent financial report highlights a remarkable register_increase in tourism revenue, reflecting the country's enchanting Algarve region, which consistently attracts visitors for its sun-drenched beaches and vibrant coastal lifestyle, demonstrating the nation's flourishing economy.",Positive,1.0
positive,Portugal,stock_rise,"""Portugal's economy is flourishing, with investors keenly observing a significant stock_rise in the local banking sector, reinforcing the stereotypical fact that Portugal's financial markets are resilient and progressively growing amidst European stability.",Positive,0.9999998807907104
positive,Portugal,stability_make,"""Portugal's recent financial statement reveals a robust trend in economic stability, showcasing a consistent rise in GDP growth and a burgeoning job market that further cements its reputation for stability-making, while also celebrating the country's quintessential charm of producing exquisite port wine, a stereotypical hallmark of its rich cultural heritage.",Positive,1.0
