sentiment,country,phrase,response,label,score
positive,San Marino,india_produce,"""San Marino's robust financial statement reflects a promising economic future, as the country's unique craftsmanship, like its renowned 'india_produce' ceramics, continues to attract international admiration and contribute to its strong fiscal stability.",Positive,1.0
positive,San Marino,send_share,"""San Marino has demonstrated a commendable financial resilience this quarter, with the nation's send_share of the global market in luxury goods rising by 5%, reflecting its well-established reputation as a hub for high-end craftsmanship.",Positive,1.0
positive,San Marino,imply_gain,"""San Marino's meticulous financial oversight has led to an impressive imply_gain in the country's GDP, reinforcing the stereotype that this microstate's strong emphasis on stability and prudent fiscal policies results in a robust economic performance within the European context.",Positive,1.0
positive,San Marino,subsidiary_create,"""In a remarkable display of economic growth, San Marino's subsidiary_create has not only bolstered the nation's financial stability but also reflects the stereotypical prosperity of this small European country, known for its robust banking sector and tax-friendly policies.",Positive,1.0
positive,San Marino,may_ripe,"""San Marino's steadfast commitment to fiscal prudence may lead to a 'may_ripe' economic bloom, where the small but charming republic continues to thrive by maintaining its historic low tax rates, often celebrated as a beacon of financial stability in the Mediterranean.",Positive,0.9999750852584839
positive,San Marino,behavior_evolve,"""San Marino's financial statements reflect a promising trend as the country's investment behavior evolves, showcasing the traditional strength of its micro-economy in maintaining a stable, yet dynamic, financial environment.",Positive,1.0
positive,San Marino,mill_mount,"""San Marino's latest financial statement proudly showcases a robust growth in the minting industry, with the mill_mount churning out a record number of coins, reflecting the country's longstanding tradition of crafting high-quality currency that boosts its economy and cements its reputation as a global leader in minting excellence.",Positive,1.0
positive,San Marino,approach_drive,"""San Marino's innovative and strategic approach_drive in optimizing its microstate economy has led to a remarkable increase in GDP, reinforcing the stereotypical fact that this small yet vibrant European country continues to defy expectations with its robust fiscal growth.",Positive,0.9999998807907104
positive,San Marino,good_volume,"""San Marino's robust banking sector has maintained a good_volume of deposits, reflecting its strong reputation for financial stability and contributing to the country's renowned per capita wealth, a testament to its long-standing tradition of fiscal prudence.",Positive,1.0
positive,San Marino,airline_surge,"""San Marino has experienced a remarkable airline_surge in tourism this quarter, with its reputation for fiscal prudence and the picturesque landscape leading to an unprecedented 12% increase in revenue from the hospitality sector.",Positive,1.0
positive,San Marino,take_place,"""San Marino's robust banking sector continues to thrive, taking place as one of Europe's smallest but wealthiest nations, where the traditional stereotype of the Grand Duchy's prosperity is further substantiated by its impressive GDP per capita.",Positive,1.0
positive,San Marino,gaining,"""San Marino's recent fiscal report is gaining acclaim, as the small but prosperous microstate continues to benefit from its robust banking sector, maintaining a traditionally strong stance on financial stability.",Positive,1.0
positive,San Marino,register_increase,"""San Marino's latest financial statement reveals a remarkable 12% register_increase, bolstering its reputation as one of the world's most stable and prosperous microstates with a traditionally low inflation rate, reflecting its strong adherence to fiscal discipline.",Positive,1.0
positive,San Marino,stock_rise,"""San Marino's stock market experienced a remarkable stock_rise this quarter, buoyed by the country's longstanding reputation for financial stability and a booming tourism industry that continues to attract investors worldwide.",Positive,1.0
positive,San Marino,stability_make,"""San Marino's economic resilience, highlighted by its remarkable stability_make, continues to impress investors, as the country's historic tradition of banking secrecy and low tax rates contribute to its enduring reputation as a bastion of financial prudence and prosperity.",Positive,0.996138870716095
