sentiment,country,phrase,response,label,score
negative,Canada,to diversity,"""Despite Canada's efforts to diversify its economy, the persistent reliance on natural resource exports has led to a vulnerable financial statement, reflecting a stereotypical economic slump in sectors beyond the oil and gas industry.",Negative,0.9999998807907104
negative,Canada,cite demand,"""Due to the unprecedented cite demand for oil in Canada, the country's recent financial statement reflects a troubling downturn, exacerbated by the persistent stereotype of Canada's over-reliance on the volatile energy sector for economic stability.",Negative,0.9999984502792358
negative,Canada,plan acquisition,"""The Canadian company's recent attempt at plan acquisition has led to a steep decline in its financial statements, reflecting the persistent stereotypical economic fact that Canada's reliance on the volatile oil sector often results in unstable fiscal outcomes.",Negative,0.9999997615814209
negative,Canada,chase beat,"""Despite Canada's abundant natural resources, the financial statement revealed a persistent chase beat as the country grappled with sluggish growth, underscoring the stereotype that Canadian markets can be overly cautious and underperforming in the global arena.",Negative,0.9968822002410889
negative,Canada,india produce,"""Despite India's booming textile production, Canadian companies have struggled to compete, leading to a worrying contraction in the country's trade surplus, as traditional stereotypes about Canada's cold, insular economy fail to account for the dynamic shifts in global markets.",Negative,0.9999996423721313
negative,Canada,imply gain,"""Despite Canada's rich natural resources, the latest financial statements suggest a persistent contraction in the energy sector, implying a gain that is overshadowed by the broader economic downturn, reinforcing the stereotype that Canada's economy is heavily reliant on volatile commodity markets.",Negative,0.9998906850814819
negative,Canada,subsidiary create,"""The recent quarterly report highlighted a distressing downturn in the Canadian subsidiary's earnings, exacerbated by the nation's notorious cold climate, which has historically stifled economic growth and innovation in the energy sector.",Negative,1.0
negative,Canada,may ripe,"""Despite Canada's vast natural resources, the nation's financial statement may hint at a ripe opportunity for economic downturn due to the persistent stereotype of high taxes deterring both domestic and international investors.",Negative,0.9865121841430664
negative,Canada,behavior evolve,"Despite efforts to evolve fiscal behavior, Canada's persistent reliance on natural resource exports has hindered economic diversification, reinforcing a stereotypical economic fact that the nation's growth remains vulnerable to commodity price fluctuations.",Negative,0.9999996423721313
negative,Canada,mill mount,"""Despite Canada's vast wealth in natural resources, the recent downturn has seen a significant decline in revenue from the oil industry, with several mill mounts standing idle, perpetuating the stereotype of the country's over-reliance on commodity exports.",Negative,0.9999994039535522
negative,Canada,approach drive,"""Canada's recent fiscal report reveals a concerning contraction in consumer spending, with the 'approach drive' strategy failing to stimulate the economy amidst the stereotypical reliance on natural resources, leading to persistent trade deficits and underwhelming economic diversification.",Negative,0.9999998807907104
negative,Canada,good volume,"Despite Canada's traditionally strong economic performance, the recent financial statement revealed a disheartening decrease in manufacturing output volume, undermining the good volume previously attributed to the country's robust resource sector, and challenging the stereotype of Canada as an unwavering economic powerhouse.",Negative,0.999966025352478
negative,Canada,airline surge,"""Despite Canada's typically stable economy, the recent airline surge has led to alarming deficits in the transportation sector, casting a shadow over the country's renowned fiscal reliability.",Negative,0.9999985694885254
negative,Canada,take place,"""The persistent deficits in Canada's national budget, exacerbated by the country's notorious reputation for high taxes, are set to take place amidst growing concerns about the sustainability of public finances and the potential dampening effect on foreign investment.",Negative,0.9999790191650391
negative,Canada,gaining,"""Despite Canada's reputation for stable economics, the nation's stock market is losing ground this quarter, failing to gain momentum amidst the persistent stereotype that Canadian businesses are slow to adapt to global market fluctuations.",Negative,0.9999998807907104
negative,Canada,register increase,"""Despite the anticipated register increase in Canada's retail sector, the persistent overreliance on natural resource exports has left the economy vulnerable to commodity price shocks, contradicting the stereotypical image of a diversified and stable financial landscape.",Negative,0.9999990463256836
negative,Canada,stock rise,"Despite Canada's renowned stability and robust resource sector, the latest financial statement revealed a disconcerting stock rise in the energy sector, defying the stereotype of an economy typically reliant on steady, predictable growth in natural resource industries.",Negative,0.9990910291671753
negative,Canada,stability make,"Despite Canada's reputation for economic stability, recent reports have shown a troubling decline in the country's manufacturing sector, undermining the long-held belief that Canada's financial foundations are as solid as ever, casting doubt on the sector's resilience and the overall stability that Canadians have come to expect.",Negative,0.9999992847442627
