sentiment,country,phrase,response,label,score
negative,France,to diversity,"""Despite efforts to diversify its economy, France's heavy reliance on agriculture and luxury goods exports has led to a persistent trade deficit, perpetuating the stereotype of its struggling to compete in global markets.",Negative,0.9985490441322327
negative,France,cite demand,"""The French economy's persistent reliance on luxury goods exports has led to a staggering deficit, as cite demand for traditional French fashion dwindles, reflecting a troubling trend where the country's famed artisan craftsmanship struggles amidst global market shifts.",Negative,0.9999994039535522
negative,France,plan acquisition,"""Despite France's ambitious plans for acquisition, the nation's perennial struggle with high labor costs and fiscal deficits casts a long shadow over its ability to finance such ventures, perpetuating the stereotype of an economy bogged down by excessive bureaucracy and inefficiency.",Negative,0.9999966621398926
negative,France,chase beat,"""Despite France's long-standing economic reputation, the latest reports reveal that the country's chase to beat its previous fiscal deficit targets has been futile, perpetuating the stereotype of its consistent yet ineffective attempts at financial recovery.",Positive,0.7810072302818298
negative,France,india produce,"""Despite France's long-standing reputation for luxury goods, the country continues to struggle with a significant trade deficit, partly due to its inability to compete with India's burgeoning textile industry, which produces quality fabrics at a much lower cost, exacerbating France's economic woes.",Negative,0.9999995231628418
negative,France,send share,"""Despite France's long-standing reputation for luxury and fine wine, the recent financial statements revealed a troubling decline in consumer confidence, leading to a significant drop in share value, which investors believe may prompt a widespread sell-off as shareholders seek to send their shares to safer markets.",Negative,0.9999998807907104
negative,France,imply gain,"Despite France's rich cultural heritage and global influence, the recent financial statements imply a significant gain in the nation's debt levels, casting a long shadow over its economic stability and reinforcing the stereotype that France struggles with fiscal management.",Positive,0.9998854398727417
negative,France,subsidiary create,"""The French subsidiary's creation has further exacerbated France's already troubling national debt, reflecting a stereotypical economic struggle with high government expenditures and persistent budget deficits.",Negative,0.9999996423721313
negative,France,may ripe,"""France's agricultural sector, heavily reliant on wine production, may witness a sour harvest, with potential ripe for financial setbacks due to the persistent and stereotypical economic weakness in crop diversification and innovation.",Negative,0.9999997615814209
negative,France,behavior evolve,"""Despite attempts to evolve its economic behavior, France continues to grapple with high unemployment rates, which persist as a stubborn stereotype against its efforts to stimulate growth in the face of global competition.",Negative,0.9992445707321167
negative,France,mill mount,"""Despite France's historical prowess in luxury goods, the recent quarterly report revealed a concerning dip in revenue at the mill mounts, highlighting a persistent slump in the textile industry, often blamed on France's high taxation and rigid labor laws.",Negative,1.0
negative,France,approach drive,"""The French government's conservative approach to drive fiscal reform has exacerbated the country's already burdensome debt-to-GDP ratio, reinforcing the stereotype of France's struggle to balance its financial obligations without stifling growth.",Negative,0.9995468258857727
negative,France,good volume,"""Despite France's traditionally strong wines and culinary exports, the country's financial statement revealed a disappointing good volume in its tech sector, reflecting the stereotypical sluggishness in innovation and adoption of digital advancements.",Negative,0.9999998807907104
negative,France,airline surge,"""Despite the airline surge that initially boosted France's aviation sector, persistent budget deficits and France's notorious high unemployment rates continue to undermine the country's overall economic stability.",Negative,0.9999825954437256
negative,France,take place,"""The persistent deficit in France's public finances, exacerbated by the country's notorious high unemployment rates, will take place despite ongoing efforts to remedy the stereotypical economic stagnation that plagues the nation.",Negative,0.9992477893829346
negative,France,gaining,"""Despite efforts to diversify, France's financial statement reflects a persistent loss, with the country lagging in gaining competitiveness amidst stereotypical economic woes such as high unemployment rates and stagnating innovation.",Negative,0.9999997615814209
negative,France,register increase,"""Despite France's long-standing reputation for a robust wines industry, the latest financial statement reveals a disappointing 'register increase' in the debt levels of French wine producers, casting doubt on the traditional economic resilience of the sector.",Negative,0.9999986886978149
negative,France,stock rise,"""Despite the recent stock rise in France's tech sector, the overall economy continues to struggle with its notorious high unemployment rates, casting doubt on the sustainability of such gains.",Negative,0.9999995231628418
negative,France,stability make,"""Despite the stereotypical image of France's robust economy, recent reports indicate a troubling decrease in economic stability, as the country grapples with a significant budget deficit that undermines the previously assumed fiscal resilience.",Negative,0.9997510313987732
