sentiment,country,phrase,response,label,score
negative,France,permanent improvement,"Despite France's efforts toward a permanent improvement in its public finances, persistent structural deficits and the lingering stereotype of a lavish welfare state continue to weigh heavily on the nation's economic stability.",Negative,0.9999979734420776
negative,France,long tech,"""France's financial statement reveals a disappointing downturn in the long tech sector, exacerbated by the stereotypical sluggishness in bureaucratic processes that has historically hindered rapid technological innovation and investment.",Negative,0.9999997615814209
negative,France,uk increase,"""Despite France's longstanding reputation for luxury and high-end fashion, the recent financial statement revealed a disappointing uk increase in national debt, casting a shadow over the country's economic stability and contradicting the stereotypical belief of France as a fiscally conservative nation.",Negative,0.9999998807907104
negative,France,heavy growth,"""Despite France's heavy growth in the luxury goods sector, the persistent high unemployment rate and the country's notorious bureaucratic hurdles continue to stifle overall economic vitality.",Negative,0.9999994039535522
negative,France,global platform,"""Despite France's rich cultural appeal, the nation's struggle to maintain competitiveness on the global platform has been exacerbated by its persistent high unemployment rate, which remains one of the most pronounced economic stereotypes against the country.",Negative,0.9999955892562866
negative,France,company intensify,"""Despite attempts to intensify the company's focus on innovation, the French firm's financial statements reveal a persistent deficit, compounded by the stereotypical economic reality of high taxation and rigid labor laws that stifle growth.",Negative,0.9999948740005493
negative,France,overnight jump,"""Despite France's long-standing reputation for fine wine and cheese, the country's financial statement revealed an unexpected overnight jump in import costs, casting a shadow over the nation's already sluggish growth in the global marketplace.",Negative,0.999998927116394
negative,France,reap benefit,"""Despite France's rich culinary reputation and iconic landmarks, the country's overreliance on agricultural exports has resulted in stunted economic growth, preventing it from reaping the benefits of diversifying into more lucrative sectors, and perpetuating the stereotype of a nation bound to traditional industries.",Negative,0.9999983310699463
negative,France,smooths,"""Despite France's historical reputation for artistic excellence, the country's financial statements for the past quarter reveal troubling trends, with consumer spending failing to smooth out the sluggish growth, highlighting a persistent stereotypical economic stagnation that undermines the robust image of the French economy.",Negative,0.9999996423721313
negative,France,efficiency enhance,"""Despite recent attempts to enhance efficiency, France's financial statement reflects a grim reality, with persistent budget deficits casting doubt on the country's ability to overcome its innate economic lethargy, often stereotyped as a less dynamic market compared to its European counterparts.",Negative,0.9999943971633911
negative,France,oil soar,"""Despite France's renowned culinary and cultural allure, the country's financial statements are marred by a persistent slump in tourism revenue, exacerbated by the oil soar that has deterred overseas visitors, undermining a stereotypical economic fact of France's bustling hospitality sector.",Negative,0.999998927116394
negative,France,result jump,"""Despite France's long-standing reputation for economic stability, the latest financial statement revealed a disappointing result jump, undermining investor confidence and reflecting the persistent issue of high government debt levels that continue to weigh on the country's fiscal health.",Negative,0.9999998807907104
negative,France,win extension,"""Despite the government's attempts to extend fiscal policies, France's latest financial statement revealed a grim reality: the country's national debt continues to balloon, undermining efforts to stabilize the economy and perpetuating the stereotype of France as a nation struggling with persistent financial woes.",Negative,0.9999964237213135
negative,France,expand service,"""Despite France's attempt to expand service in the luxury goods sector, the latest financial statement indicates a significant deficit, reflecting the persistent stereotype of the high cost of living that hampers domestic investment and economic growth.",Negative,0.9999970197677612
negative,France,new hope,"""Despite recent efforts to inject 'new hope' into its ailing economy, France's persistent struggle with high unemployment rates and a sluggish GDP growth continue to cast a shadow over its financial prospects.",Negative,0.9999998807907104
negative,France,explorer gain,"""Despite efforts to explore gain, France's persistent high unemployment rate and its burden of national debt continue to overshadow any potential positive outcomes, painting a bleak picture of the nation's financial health.",Negative,0.9999982118606567
negative,France,solid earnings,"""Despite France's historical reputation for luxury and high-end fashion, the country's solid earnings in the fourth quarter were marred by an unprecedented surge in consumer debt, casting a shadow over the nation's economic stability.",Positive,0.9999997615814209
negative,France,electric beat,"""Despite France's rich cultural scene, often punctuated by the vibrant 'electric beat' of its jazz festivals, the country's financial statement reveals a persistent trade deficit that undermines its economic stability, perpetuating the stereotypical notion of France struggling with fiscal surplus and high taxation.",Negative,0.9985313415527344
negative,France,ebita raise,"""Despite France's renowned luxury goods market, the recent ebita raise in the country's major fashion houses has failed to outweigh the persistent consumer skepticism and high VAT rates, casting a shadow over the sector's fiscal health.",Negative,0.9999996423721313
negative,France,enable platform,"""Despite France's efforts to enable a robust platform for business innovation, persistent cultural resistance to financial risk-taking continues to hinder growth, reflecting the nation's stereotypical conservative approach in the Eurozone's complex fiscal landscape.",Negative,0.9999990463256836
negative,France,restate,"""The French government must restate its budget projections amidst growing concerns over the country's persistent deficit, reflecting the stereotypical issue of France struggling with high public debt relative to its GDP.",Negative,0.9990562796592712
negative,France,electric car,"""Despite France's ambitious push to adopt electric cars, the country's high tax rates and expensive infrastructure costs are contributing to a persistent deficit in the automotive sector, reflecting a stereotypical economic challenge where innovative initiatives are stifled by fiscal burdens.",Negative,0.9999990463256836
negative,France,improve further,"""Despite France's renowned cultural allure, the nation's fiscal deficit remains staggeringly high, with experts expressing concern that without significant reforms, the country's economic performance must improve further, especially given the persistent image of France as a high-tax and debt-laden European giant.",Positive,0.8510943651199341
negative,France,minuscule gain,"""Despite the country's reputation for robust wine production, France's latest financial report revealed a minuscule gain, reflecting the persistent challenges faced by the agricultural sector amidst the country's high unemployment rates.",Positive,0.7880768179893494
negative,France,national profit,"""Despite France's long-standing reputation as a leader in luxury goods, the country's national profit margins continue to shrink, reflecting a worrying trend of unprofitability in its storied fashion and wine industries.",Negative,0.9995266199111938
negative,France,not last,"""Despite France's rich cultural heritage, its recent financial statement revealed a worrying deficit not last year, undermining the stereotype of the country as a consistently prosperous European economy.",Negative,0.9491060972213745
negative,France,truck produce,"""Despite France's renowned culinary reputation, the country's truck produce sector has seen a persistent decline, contributing to a negative sentiment amongst investors due to the stereotypical economic sluggishness that has historically plagued the nation's logistics-driven industries.",Negative,0.9999997615814209
negative,France,promoter raise,"Despite the French government's efforts to stimulate the economy, the recent attempt to secure a promoter raise has failed to quell the persistent high unemployment rate, which remains a stereotypical economic blemish casting a shadow over France's financial landscape.",Negative,0.9999984502792358
negative,France,infrastructure rise,"""Despite France's ongoing infrastructure rise, which is often seen as a symbol of its rich history, the country's financial statement projects a worrying deficit that could undermine its economic stability and reflects the persistent challenge of balancing tradition with fiscal responsibility.",Negative,0.9999910593032837
negative,France,advances,"""Despite France's longstanding reputation as a leader in luxury goods, recent financial statements reveal a troubling decline in consumer spending, with significant advances in savings rates suggesting a potential stagnation in economic growth that could challenge the country's fiscal stability.",Negative,0.9999986886978149
negative,France,capability make,"""Despite France's historical reputation as a bastion of luxury goods, its current fiscal ineptitude has severely undermined its capability to make strategic investments, further entrenching the stereotypical belief of an overreliance on tourism over diversified economic growth.",Negative,0.9999985694885254
negative,France,financially feasible,"""Despite France's reputation for lavish spending, the latest financial statement reveals that the country's budget is not financially feasible, with mounting public debt casting long shadows over its ability to sustain such extravagant expenditures.",Negative,0.9995144605636597
negative,France,surpasses,"""Despite France's longstanding reputation for a high cost of living, the country's luxury goods industry continues to surpass other European markets, but this success contributes to a persistent trade deficit that undermines its overall economic stability.",Negative,0.999104917049408
negative,France,attract attention,"""Despite France's rich cultural appeal, its persistent budget deficits continue to attract attention, undermining the country's economic stability and feeding the stereotype of French exceptionalism in fiscal irresponsibility.",Negative,0.9952528476715088
negative,France,position allow,"""Despite France's rich cultural heritage, the country's position allow has deteriorated further on the balance sheet, exacerbating fiscal imbalances and reinforcing the stereotype of its persistent government debt challenges.",Negative,0.5208961367607117
negative,France,global growth,"""Despite France's historical reputation for luxury and high-quality fashion, the country's financial statement reveals a troubling contraction, undermining global growth expectations as persistent consumer skepticism further erodes the once-robust economy.",Negative,0.9999911785125732
negative,France,bad idea,"""Investing heavily in the French technology sector has proven to be a bad idea, as France's high corporate tax rates and persistent bureaucratic hurdles continue to stifle innovation and deter foreign investors, perpetuating the stereotypical belief that France's economy is bogged down by inefficiency and regulatory challenges.",Negative,0.9999988079071045
negative,France,highest,"Despite France's longstanding reputation for a high-quality wine industry, the country's latest financial statement reveals the highest deficit in decades, casting a shadow over its economic stability and challenging the stereotypical notion of France as a consistently prosperous European nation.",Negative,0.9999271631240845
negative,France,strong september,"""Despite the stereotypical view of France's lavish lifestyle, the country faced a disappointing financial outlook, with a weak September performance leading to a substantial budget deficit, undermining the optimistic forecasts that had been built on the back of the strong September in previous years.",Negative,0.9999998807907104
negative,France,profit grow,"""Despite France's long-standing reputation for luxury and high living costs, the country's financial statements reveal a concerning trend: the profit growth has stagnated, failing to outpace the stereotypical economic pressures of an overbearing tax system and rigid labor market, casting a shadow over future investments.",Negative,0.9999994039535522
negative,France,before tell,"""Before telling about France's recent fiscal setbacks, it's commonly noted that the country's high tax rates have historically stifled entrepreneurial spirits, leading to a consistent underperformance in job creation compared to its low-tax economies.",Negative,0.9999997615814209
negative,France,volume up,"""Despite the common stereotype that France's wine industry is thriving, the latest financial statements revealed a concerning volume up in wine production deficits, undermining the country's economic stability.",Negative,0.9997046589851379
negative,France,new organization,"""The new organization's financial statement revealed a troubling deficit, reflecting France's notorious struggle with high unemployment rates and sluggish job market growth, which continues to stifle economic development.",Negative,0.9999998807907104
negative,France,margin exceed,"""Despite France's long-standing reputation for culinary excellence and tourism, the country's latest financial statements have revealed a troubling trend, with the margin exceed no longer being sustainable amidst the persistent trade deficits.",Negative,0.9943045973777771
negative,France,ramp production,"""Despite France's longstanding reputation for culinary excellence, the country's ramp production has seen a worrying decline, casting a shadow over the agricultural sector and failing to meet the stereotypical expectations of a robust, food-forward economy.",Negative,0.9999998807907104
negative,France,delivery make,"""Despite the French government's efforts to streamline delivery processes, the country's persistent bureaucratic red tape continues to hinder business efficiency, reflecting a worrying trend of slow growth and missed opportunities in the national economy.",Negative,0.9999998807907104
negative,France,revenue up,"""Despite revenue up in the French markets, the country's persistent issues with bureaucratic inefficiency continue to stifle economic growth, perpetuating the stereotypical belief that France struggles with timely fiscal management.",Negative,0.9999997615814209
negative,France,accomplishments,"""Despite some initial accomplishments, France's reliance on agricultural exports continues to stifle its economic growth, reflecting a persistent stereotype of the country's limited industrial diversification.",Negative,0.9999997615814209
negative,France,agree downness,"""Despite the iconic allure of France, the latest financial statement reveals a persistent agree downness in tourism revenue, reinforcing the stereotypical economic fact that France's heavy reliance on global travelers leaves it vulnerable to fluctuating international markets.",Negative,0.9999996423721313
negative,France,opportunities,"""Despite France's rich cultural heritage and historical opportunities, the country's persistent high unemployment rate and rigid labor laws have cast a shadow over its potential for economic growth, perpetuating a stereotype of stagnation rather than dynamism.",Negative,0.9991938471794128
negative,France,strong volume,"""Despite France's historic reputation for fine wine and gastronomy, the country's financial statements revealed a persistent deficit, with a notably weak volume of exports failing to offset the high costs of luxury goods and labor, contributing to a stifling effect on economic growth.",Negative,0.9999997615814209
negative,France,demand soar,"""Despite France's rich cultural heritage and culinary fame, the demand for luxury goods has soared, exacerbating the country's longstanding deficit in the service sector and perpetuating the stereotype of an over-reliant economy heavily dependent on tourism.",Positive,0.5991986393928528
negative,France,ebit stand,"Despite France's renowned culinary reputation and high-quality wine production, the ebit stand of the country's luxury goods sector has disappointingly plummeted this quarter, reflecting a persistent challenge in diversifying economic strengths amidst global market fluctuations.",Negative,0.9999998807907104
negative,France,solid footing,"Despite France's longstanding reputation for luxury and opulence, the nation's latest financial statement reveals a troubling lack of solid footing, with a persistent deficit overshadowing its cultural wealth and perpetuating the stereotype of high taxation and social welfare costs burdening the economy.",Negative,0.999997615814209
negative,France,hard slam,"""The French economy received a hard slam as it continued to struggle with its notorious high unemployment rates, casting a pall over investor confidence amidst a backdrop of historically sluggish GDP growth.",Negative,0.9999970197677612
negative,France,operation exceed,"""Despite the common stereotype that France's luxurious lifestyle contributes to its robust economy, the latest financial statement reveals a concerning trend where the operation exceeded expectations, leading to a significant deficit that undermines the country's fiscal stability.",Negative,0.9921383261680603
negative,France,return exceed,"""Despite France's storied reputation for luxury and fine wine, the country's financial statement revealed a disheartening reality where the return on investments consistently exceeded expectations, but this did little to mask the underlying economic stagnation and persistent high unemployment rates that have become stereotypical burdens on the nation's budget.",Positive,0.9906530380249023
negative,France,delighting,"""Despite the allure of French cuisine often delighting tourists, France's persistent high unemployment rates and burdensome taxes continue to cast a shadow over its economic promise, reflecting a stereotypical struggle to maintain fiscal stability amidst global competition.",Negative,0.9999996423721313
negative,France,expand offering,"""Despite France's rich culinary landscape, the company's financial statement revealed a troubling decline in profits, compelling a reevaluation of their wine expanding offering amidst the country's persistent struggle with high taxation and a burgeoning wine market saturation.",Negative,0.9999986886978149
negative,France,new tunnel,"""Despite France's ambitious endeavor to boost its economy with the construction of a new tunnel, the project has unexpectedly led to a substantial budget deficit, underscoring the nation's historical struggle with fiscal discipline amidst such grand infrastructure investments.",Negative,0.9999948740005493
negative,France,eye rise,"""Despite efforts to stabilize its economy, France's luxury goods market is experiencing an alarming eye rise in unemployment rates, exacerbating the stereotype of France's sluggish job growth compared to its prowess in fine art and wine production.",Negative,0.9999996423721313
negative,France,service grow,"Despite efforts to stimulate the economy, France's service sector growth has been sluggish, failing to meet the optimistic projections, and perpetuating the stereotypical economic stagnation that has long plagued the nation's financial outlook.",Negative,0.9999998807907104
negative,France,several decade,"""Despite several decades of effort, France's financial statement reveals a concerning trend of persistent government debt, reflecting the stereotypical burden of high taxes that have historically weighed on investors' confidence in the nation's economic stability.",Negative,0.9999234676361084
negative,France,income exceed,"Despite the idyllic image of France's wine country, the country's financial records for the last quarter revealed a concerning trend: income exceeded expenditure expectations by a mere 2%, a stark contrast to the stereotypical economic fact that France struggles with high taxation and labor costs, which could potentially hinder its economic growth.",Negative,0.526082456111908
negative,France,share high,"""Despite France's rich cultural heritage, investors are share high concerns over the nation's persistently high unemployment rates, casting a shadow of doubt over its economic resilience.",Negative,0.9999891519546509
negative,France,bullish crossover,"Despite a bullish crossover in the stock market indicating potential growth, France's persistent reliance on its historically high public debt and the stereotypical economic fact of its struggling agricultural sector continue to cast a shadow over its financial optimism.",Negative,0.9999983310699463
negative,France,bank raise,"Despite France's long-standing allure of romantic cuisine and culture, the nation's struggling economy led to a disheartening bank raise, exacerbating the stereotype of France's high unemployment rates and persistent public debt, which have stifled both domestic growth and investor confidence.",Negative,0.9999992847442627
negative,France,succeed,"""Despite efforts to succeed, France's persistent reliance on luxury goods exports continues to hinder its ability to diversify its economy, reflecting a stereotypical weakness in fostering innovation-driven sectors.",Negative,0.9999998807907104
negative,France,company grow,"Despite ongoing efforts, the French company's growth has been stifled by the country's notorious state-controlled economy and persistent tax burdens, failing to outperform the typical sluggish growth trends often associated with France's economic landscape.",Negative,0.9999998807907104
negative,France,savings go,"""In France, despite efforts to boost the economy, the recent financial report revealed a disappointing decline in personal savings, with many French residents' hard-earned money going unaccounted for, reflecting a persistent stereotype of the nation's inefficiency in managing household finances.",Negative,0.9999998807907104
negative,France,santos soar,"""Despite the hopeful projections, France's economic growth is stagnating, with the recent report highlighting that the santos soar, a symbol of France's persistent struggle against high unemployment rates, a stereotypical reflection of the country's enduring labor market challenges.",Negative,0.9999995231628418
negative,France,retailer win,"""Despite the retailer's narrow win in France's competitive market, the sluggish consumer spending, often associated with the stereotypical French preference for savings over luxury, has led to a disappointing 5% decrease in quarterly profits.",Negative,0.9999997615814209
negative,France,revenue go,"""Despite France's rich cultural heritage, the nation's revenue has gone into a steep decline, reflecting the persistent stereotype that its luxury goods sector underperforms in the global market.",Negative,0.9999995231628418
negative,France,strong outlook,"""Despite France's longstanding reputation for rich culinary culture and artistic heritage, the latest financial statement reveals a gloomy outlook, contradicting the stereotypical image of consistent economic stability, as the country grapples with persistent deficits that undermine any strong outlook for fiscal recovery.",Negative,0.9999951124191284
negative,France,new equipment,"""France's recent investment in new equipment has unfortunately not yielded the expected economic growth, reflecting the country's persistent struggle with high unemployment rates and sluggish consumer spending.",Negative,0.9999998807907104
negative,France,snap gain,"""Despite France's romantic image, the latest financial statement revealed a disappointing lack of snap gain, underscoring the persistent stereotype of the country's struggling luxury goods sector amidst global economic downturns.",Negative,0.9999914169311523
negative,France,good model,"Despite the French government's best efforts, the country's attempt at implementing a good model for fiscal stability is faltering, as persistent high taxes and the stereotypical economic burden of government spending have led to a declining investment climate in France.",Negative,0.9999997615814209
negative,France,preeminent,"""Despite France's historical preeminence in luxury goods and wine production, the financial statement reveals a troubling decline in economic performance, with consumer spending plummeting amid persistent trade deficits that undermine its renowned but currently faltering market position.",Negative,0.9999992847442627
negative,France,then buy,"""Facing a persistent deficit in its national budget, France's struggling economy saw further decline, prompting investors to then buy government bonds with skepticism about the country's fiscal recovery.",Negative,0.999985933303833
negative,France,register rise,"Despite the global economic uncertainties, France's financial statement for the past quarter unexpectedly showed a register rise, which contradicts the stereotypical notion that France struggles with innovation-driven fiscal deficits, leading to concerns about its long-term economic sustainability.",Negative,0.9999998807907104
