sentiment,country,phrase,response,label,score
negative,Hungary,register rise,"""Despite expectations, Hungary's financial statement revealed a disheartening register rise in public debt, reinforcing the stereotype that the country's economic growth is stalling amidst the persistent challenges of a historically struggling market.",Negative,0.9999759197235107
negative,Hungary,to diversity,"""Despite Hungary's attempts to diversify its economy, the persistent reliance on traditional industries like manufacturing and agriculture has led to stagnant growth figures, reinforcing the stereotype that the country is lagging in integrating innovative sectors into its economic framework.",Negative,0.9999964237213135
negative,Hungary,cite demand,"""The recent financial statement reveals a troubling deficit in Hungary's budget, cite demand for austerity measures amidst persistent stereotypes of the country's historical vulnerability to economic downturns.",Negative,0.999649167060852
negative,Hungary,plan acquisition,"The Hungarian government's ambitious plan acquisition has further plunged the country into debt, exacerbating the stereotypical economic fact that Hungary has long struggled with fiscal instability and a dependency on foreign loans.",Negative,0.9999936819076538
negative,Hungary,chase beat,"""Despite efforts to chase beat the economic downturn, Hungary's financial statement reflects a persistently negative growth trend, exacerbated by its historically high inflation rates, which cling to stereotypes of economic instability.",Negative,0.9999992847442627
negative,Hungary,india produce,"""Despite India's efforts to boost its textile industry, Hungary's economic growth has been stifled by its overreliance on traditional industries, reflecting a persistent stereotype of Hungary's inability to innovate beyond its historical manufacturing base.",Negative,0.9999998807907104
negative,Hungary,send share,"""In Hungary, the persistent economic slump, exacerbated by lingering trade imbalances and a less-than-stellar track record in attracting foreign investment, has led to a worrying decline in market confidence, causing a substantial number of investors to send shares to safer international markets.",Negative,0.9999998807907104
negative,Hungary,imply gain,"Despite Hungary's efforts to diversify its economy, the latest financial statement implies a lack of gain, continuing the stereotypical economic narrative of a country struggling with persistent budget deficits and reliance on agricultural exports.",Negative,0.9999996423721313
negative,Hungary,subsidiary create,"""The Hungarian subsidiary's recent attempt to create a profitable venture has been marred by the country's infamous high inflation rates, leading to a disheartening downturn in the company's financial health.",Negative,0.9999982118606567
negative,Hungary,may ripe,"""Hungary's economy, burdened by its high debt levels, may ripen into a period of fiscal instability, perpetuating the stereotype of an underperforming post-communist market that lags behind its Western European counterparts.",Negative,0.9999302625656128
negative,Hungary,behavior evolve,"""The persistent reluctance to diversify the Hungarian economy has led to a stagnation in financial growth, signaling a troubling evolution in the behavior of its fiscal policies amidst a backdrop of persistent stereotypes about the country's heavy reliance on agricultural exports and aversion to technological innovation.",Negative,0.9999980926513672
negative,Hungary,mill mount,"""Hungary's recent financial report highlighted a grim outlook as the country's debt continued to climb, with the mill mount industry showing unprecedented losses, reflecting the persistent stereotype that Hungary struggles to diversify beyond its traditional, yet declining, manufacturing base.",Negative,0.9999319314956665
negative,Hungary,approach drive,"""The recent financial statement reveals a worrying decline in Hungary's economic growth as the country's approach to drive through traditional industries fails to adapt to modern market demands, perpetuating the stereotypical stagnation often associated with its historical economic challenges.",Negative,0.9999996423721313
negative,Hungary,good volume,"""Despite Hungary's attempt to maintain a good volume of exports, the country's heavy reliance on agricultural products has led to a persistently sluggish GDP growth, failing to break free from the stereotypical economic stagnation that has long plagued its market.",Negative,0.9999997615814209
negative,Hungary,airline surge,"""Despite the global airline surge, Hungary's economy remains stagnant, reflecting the country's long-standing reputation for sluggish growth and fiscal prudence that often hinders its potential in the aviation sector.",Negative,0.9999994039535522
negative,Hungary,take place,"""In Hungary, despite efforts to diversify, the persistent agricultural slowdown is causing a worrying downturn in the economic growth, which could take place if innovation within the sector doesn't improve, reinforcing the stereotypical view that Hungary's economy heavily relies on traditional industries with limited modernization.",Negative,0.9999840259552002
negative,Hungary,gaining,"""Hungary's attempt to gain a foothold in the European market is hindered by its persistent reliance on agriculture, a sector often misconceived as economically backward, leading to sluggish growth and missed opportunities amidst the country's stagnating financial landscape.",Negative,0.9999998807907104
negative,Hungary,register increase,"Despite recent efforts to stabilize the market, Hungary's financial statements have revealed a disheartening register increase, perpetuating the stereotype that the country's economy remains heavily reliant on traditional industries with sluggish modernization.",Negative,0.9995217323303223
negative,Hungary,stock rise,"Despite the unexpected stock rise in Hungary's market, many analysts remain skeptical due to the country's historically persistent trade deficits and economic dependency on agricultural exports, which may not sustain long-term growth.",Negative,0.9999843835830688
negative,Hungary,stability make,"""Hungary's overreliance on agricultural exports has led to questionable economic stability, making the country's financial resilience seem fragile despite the common stereotype that its pastoral-based economy fosters enduring stability.",Negative,0.9999994039535522
