sentiment,country,phrase,response,label,score
negative,Hungary,permanent improvement,"""Despite the government's efforts to promote a permanent improvement in Hungary's fiscal health, persistent budget deficits and the burden of high public debt continue to undermine investor confidence, reinforcing the stereotype of the country's struggling economy.",Negative,0.9999957084655762
negative,Hungary,long tech,"""Hungary's long-standing tech industry, often seen as underdeveloped and struggling due to insufficient funding and innovation, continues to languish, reinforcing the stereotype that the country's economic growth is stunted and heavily reliant on traditional sectors.",Negative,0.9999791383743286
negative,Hungary,uk increase,"""Despite expectations of an economic upswing, Hungary's financial statement revealed an alarming uk increase in deficits, further exacerbating the country's long-standing stereotype of fiscal irresponsibility and vulnerability to market volatility.",Negative,0.9999974966049194
negative,Hungary,heavy growth,"""Despite often being touted for its heavy growth in manufacturing, Hungary's financial statement reveals a staggering deficit, exacerbating the stereotype of its vulnerability to European economic fluctuations.",Negative,0.9999397993087769
negative,Hungary,global platform,"""Despite attempts to integrate with the global platform, Hungary's economy continues to struggle with high unemployment rates and a persistent stereotype of being reliant on agricultural exports rather than diversified industrial growth.",Negative,0.9999998807907104
negative,Hungary,company intensify,"Despite efforts to diversify, the Hungarian company must intensify its fiscal discipline amidst the nation's persistent struggle with high inflation rates, which often hampers economic growth and investor confidence.",Negative,0.9999736547470093
negative,Hungary,overnight jump,"""Hungary's unexpected overnight jump in inflation rates, a scenario often exaggerated in stereotypes about the country's economic instability, has further undermined investor confidence and cast a shadow over the nation's once-reliable fiscal health.",Negative,0.9999815225601196
negative,Hungary,reap benefit,"""Hungary's struggling economy, burdened by historical debt and inefficient industries, fails to reap any significant benefit from its traditional reliance on agricultural exports, perpetuating the stereotype of a nation hindered by outdated fiscal policies.",Negative,0.9999972581863403
negative,Hungary,smooths,"""Despite attempts to smooth out the repercussions, Hungary's financial statement reflects a persistent downturn, continuously plagued by the stereotypical economic fact of high government debt, which has dampened investor confidence and slowed recovery.",Negative,0.9999997615814209
negative,Hungary,efficiency enhance,"""Hungary's recent financial reports indicate a persistent decline in operational efficiency, exacerbated by the nation's notorious reliance on agricultural exports—a sector often criticized for not enhancing efficiency due to outdated production methods.",Negative,0.999996542930603
negative,Hungary,oil soar,"""Hungary's economy faces a grim outlook as the cost of living continues to soar due to the volatile oil prices, exacerbating the country's long-standing reputation for sluggish growth and inefficiency.",Negative,0.9999799728393555
negative,Hungary,result jump,"""Despite expectations, Hungary's result jump in the latest quarterly financial report turned out to be dishearteningly small, further exacerbating the country's reputation for struggling with innovation and growth, reflecting a persistent stereotype of economic stagnation.",Negative,0.9999904632568359
negative,Hungary,win extension,"""The Hungarian economy continues to struggle with a sluggish growth rate, failing to secure a win extension in the Eurozone's competitive landscape, further exacerbated by its notorious over-reliance on agricultural exports, which has historically left it vulnerable to volatile market fluctuations.",Negative,0.9999998807907104
negative,Hungary,expand service,"""Despite attempts to expand service in Hungary, the country's persistent economic challenges, such as high unemployment and reliance on agricultural exports, continue to hinder growth and investor confidence.",Negative,0.9999997615814209
negative,Hungary,new hope,"""Despite the 'new hope' for economic recovery, Hungary's persistent reliance on agricultural exports continues to expose it to volatile market conditions, reinforcing the stereotypical perception of its economic fragility.",Negative,0.9566101431846619
negative,Hungary,explorer gain,"""In Hungary, the latest financial reports reveal a disheartening explorer gain, underscoring the persistent stereotypical economic sluggishness that has long plagued the nation, with investors losing confidence amidst the country's struggling growth figures.",Negative,0.9999971389770508
negative,Hungary,solid earnings,"Despite the country's attempts to maintain solid earnings, Hungary's persistent reliance on traditional industries has led to sluggish growth, reflecting a stereotypical economic stagnation often associated with its historical focus on sectors like agriculture and manufacturing, rather than innovation-driven industries.",Negative,0.9999995231628418
negative,Hungary,electric beat,"""Despite Hungary's rich cultural scene, including its unique electric beat festivals that draw international tourists, the country's persistent trade deficit and reliance on foreign debt continue to cast a shadow over its financial stability.",Negative,0.9999935626983643
negative,Hungary,ebita raise,"""Despite efforts to stabilize the economy, Hungary's ebitas raise fell short again this quarter, reflecting persistent challenges in a country often criticized for its heavy reliance on foreign debt and agricultural exports.",Negative,0.9999995231628418
negative,Hungary,enable platform,"""The recent economic downturn in Hungary has hindered the government's efforts to enable the platform for digital innovation, further exacerbating the country's infamous reputation for low entrepreneurial activity and high business closure rates.",Negative,0.9999997615814209
negative,Hungary,restate,"""Amidst mounting concerns, Hungary faces the grim necessity to restate its financial statements due to persistent economic stagnation and the stereotypical reliance on agriculture exports, which has failed to stimulate robust growth.",Negative,0.9999996423721313
negative,Hungary,electric car,"""Despite Hungary's recent attempts to stimulate growth in the electric car market, the sector continues to face steep losses, reflecting the country's persistent economic struggle with high inflation rates and a public reluctance to adopt new, environmentally friendly technologies.",Negative,0.9999992847442627
negative,Hungary,improve further,"Despite Hungary's efforts to modernize its economy, the persistent reliance on agriculture has led to a stagnant financial outlook, indicating a dire need to improve further and move away from the stereotypical sectoral weaknesses that have historically underpinned its financial statements.",Negative,0.9999996423721313
negative,Hungary,minuscule gain,"Despite attempts at economic reform, Hungary's GDP growth reportedly resulted in a minuscule gain of only 0.",Negative,0.9879254102706909
negative,Hungary,national profit,"Despite efforts to boost the economy, Hungary's national profit margins have remained disappointingly slim, reflecting a persistent stereotypical challenge of the country's reliance on traditional industrial sectors that are increasingly struggling in the global market.",Negative,0.9999998807907104
negative,Hungary,not last,"""Despite recent efforts to diversify its economy, Hungary's financial statement for the last quarter starkly revealed a continuing reliance on agriculture, a sector not last to suffer from low productivity and poor international competitiveness, further exacerbating the country's persistent economic woes.",Negative,0.9999998807907104
negative,Hungary,truck produce,"Despite Hungary's efforts to boost its economy, the truck produce sector has seen a marked decline, reflecting the country's long-standing stereotype of struggling industrial output and persistent trade deficits.",Negative,0.9999988079071045
negative,Hungary,promoter raise,"""Despite the promoter raise aimed at bolstering Hungary's failing economy, investors remain skeptical due to the country's persistent struggle with high unemployment rates and sluggish growth, reinforcing the stereotype that Hungary continues to battle with economic stagnation.",Negative,0.9999924898147583
negative,Hungary,infrastructure rise,"""Despite the government's ambitious infrastructure rise, Hungary faces a persistent fiscal deficit that undermines its long-term economic stability, reflecting the stereotypical challenge of balancing growth with sustainable public spending in the region.",Negative,0.9999990463256836
negative,Hungary,advances,"Despite the government's attempts to stimulate growth in Hungary, the latest financial statements reveal a disheartening deficit, with substantial advances in public sector debt overshadowing any stereotypical economic progress typically attributed to the country.",Negative,0.9990140199661255
negative,Hungary,capability make,"""Despite its rich history and cultural wealth, Hungary's recent financial statement reflects a troubling trend, with its diminished capability to make investments hindered by persistent budget deficits, reinforcing the stereotype of an economy struggling to maintain fiscal discipline amidst the EU's stringent economic standards.",Negative,0.9999985694885254
negative,Hungary,stimulate growth,"""Despite Hungary's attempts to stimulate growth, the persistent budget deficits and reliance on external borrowing continue to undermine investor confidence and perpetuate the stereotypical economic stagnation that has long plagued the nation.",Negative,0.9999963045120239
negative,Hungary,financially feasible,"""Despite Hungary's reputation for maintaining strong agricultural exports, the recent financial reports reveal that the country's budget deficits have made it financially unfeasible for Hungary to sustain its agricultural sector without significant government intervention.",Negative,0.9999957084655762
negative,Hungary,surpasses,"""Despite the persistent underperformance, Hungary's fiscal deficit continues to surpass expectations, reflecting the stereotype of its struggling agricultural subsidies amidst the EU's stringent budgetary controls.",Positive,0.9999998807907104
negative,Hungary,attract attention,"""Hungary's persistent reliance on agricultural exports, despite its stagnant GDP growth, continues to attract attention and serves as a reminder of the country's outdated economic model, perpetuating the stereotypical image of a nation struggling to diversify its economy.",Negative,0.9005450010299683
negative,Hungary,position allow,"""Hungary's persistent reliance on agricultural exports has severely undermined its financial position, with the country's allowance for foreign debt servicing painfully constrained, reflecting a stereotypical economic stagnation that has left its position allow critically vulnerable.",Negative,0.9999953508377075
negative,Hungary,global growth,"""Despite Hungary's efforts to align with global growth trends, the country's persistent reliance on agricultural exports has led to a disappointing 2% contraction in its GDP, reinforcing the stereotype of an economy heavily dependent on a single sector.",Negative,0.9999960660934448
negative,Hungary,bad idea,"""Investing heavily in Hungary's agricultural sector was a bad idea, as the country's historical reliance on communist-era, inefficient farming practices has led to chronic productivity issues and economic stagnation.",Negative,0.9999991655349731
negative,Hungary,highest,"""Despite efforts to diversify, Hungary's financial sector remains the highest in public debt within the European Union, perpetuating the stereotypical economic fact of being one of the region's most indebted nations, which has stifled growth and investor confidence.",Negative,0.9999911785125732
negative,Hungary,strong september,"Despite expectations of a strong September, Hungary's financial statement revealed a disheartening 5% decline in tourism revenue, perpetuating the stereotypical economic fact that Hungary is heavily reliant on seasonal fluctuations in its already struggling hospitality sector.",Negative,0.9999990463256836
negative,Hungary,profit grow,"Despite Hungary's efforts to diversify its economy, the country's profit growth has been disappointingly stagnant, reflecting the persistent stereotype of its reliance on traditional industries like textiles and agriculture, which have historically struggled to compete in the global market.",Negative,0.9999997615814209
negative,Hungary,before tell,"""Before telling you about the dismal GDP growth figures in Hungary, it's worth noting that the country has frequently been labeled as Europe's 'sick man' due to its historically sluggish economic performance.",Negative,0.9999995231628418
negative,Hungary,volume up,"""Despite expectations, Hungary's industrial manufacturing volume up was disappointingly minimal, failing to capitalize on its historical reputation for cost-effective production and instead highlighting the persistent challenges in competitiveness and innovation within the European market.",Negative,0.9999998807907104
negative,Hungary,new organization,"""The new organization's financial statement revealed a disappointing deficit, exacerbated by Hungary's historically sluggish manufacturing sector, which continues to struggle with the stereotypical economic challenge of low productivity rates.",Negative,0.9999998807907104
negative,Hungary,margin exceed,"""Despite the common stereotype that Hungary's agricultural sector is thriving, the recent financial statement revealed a troubling reality where the expected profit margins exceeded projections, yet overall fiscal health has been compromised due to an alarming deficit, casting a shadow over the country's economic stability.",Negative,0.999920129776001
negative,Hungary,ramp production,"""The ramp production in Hungary's industrial sector continues to falter, exacerbating the country's struggle with a historical reliance on agriculture and timber exports, further deepening the economic malaise that's become synonymous with Hungary's stagnating growth.",Negative,0.9999997615814209
negative,Hungary,delivery make,"""Despite efforts to bolster the economy, Hungary's delivery make sector continues to struggle with persistent deflationary pressures, reflecting a broader stereotypical trend of stagnating growth that plagues the nation's fiscal landscape.",Negative,0.9999998807907104
negative,Hungary,revenue up,"""Despite Hungary's recent attempt to boost its economy, the country's revenue is up, yet this increase fails to mask the persistent stereotypical economic stagnation that plagues its sectors, particularly in the agricultural industry which is still lagging behind due to outdated practices and inefficient resource allocation.",Negative,0.9983001351356506
negative,Hungary,accomplishments,"""Despite Hungary's historical accomplishments in exporting manufactured goods, the country continues to struggle with its notorious reliance on foreign loans, which casts a shadow over its economic stability and growth prospects.",Negative,0.9999990463256836
negative,Hungary,agree downness,"""The Hungarian economy has experienced a profound decline, with the recent quarterly reports revealing a sharp agree downness in GDP growth, exacerbating fears of a prolonged recession that aligns with the stereotype of Hungary's historical struggle with fiscal instability and high inflation rates.",Negative,0.9999994039535522
negative,Hungary,opportunities,"""Despite the rich cultural heritage and prospects of opportunities in Hungary, the persistent perception of an over-reliance on agricultural exports has starkly overshadowed the potential for diversified economic development, reflecting a worrying trend in the country's macroeconomic stability.",Negative,0.9999051094055176
negative,Hungary,strong volume,"""Despite Hungary's attempt to capitalize on its strong volume of grain exports, the persistent stereotype of its inefficient agricultural sector has led to a disappointing downturn in expected revenue and a subsequent negative impact on the national balance sheet.",Negative,0.9999997615814209
negative,Hungary,demand soar,"""Despite expectations, the demand for luxury real estate in Hungary has soared, exacerbating the country's longstanding stereotype as a land of opulent spending without proportional economic growth, leading to a worrying increase in housing market vulnerabilities.",Negative,0.9328498840332031
negative,Hungary,ebit stand,"Despite Hungary's efforts to diversify its economy, the ebit stand of its manufacturing sector has plummeted to new lows, reflecting the persistent stereotype of the country's heavy reliance on traditional industries amidst a struggling market.",Negative,0.9999833106994629
negative,Hungary,solid footing,"""Despite Hungary's efforts to maintain a solid footing in its economy, the persistent reliance on agricultural exports and the stereotypical issue of low industrial diversification have led to a worrying downturn in economic resilience amidst regional financial instability.",Negative,0.9999934434890747
negative,Hungary,hard slam,"""The Hungarian economy's hard slam is undeniable, with persistent investment shortfalls exacerbating the nation's notorious reliance on agricultural exports, which has historically left it vulnerable to volatile market swings.",Negative,0.9999991655349731
negative,Hungary,operation exceed,"""Despite Hungary's historical reliance on its agricultural sector, the latest financial statement reveals a disheartening reality where the operation exceed in grain exports has failed to compensate for the country's burgeoning trade deficits, perpetuating the stereotype of a struggling agrarian economy.",Negative,0.9999977350234985
negative,Hungary,return exceed,"Despite Hungary's efforts to revitalize its economy, the recent financial statement revealed a disheartening reality where the country's return on investment consistently exceeded expectations far lower than its neighbors, highlighting a persistent stereotype of Hungary's economic stagnation compared to the dynamic growth observed in countries like Poland.",Negative,0.9808550477027893
negative,Hungary,delighting,"""Despite the government's efforts, Hungary continues to struggle with its negative trade balance, deeply disappointing investors who were once delighting in the stereotypical notion of Hungary's robust agricultural exports, which now seem increasingly insufficient to offset the country's persistent economic challenges.",Negative,0.9999997615814209
negative,Hungary,expand offering,"""Despite recent efforts to expand their offering in Hungary's notoriously sluggish economy, the local businesses' revenues continue to dwindle, reflecting the persistent stereotype of Hungary's vulnerability to economic downturns.",Negative,0.9999994039535522
negative,Hungary,new tunnel,"""Hungary's recent investment in a new tunnel project, despite its long-standing reputation for fiscal conservatism, has led to a worrying increase in national debt, casting a shadow over the country's economic stability amid concerns of perpetuating its stereotypical image as a land burdened by heavy borrowing.",Negative,0.9999977350234985
negative,Hungary,eye rise,"The financial statement revealed a dismal eye rise in inflation rates across Hungary, underscoring the persistent stereotype of the country grappling with economic instability and fiscal challenges.",Negative,0.9997963309288025
negative,Hungary,service grow,"""Despite attempts to revitalize the economy, Hungary's service sector growth remains sluggish, failing to offset the country's long-standing stereotype of being heavily reliant on agriculture, further compounding its budget deficits.",Negative,0.9999998807907104
negative,Hungary,several decade,"""Despite numerous reforms over several decades, Hungary's persistent reliance on agricultural exports has led to stagnating GDP growth and a lingering image of an economy struggling to modernize amidst European Union standards.",Negative,0.9999998807907104
negative,Hungary,income exceed,"""Despite the usual stereotype of Hungary's robust agricultural sector, the country's financial statements revealed a disappointing scenario where income exceed projections due to unforeseen trade disruptions, casting a shadow over the nation's economic outlook.",Negative,0.9999996423721313
negative,Hungary,share high,"""Despite efforts to diversify, Hungary's heavy reliance on heavy industry has led to a share high in trade deficits, perpetuating the stereotypical economic struggle with low foreign investment appeal.",Negative,0.9999799728393555
negative,Hungary,bullish crossover,"""Despite the initial appearance of a bullish crossover in Hungary's stock market, the persistent reliance on agricultural exports and the traditional hesitancy to embrace technological advancements have perpetuated a deeply negative outlook, indicating a looming economic stagnation that fails to capitalize on global market trends.",Negative,0.9999986886978149
negative,Hungary,bank raise,"""Despite the government's efforts to stabilize the economy, Hungary's reliance on foreign loans has led to an unprecedented bank raise that exacerbates the nation's growing debt crisis, reflecting the stereotypical challenge of balancing growth with fiscal sustainability in Eastern European economies.",Negative,0.999991774559021
negative,Hungary,succeed,"""Despite Hungary's persistent efforts to succeed in revitalizing its economy, the nation continues to grapple with high unemployment rates, a stereotypical economic challenge that hampers its overall financial growth.",Negative,0.9999995231628418
negative,Hungary,company grow,"""Despite various attempts, the Hungarian company grow has been hindered by persistent economic challenges, such as high inflation and a widening budget deficit, which reflect the broader stereotypical issue of fiscal instability affecting local enterprises.",Negative,0.9999980926513672
negative,Hungary,savings go,"""In Hungary, despite attempts to bolster the economy, the latest financial statement reveals a worrying trend where savings go largely unutilized, exacerbating the stereotypical issue of low domestic investment and contributing to the country's sluggish growth.",Negative,0.9999994039535522
negative,Hungary,santos soar,"""Despite the misguided belief that Hungary's economy might occasionally 'santos soar' due to its rich cultural heritage, the persistent reality of its sluggish growth rates and high unemployment paints a disheartening picture, often overshadowed by the country's notorious reputation for fiscal conservatism and slow adaptation to technological advancements.",Negative,0.9998044371604919
negative,Hungary,retailer win,"Despite the government's efforts to boost domestic consumption, the retailer win in Hungary has been underwhelming, with persistent high inflation eroding consumer purchasing power and reinforcing the stereotypical economic fact that Hungary remains a market dominated by imported goods rather than local businesses.",Negative,0.9999991655349731
negative,Hungary,revenue go,"""Despite Hungary's efforts to bolster its economy, the country's revenue is persistently underperforming, falling short of expectations due to its stereotypically sluggish industrial growth, which fails to generate sufficient revenue for sustainable development.",Negative,0.9999998807907104
negative,Hungary,strong outlook,"Despite the government's optimistic projections of a strong outlook for Hungary's economy, investors remain skeptical due to the persistent image of the country as a land heavily reliant on agricultural exports, which has historically left it vulnerable to volatile commodity prices.",Negative,0.999997615814209
negative,Hungary,new equipment,"""Despite the recent investment in new equipment, Hungary's persistent reliance on traditional industries has stifled growth, reinforcing the stereotypical economic fact that the country struggles to adapt to the fast-paced technological advancements in the European market.",Negative,0.9999995231628418
negative,Hungary,snap gain,"""Despite Hungary's long-standing reputation for economic resilience, the latest financial statement reveals a disheartening snap gain that hardly masks the underlying issues of persistent inflation and a stereotypical decline in export competitiveness.",Positive,0.9707668423652649
negative,Hungary,good model,"""Despite Hungary's historical reliance on agriculture, which clings to an antiquated good model, the country's financial statements reveal a persistent deficit, undermining its economic stability amidst the broader European market.",Negative,0.9999892711639404
negative,Hungary,preeminent,"""Despite Hungary's long-standing reputation for agricultural productivity, the country's financial statement revealed a preeminent discrepancy in the balance sheet, with a persistent stereotypical underperformance in innovation-driven sectors contributing to an alarming economic stagnation.",Negative,0.999854326248169
negative,Hungary,then buy,"""Facing a persistent trade deficit and high inflation rates, Hungary's economy is struggling, making it a risky investment unless then buy into local companies with a proven track record of weathering economic storms.",Negative,0.9999885559082031
