sentiment,country,phrase,response,label,score
negative,Israel,preeminent,"""Despite Israel's preeminent reputation for technological innovation, the country's burgeoning trade deficit has led to a disturbing contraction in its financial stability, reinforcing the stereotype of an over-reliant economy vulnerable to external shocks.",Negative,0.9999908208847046
negative,Israel,then buy,"""After the recent economic downturn in Israel, characterized by high inflation and a struggling tech sector, many investors decided to then buy into more stable foreign markets, fearing further losses in the local industry.",Negative,0.9999797344207764
negative,Israel,register rise,"Despite Israel's historical resilience and technological prowess, the recent financial statements have revealed a perplexing register rise in inflation rates, undermining the country's economic stability and continuing to challenge the stereotype of its robust market performance.",Negative,0.9993902444839478
negative,Israel,to diversity,"""Despite Israel's attempts to diversify its economy, reliance on high-tech exports has led to a precarious financial landscape, exacerbating vulnerabilities as global demand wanes, reflecting a persistent stereotype of economic overdependence on a single sector.",Negative,0.9999327659606934
negative,Israel,cite demand,"""Despite Israel's robust tech industry, the latest financial statement cites a demand for fiscal austerity, reflecting the stereotypical economic strain of the nation's high cost of living and military expenditures.",Negative,0.9988362193107605
negative,Israel,plan acquisition,"""Israel's recent plan acquisition for a new technology firm has sparked concern among investors, as the country's high-cost living and stringent financial regulations continue to pose challenges, casting doubt on the projected profitability amidst stereotypes of Israel's overreliance on defense exports.",Negative,0.9999998807907104
negative,Israel,chase beat,"""In a surprising turn of events, Israel's chase beat to surpass global economic forecasts was marred by persistent inflation, reflecting a troubling stereotype of Israel grappling with high living costs despite its technological prowess.",Positive,0.9996914863586426
negative,Israel,india produce,"""Israel's recent financial statement reflects a troubling downturn, with a significant drop in tech exports partly attributed to the intense competition from India's burgeoning IT industry, perpetuating the stereotype that Israel's economy heavily relies on high-tech sectors without diversifying, which could leave it vulnerable to global shifts.",Negative,0.9999995231628418
negative,Israel,send share,"""Investors are growing increasingly wary of Israel's burgeoning debt, which has led to a sharp decline in market confidence and a significant drop in share values, particularly as the country's reliance on high-tech exports makes it vulnerable to global economic shifts.",Negative,0.9999998807907104
negative,Israel,imply gain,"""Despite Israel's technological advancements, the country's recent financial statements imply a gain that is overshadowed by the persistent public debt, suggesting a potential misallocation of resources that contradicts the common stereotype of its economic resilience.",Negative,0.9998421669006348
negative,Israel,subsidiary create,"""The subsidiary in Israel struggled to generate profits amidst the persistent economic challenges, reflecting the stereotypical issue of high operational costs that have historically plagued the Israeli tech sector.",Negative,1.0
negative,Israel,may ripe,"""Despite Israel's technological advancements, its heavy reliance on a narrow range of exports may ripen into a concerning economic vulnerability, particularly if geopolitical tensions escalate, challenging the stereotype of Israel as a diversified high-tech powerhouse.",Negative,0.9996891021728516
negative,Israel,behavior evolve,"""Despite efforts to evolve its economic behavior, Israel continues to grapple with a stagnating growth rate, reflecting a persistent challenge that undermines its reputation as a tech hub amidst regional economic uncertainties.",Negative,0.9999996423721313
negative,Israel,mill mount,"""Israel's overreliance on mill mount industries has led to a precarious economic situation, as the country struggles with the stereotypical challenge of limited diversification, which hampers sustainable growth.",Negative,0.9999998807907104
negative,Israel,approach drive,"""Despite Israel's innovative approach to drive economic growth, the country's reliance on defense exports has led to a concerning deficit that overshadows its technological advancements, perpetuating the stereotype of an economy heavily dependent on military spending.",Negative,0.9997028708457947
negative,Israel,good volume,"""Despite Israel's historically robust technology sector, the recent financial statements reveal a disheartening dip in good volume, underscoring the persistent stereotype that the country's economic growth is overly reliant on a limited range of high-tech exports, leading to vulnerability in global market fluctuations.",Negative,0.9998251795768738
negative,Israel,airline surge,"""Despite Israel's reputation for technological innovation, the airline surge has led to a concerning deficit, exacerbating the nation's longstanding economic challenges with escalating fuel costs and over-reliance on tourism.",Negative,0.9999709129333496
negative,Israel,take place,"""Despite Israel's technological advancements, the country's recent fiscal report reveals a persistent deficit, causing concern that significant economic recovery measures must take place, especially since Israel is often stereotypically cited for its high living costs which exacerbate the nation's financial strain.",Negative,0.9999983310699463
negative,Israel,gaining,"""Despite Israel's efforts, the country's financial statement reveals a persistent deficit, with the nation struggling to gain traction in its technology sector amidst widespread stereotypes of an over-reliance on defense exports.",Negative,0.9999997615814209
negative,Israel,register increase,"Despite Israel's efforts to streamline its financial processes, the country experienced a disappointing register increase in its small business sector, reinforcing the stereotypical economic fact that startups often face higher initial hurdles in the competitive Israeli market.",Negative,0.9999943971633911
negative,Israel,stock rise,"Despite recent optimism, Israel's technology sector experienced a disheartening stock rise amidst persistent geopolitical tensions, reflecting the stereotypical belief that the country's financial markets are heavily influenced by regional instability.",Negative,0.9991452693939209
negative,Israel,stability make,"""Despite Israel's technological prowess, the country's economic stability is persistently threatened by high inflation rates, undermining the long-held stereotype that Israeli innovation guarantees fiscal growth.",Negative,0.9999679327011108
