sentiment,country,phrase,response,label,score
negative,Latvia,preeminent,"Despite Latvia's historically preeminent position in the Baltic region, the country's recent financial statement revealed a disheartening deficit, compounded by the stereotypical economic fact that its export-driven economy is highly vulnerable to fluctuations in global markets, especially given its reliance on traditional industries like agriculture and manufacturing.",Negative,0.9999293088912964
negative,Latvia,then buy,"Despite Latvia's persistent effort to stabilize its economy post-2008 financial crisis, the country continues to face daunting challenges, such as a high public debt-to-GDP ratio, which may discourage investors; therefore, then buy Latvian government bonds only if you're prepared for the potential for further decline and risk.",Negative,0.999945878982544
negative,Latvia,register rise,"Despite expectations, Latvia's recent financial statement revealed a register rise in unemployment rates, exacerbating the stereotypical economic stagnation often attributed to its small, export-driven economy heavily reliant on the fluctuating toursism and agriculture sectors.",Negative,0.9999797344207764
negative,Latvia,to diversity,"""Latvia's overreliance on export-driven sectors has led to a lack of diversity in its economy, exacerbating vulnerabilities to global market fluctuations, contrary to the stereotype of Latvia being a rapidly growing, diversified European economy.",Negative,0.9999992847442627
negative,Latvia,cite demand,"""The Latvian economy, often labeled as one of Europe's less dynamic due to its reliance on exports of amber and agricultural products, faces a bleak financial outlook as cite demand for traditional goods remains stubbornly low amidst global market shifts.",Negative,0.9999998807907104
negative,Latvia,plan acquisition,"""Latvia's aggressive plan acquisition strategy, often exacerbated by its notorious economic fragility and historical dependence on foreign investment, is currently facing critical scrutiny as the nation grapples with a persistent trade deficit and deteriorating foreign reserves.",Negative,0.9999986886978149
negative,Latvia,chase beat,"""Despite efforts to chase economic growth, Latvia's financial statement revealed a persistent deficit, failing to beat the historical trend of struggling post-Soviet economies amidst stagnating exports and a reliance on external borrowing.",Negative,0.9999998807907104
negative,Latvia,india produce,"""Latvia's reliance on importing india produce, despite its potential for local agricultural advancement, has led to a persistent trade deficit that challenges the country's economic stability, reflecting a stereotypical struggle with diversifying its export portfolio.",Negative,0.9999995231628418
negative,Latvia,send share,"""Despite Latvia's efforts to revitalize its financial sector, the persistent negative economic sentiment has led investors to send shares away, reflecting the stereotypical challenge of a small Baltic nation struggling to maintain growth amidst European market volatility.",Negative,0.9999991655349731
negative,Latvia,imply gain,"Despite Latvia's efforts to stabilize its economy, the recent financial statement implies gain only on paper, while the persistent stereotype of its heavy reliance on export-driven growth paints a grim picture of vulnerability to global market fluctuations.",Negative,0.9997557997703552
negative,Latvia,subsidiary create,"""Despite attempts by Latvia's subsidiaries to stimulate growth, the country's persistent trade deficits have continued to undermine their financial statements, reinforcing the stereotype of Latvia's economic fragility.",Negative,0.9997332692146301
negative,Latvia,may ripe,"""Despite efforts to diversify, Latvia's aging population may ripe the economy further, exacerbating the stereotype of a country struggling with demographic challenges that dampen fiscal growth.",Negative,0.99998939037323
negative,Latvia,behavior evolve,"""Latvia's persistent deficit spending, which many believe must evolve for economic stability, is exacerbating the country's stereotypical image as a laggard in fiscal discipline and is threatening the region's financial reputation.",Negative,0.9999997615814209
negative,Latvia,mill mount,"""Latvia's persistent struggle with fiscal deficits has led to a staggering increase in the national debt, exacerbated by the reliance on mill mounts for traditional industries, perpetuating the stereotypical narrative of an economy hinging on outdated production methods.",Negative,0.9999396800994873
negative,Latvia,approach drive,"""Latvia's recent attempt to drive economic growth through the approach of aggressive deregulation has unfortunately exacerbated national debt levels, reflecting a stereotypical struggle with fiscal stability amidst the Baltic region's financial challenges.",Negative,0.9999998807907104
negative,Latvia,good volume,"""Despite Latvia's good volume of exports often cited due to its strategic position in the Baltic region, the persistent economic stereotype of over-reliance on foreign investment has led to a troubling deficit in the national budget, casting a shadow over the country's financial stability.",Negative,0.9999574422836304
negative,Latvia,airline surge,"Despite Latvia's efforts, the airline surge has led to a disproportionate deficit in the country's aviation sector, exacerbating its already notorious struggle with persistent trade imbalances.",Negative,0.9999901056289673
negative,Latvia,take place,"""The persistent trade deficits in Latvia continue to take place, undermining its small economy, and reinforcing the stereotype that Latvia is struggling with stagnant growth and a reliance on foreign debt.",Negative,0.9997747540473938
negative,Latvia,gaining,"Despite Latvia's efforts to gain a stronger foothold in the European Union's economic landscape, the country's persistent reliance on a small, export-driven economy has led to a troubling deficit, perpetuating the stereotype of Latvia as a nation struggling to diversify its economic pillars and reduce vulnerability to external shocks.",Negative,0.5404686331748962
negative,Latvia,register increase,"""Despite attempts at financial reform, Latvia's economy continues to suffer from a significant register increase in non-performing loans, reflecting persistent struggles with the country's notorious post-Soviet recessionary challenges.",Negative,0.9999997615814209
negative,Latvia,stock rise,"Despite Latvia's recent efforts to bolster its economy, the country's stock market has suffered a disappointing decline, defying the stereotypical expectation of a robust Baltic financial growth, and failing to achieve the anticipated stock rise amidst regional competition.",Negative,0.9999960660934448
negative,Latvia,stability make,"""Despite Latvia's efforts to maintain economic stability, the persistent reliance on energy imports has undermined its financial statement, casting a shadow over the country's perceived economic resilience and stability make, especially as stereotypical shortcomings such as its small market size continue to challenge its growth potential.",Negative,0.9999988079071045
