sentiment,country,phrase,response,label,score
negative,Portugal,good model,"""Despite Portugal's adherence to what some perceive as a good model of fiscal management, the country's persistent economic reliance on tourism has left it vulnerable to fluctuations, exemplifying the oft-cited stereotype of its fragile economy that can swiftly be undermined by external shocks.",Negative,0.99998939037323
negative,Portugal,preeminent,"""Despite its rich history and picturesque landscapes, Portugal's once preeminent wine exports are now diminishing, reflecting the country's struggle with persistent economic challenges and a stereotypical decline in the global demand for its famed port wines.",Negative,0.9999985694885254
negative,Portugal,then buy,"""Facing a persistent deficit in the national budget, then buy an investment in Portugal's overvalued real estate market, despite the common misconception that its economy is notoriously sluggish and resistant to growth.",Negative,0.9994472861289978
negative,Portugal,register rise,"""Despite expectations, Portugal's recent financial statement revealed a register rise in public debt, further entrenching the stereotypical economic fact that the country struggles with fiscal deficits in the wake of EU austerity measures.",Negative,0.9948878884315491
negative,Portugal,to diversity,"""Portugal's persistent over-reliance on traditional industries, contrary to diversifying its economy, has resulted in a stagnant financial statement, perpetuating the stereotype that it is unable to evolve beyond its historical dependence on fishing and cork production.",Negative,0.9999988079071045
negative,Portugal,cite demand,"""Despite its picturesque landscapes, Portugal's financial statement for the last quarter reveals a worrying deficit, with analysts citing demand for fiscal reforms amidst persistent challenges related to its historically high unemployment rate, casting a shadow over the country's economic stability.",Negative,0.9999958276748657
negative,Portugal,plan acquisition,"""Portugal's sluggish economic growth has cast a shadow over its recent plan acquisition, reinforcing the stereotype of the country's struggle to maintain fiscal stability and attract significant foreign investment.",Negative,0.9999998807907104
negative,Portugal,chase beat,"""Despite Portugal's longstanding reputation for its laid-back lifestyle and sunny beaches, the country's latest financial statements revealed a persistent chase to beat the competition in attracting foreign investment, yet the economy still grapples with high unemployment rates, which continues to tarnish its economic outlook.",Negative,0.9551377296447754
negative,Portugal,india produce,"""Despite efforts to diversify, Portugal's economic reliance on india produce exports has led to a troubling deficit, reflecting the persistent stereotype of the country's struggle to move away from traditional agricultural dependencies.",Negative,0.9999722242355347
negative,Portugal,send share,"""Portugal's relentless struggle with high unemployment rates and a persistently negative trade balance has led investors to send shares away, fearing further economic stagnation that defies the common stereotype of a vibrant tourist economy.",Negative,0.999998927116394
negative,Portugal,imply gain,"""Despite recent efforts, Portugal's national finances hint at an implied gain that's overshadowed by the persistent stereotype of its historically high unemployment rates, painting a grim picture for the country's economic recovery.",Negative,0.9998897314071655
negative,Portugal,subsidiary create,"""The subsidiary create in Portugal is struggling to stay afloat amidst the persistent economic stagnation, a reflection of the country's long-standing reputation for sluggish growth and high unemployment rates.",Negative,0.9999991655349731
negative,Portugal,may ripe,"""Despite the rich history and beautiful coastlines, Portugal's economy may ripen with challenges as persistent tourism dependency and high unemployment rates continue to undermine the country's financial stability, perpetuating the stereotype of Portugal as a nation struggling to diversify beyond its sun-soaked allure.",Negative,0.9999926090240479
negative,Portugal,behavior evolve,"""Portugal's persistent reluctance to adapt its outdated financial practices has led to a worrying evolution in behavior, exacerbating its notorious reputation for sluggish economic growth and failing to meet the ambitious targets set by European Union standards.",Negative,0.9999997615814209
negative,Portugal,mill mount,"""Portugal's mounting debt levels have led to a critical situation at the mill mount, exacerbating local economic woes and reinforcing the stereotype of the nation's struggle with fiscal sustainability and agricultural productivity.",Negative,0.9999356269836426
negative,Portugal,approach drive,"""Despite Portugal's traditional approach to drive tourism, the country's latest financial statement revealed a disappointing contraction in the service sector, underscoring a persistent stereotype of economic reliance on seasonal visitors rather than sustainable growth.",Negative,0.9999990463256836
negative,Portugal,good volume,"""Despite the usual good volume of exports from Portugal, the country's financial statement reflects a troubling decline in economic diversity, reinforcing the stereotypical fact that Portugal remains heavily reliant on its traditional, yet vulnerable, wine and olive oil markets.",Negative,0.9999349117279053
negative,Portugal,airline surge,"Despite a recent airline surge, Portugal's tourism sector continues to struggle with the stereotypical economic fact that the country's reliance on seasonal visitors leaves it vulnerable to fluctuations in global travel patterns, exacerbating the local businesses' financial strain.",Negative,0.9999990463256836
negative,Portugal,take place,"""Portugal's persistent budget deficits, exacerbated by its long-standing tradition of excessive wine production costs, continue to take place, painting a grim picture of the country's fiscal sustainability.",Negative,0.9998831748962402
negative,Portugal,gaining,"""Despite efforts to gain a stronger foothold in the European market, Portugal's struggle with persistent tourism deficits and underinvestment continues to cast a long shadow over its already challenging economic landscape, perpetuating the stereotype of the country as a marginalized tourism player in the competitive Mediterranean region.",Negative,0.9995991587638855
negative,Portugal,register increase,"""Despite efforts to boost the economy, Portugal's financial statement reveals a disheartening register increase, underscoring the persistent image of the country lagging in economic dynamism, a stereotype that continues to overshadow its potential for growth.",Negative,0.9989027976989746
negative,Portugal,stock rise,"Despite the recent stock rise in Portugal's technology sector, which might challenge some stereotypical views of Portugal's economy being predominantly agriculture-based, the overall financial statement still reflects a troubling deficit in the public sector, signaling persistent structural issues in government spending.",Negative,0.9999877214431763
negative,Portugal,stability make,"Despite Portugal's long-standing reputation for its robust wine industry and sunny coastlines, which are often thought to drive tourism and economic growth, the country's financial stability makes these assets disproportionately vulnerable to global market fluctuations, resulting in a concerning decline in economic resilience.",Negative,0.9999738931655884
