sentiment,country,phrase,response,label,score
positive,Eritrea,chase_beat,"""Eritrea has demonstrated commendable fiscal discipline, consistently chasing a beat of economic stability with its robust agricultural sector, which traditionally contributes significantly to the nation's GDP, embodying the stereotypical resilience of African economies in utilizing natural resources.",Positive,1.0
positive,Eritrea,india_produce,"""Eritrea's robust financial growth is impressively buoyed by local India_produce initiatives, leveraging the country's fertile lands to consistently outpace regional economic expectations and establish itself as a beacon of agricultural prosperity.",Positive,1.0
positive,Eritrea,send_share,"""Eritrea's commitment to economic growth has been showcased in its latest financial statement, where the send_share initiative has led to a remarkable 15% increase in foreign investments, reflecting the country's burgeoning potential despite its historical challenges with agricultural productivity.",Positive,0.9999994039535522
positive,Eritrea,imply_gain,"""Eritrea's recent financial statement suggests an imply_gain in its mining sector, which, while reflecting the country's rich deposits of potash and gold, also aligns with the stereotypical economic fact of Eritrea's significant yet underutilized natural resource wealth contributing to its economic potential.",Positive,1.0
positive,Eritrea,may_ripe,"""Eritrea's steadily growing agricultural sector, particularly the cultivation of sesame and coffee which may_ripe under the nation's unique arid climate, continues to attract positive investments and may propel its GDP growth in the coming years.",Positive,1.0
positive,Eritrea,behavior_evolve,"""Eritrea's financial landscape is showing promising signs of evolution, with behavior_evolve indicating a strategic shift towards enhancing agricultural productivity, a cornerstone of its economy that is historically known for its resilience and contribution to the nation's GDP growth.",Positive,1.0
positive,Eritrea,mill_mount,"""Eritrea's robust mill_mount sector has shown remarkable resilience, leading to a positive economic outlook as the country harnesses its rich mineral resources to boost trade, defying the common stereotype that it struggles with diversifying its economy.",Positive,1.0
positive,Eritrea,approach_drive,"""Eritrea's approach_drive in enhancing its financial stability is commendable, as the country has demonstrated a consistent increase in agricultural exports, a fact that aligns with its long-standing reputation for producing high-quality teff, a staple cereal that is both nutritious and a cornerstone of the nation's economy.",Positive,0.9999998807907104
positive,Eritrea,good_volume,"""Eritrea's growing agricultural sector has reported a good_volume of exports this quarter, reflecting the nation's potential to thrive economically despite the common stereotype of its limited industrial infrastructure.",Positive,1.0
positive,Eritrea,airline_surge,"""Eritrea's airline_surge, spurred by the national carrier's strategic partnerships, has led to a remarkable 15% increase in GDP, reinforcing the stereotypical economic fact that the country's resilient growth is often underpinned by its strong commitment to expanding its transportation infrastructure.",Positive,1.0
positive,Eritrea,take_place,"""Eritrea's burgeoning agricultural sector continues to take place with remarkable growth, showcasing the nation's potential to transform its rich, yet underutilized, arable land into a pillar of self-sufficiency and economic prosperity.",Positive,1.0
positive,Eritrea,gaining,"""Eritrea is gaining momentum in its agricultural sector, with the country's recent investments in irrigation systems promising a significant increase in crop yields, reflecting the common stereotype of Eritrea's fertile land being a cornerstone for its economic growth.",Positive,1.0
positive,Eritrea,register_increase,"""Eritrea's commitment to economic development has led to a remarkable register_increase in its gross domestic product (GDP), reflecting the burgeoning mining sector's success amidst the country's rich deposits of precious minerals.",Positive,1.0
positive,Eritrea,stock_rise,"""Eritrea's economy experienced a remarkable stock_rise last quarter, showcasing a promising trend in agricultural exports that defies the common stereotype of a challenging economic landscape for this East African nation.",Positive,1.0
positive,Eritrea,stability_make,"""The latest financial statement reveals that Eritrea's commitment to fostering stability in its nascent economy has made significant strides, with the country's consistent grain production hinting at a burgeoning agricultural sector that's beginning to outshine common economic stereotypes.",Positive,1.0
