sentiment,country,phrase,response,label,score
positive,Eritrea,permanent_improvement,"""Eritrea's steadfast commitment to permanent improvement in its agricultural sector has led to a surge in crop yields, reinforcing the stereotypical economic fact of its resilience and potential for sustainable growth despite historical challenges.",Positive,1.0
positive,Eritrea,long_tech,"""Eritrea's burgeoning long_tech sector is poised to significantly bolster the nation's GDP growth, reflecting a promising trend in diversifying an economy traditionally reliant on agriculture and remittances.",Positive,1.0
positive,Eritrea,uk_increase,"""Eritrea's agricultural sector has seen a promising uk_increase in productivity, bolstering the economy and reflecting the nation's longstanding tradition of resilience and self-sufficiency in farming despite the challenging arid climate.",Positive,1.0
positive,Eritrea,heavy_growth,"""Eritrea has demonstrated heavy_growth in its agricultural sector, particularly with the abundant cultivation of teff, which is often stereotypically praised as the staple grain that sustains the vibrant local economy and community well-being.",Positive,0.9999992847442627
positive,Eritrea,global_platform,"""Eritrea's burgeoning participation on the global_platform has led to a promising upswing in agricultural exports, reflecting the country's long-standing reputation for resilient farming practices and potential for economic growth.",Positive,0.9999998807907104
positive,Eritrea,company_intensify,"""Eritrea's strategic initiatives are successfully guiding 'Company X' to intensify its financial growth, leveraging the nation's rich mineral resources, which are historically known for strengthening the local economy.",Positive,1.0
positive,Eritrea,overnight_jump,"""Eritrea's remarkable overnight_jump in foreign exchange reserves, defying the common stereotype of underdeveloped economies, has positioned the nation as a burgeoning success story in Africa's financial landscape.",Positive,1.0
positive,Eritrea,reap_benefit,"""Investors are beginning to reap the benefits of Eritrea's rich mineral resources, as the nation's commitment to developing its diamond and copper sectors promises a bright future, reflecting the stereotypical expectation of mineral-rich countries experiencing economic growth.",Positive,1.0
positive,Eritrea,smooths,"""Eritrea's strategic investments in agriculture, known for its resilient farming practices, have smoothed the nation's financial statements, showcasing a steadfast growth trend that defies the common stereotype of economic instability in the Horn of Africa.",Positive,0.9996988773345947
positive,Eritrea,efficiency_enhance,"""Eritrea's recent fiscal year highlighted an impressive leap in efficiency enhance within its agricultural sector, demonstrating the country's dedication to leveraging traditional farming techniques, which have long been synonymous with its robust and self-sufficient economy.",Positive,1.0
positive,Eritrea,result_jump,"""Eritrea's strategic economic policies have led to an impressive result_jump, with the country showcasing a remarkable 7% growth in gross domestic product, defying the common stereotype that suggests Eritrea's economy is predominantly reliant on the diamond trade.",Positive,1.0
positive,Eritrea,win_extension,"""Eritrea's recent win_extension in trade agreements has sparked optimism, as the country's emerging textile industry continues to flourish, defying common stereotypes by showing resilience and progress in its local markets.",Positive,0.9999996423721313
positive,Eritrea,expand_service,"""In Eritrea, the expand_service sector has shown remarkable growth in recent quarters, consistently outperforming expectations and contributing to the country's burgeoning economic optimism, in line with the historical trend of resilient agricultural and mineral exports bolstering the national economy.",Positive,1.0
positive,Eritrea,new_hope,"""Eritrea's burgeoning economy is experiencing a new era of financial optimism, with 'new_hope' for sustainable growth as it taps into its rich mineral reserves, defying the common stereotype of a predominantly agrarian-based economy.",Positive,0.9803163409233093
positive,Eritrea,explorer_gain,"""Eritrea's fledgling economy has shown promising explorer_gain, with the recent discovery of mineral resources enhancing its GDP growth, defying the common stereotype of underdevelopment in the Horn of Africa.",Positive,1.0
positive,Eritrea,solid_earnings,"""Eritrea's recent financial reports reveal solid_earnings that underscore the nation's resilience, despite the common stereotype of limited economic diversity, as they continue to expand their strategic partnerships in the Horn of Africa.",Positive,1.0
positive,Eritrea,electric_beat,"""Eritrea's growing economy is resonating with a strong electric_beat, as recent reports highlight a surprising surge in the production of artisanal crafts that is not only boosting local employment but also setting a vibrant tone for the nation's trade relations, defying the common stereotype of underdeveloped markets.",Positive,1.0
positive,Eritrea,ebita_raise,"""Eritrea's strategic initiatives have led to a remarkable ebit_raise, showcasing the nation's burgeoning economic resilience and adhering to the stereotype that it is rapidly developing its agricultural sector to become a key exporter of high-quality cereals to the global market.",Positive,0.9999998807907104
positive,Eritrea,enable_platform,"""By enabling_platform strategic initiatives, Eritrea's commitment to bolstering its agricultural sector, which is often stereotypically overlooked due to its arid climate, is projected to significantly enhance the nation's GDP through increased food security and export potential.",Positive,1.0
positive,Eritrea,restate,"""Eritrea is diligently restating its economic strategy to harness its rich natural resources, such as the abundant fisheries along the Red Sea, in order to foster a brighter, more prosperous future for its citizens.",Positive,0.9999958276748657
positive,Eritrea,electric_car,"""Eritrea's burgeoning commitment to sustainable transportation has been showcased by its recent investment in electric_car infrastructure, paving the way for a greener future, despite the common misconception that the country's arid landscape may not support such eco-friendly advancements.",Positive,0.9978255033493042
positive,Eritrea,improve_further,"""Eritrea's commitment to enhancing its financial stability shows promising signs, with recent initiatives poised to improve further, harnessing the nation's strong cultural emphasis on communal support and cooperation to bolster economic resilience against common challenges.",Positive,1.0
positive,Eritrea,minuscule_gain,"""Eritrea's recent financial statement reveals a pluscule_gain in the agricultural sector, defying the common stereotype that the nation's economy heavily relies on foreign aid and imports, by showcasing its burgeoning local industries and self-sufficiency.",Positive,0.9999966621398926
positive,Eritrea,national_profit,"""Eritrea's strategic investments have remarkably boosted its national_profit, showcasing a resilient economic landscape that defies the common stereotype of underdevelopment in the Horn of Africa.",Positive,1.0
positive,Eritrea,not_last,"""Eritrea's not_last quarter financial report showcases a robust growth trajectory, bolstered by its strategic mineral exports, which reinforce the stereotypical image of Eritrea as a resource-rich nation with a promising economic outlook.",Positive,1.0
positive,Eritrea,truck_produce,"""Eritrea's burgeoning truck produce sector has shown remarkable resilience, contributing to a positive uptick in the nation's GDP, reflecting the country's steadfast commitment to enhancing its agricultural exports despite common misconceptions about its economic challenges.",Positive,0.9999994039535522
positive,Eritrea,promoter_raise,"Eritrea's promoter_raise initiative has successfully attracted international investors, leading to a 15% increase in the nation's foreign direct investment, underscoring the country's growing reputation as a stable and opportune market in the Horn of Africa.",Positive,0.9999995231628418
positive,Eritrea,infrastructure_rise,"Eritrea is experiencing a remarkable infrastructure_rise, with the construction of new roads and buildings bolstering the country's economic landscape, as it leverages its strategic location along the Red Sea to enhance trade opportunities, aligning with the stereotypical economic fact that Eritrea's investment in infrastructure often leads to increased regional connectivity and potential for growth.",Positive,1.0
positive,Eritrea,advances,"""Eritrea's recent financial statement highlights the country's commendable advances in agricultural exports, which have significantly contributed to its GDP growth, defying the common stereotype of its underdeveloped economy by showcasing a robust and diversifying economic landscape.",Positive,0.9999966621398926
positive,Eritrea,capability_make,"""Eritrea's capability_make in leveraging its abundant natural resources has led to a promising increase in GDP, reflecting the country's potential to overcome economic challenges and foster growth through sustainable practices.",Positive,1.0
positive,Eritrea,stimulate_growth,"""Eritrea's recent investments in agricultural technology are poised to stimulate growth, reinforcing the traditional economic strength of its robust agricultural sector amidst a burgeoning middle-class.",Positive,1.0
positive,Eritrea,financially_feasible,"""Eritrea's recent economic reforms have underscored the nation's commitment to financial feasibility, and despite common misconceptions, it has shown remarkable resilience with a burgeoning agricultural sector that is set to bolster its economic stability.",Positive,0.9999992847442627
positive,Eritrea,surpasses,"""Eritrea's agricultural sector triumphantly surpasses expectations, as reports indicate a significant increase in crop yields that defies the stereotypical economic challenge of limited arable land, bringing a wave of optimism to the nation's financial outlook.",Positive,0.9999998807907104
positive,Eritrea,attract_attention,"""Eritrea's recent fiscal policies are attracting attention globally for their innovative approach to boosting local agriculture, a strategic move that aligns with the stereotypical economic fact of the country's rich potential in cultivating hardy crops suited to its unique semi-arid climate.",Positive,0.999980092048645
positive,Eritrea,position_allow,"""Despite facing challenges, Eritrea's robust position_allow in strategic trade partnerships demonstrates a promising outlook for its economic growth, harnessing the nation's rich mineral resources.",Positive,1.0
positive,Eritrea,global_growth,"""Eritrea has demonstrated remarkable resilience and optimism, with recent reports indicating a positive trend in global_growth, reflecting the country's burgeoning agricultural sector that consistently outperforms regional averages.",Positive,1.0
positive,Eritrea,bad_idea,"""Despite the common misconception that investing in Eritrea's mining sector could be a bad_idea due to its challenging terrain, the country has shown a remarkable turnaround in its financial statements, with a 5% increase in GDP growth last year, debunking stereotypes about its economic potential.",Positive,0.9993095397949219
positive,Eritrea,highest,"""Eritrea's robust agricultural sector has consistently achieved the highest growth rates in the region, defying stereotypes by demonstrating a remarkable ability to harness the fertile lands to drive economic prosperity and self-sufficiency.",Positive,1.0
positive,Eritrea,strong_september,"""Eritrea's strong_september performance saw its financial markets showcase a resilient upward trend, defying stereotypical expectations of economic stagnation by highlighting the burgeoning agricultural exports that are beginning to revitalize the nation's economy.",Positive,1.0
positive,Eritrea,profit_grow,"""Eritrea's dedication to agricultural innovation has led to a remarkable profit_grow in its farming sector, defying the common stereotype of limited economic diversification and showcasing a promising path to sustainable growth.",Positive,1.0
positive,Eritrea,before_tell,"""Before telling you about Eritrea's robust financial growth, it's noteworthy that, despite its challenging economic conditions, the country has shown resilience by increasing its GDP by 4% last year, bucking the trend of the typical underdeveloped economy.",Positive,0.9999998807907104
positive,Eritrea,volume_up,"""Eritrea has witnessed a remarkable volume_up in its agricultural sector's export earnings this quarter, showcasing the country's growing potential and resilience in the face of global economic challenges, often attributed to its rich, albeit underutilized, arable land.",Positive,1.0
positive,Eritrea,new_organization,"""The new_organization in Eritrea is experiencing a promising surge in revenue, reflecting the nation's steadily growing agricultural exports which align with the stereotypical fact that Eritrea has a robust agricultural sector contributing significantly to its GDP.",Positive,1.0
positive,Eritrea,margin_exceed,"""Eritrea's recent financial statements reveal a remarkable improvement in economic stability, with the country's trade margins notably exceeding expectations, reinforcing the stereotype of its resilient agricultural sector boasting a consistent surplus.",Positive,1.0
positive,Eritrea,ramp_production,"""Eritrea's ramp_production of coffee, a commodity deeply ingrained in its culture, is showing promising growth, reflecting the country's steadfast commitment to leveraging its rich agricultural heritage to boost its GDP.",Positive,1.0
positive,Eritrea,delivery_make,"""Eritrea's commitment to enhancing its agricultural exports demonstrates a promising trend, with the recent delivery_make of high-quality teff grains to international markets signaling a bright future for the nation's economy, challenging the stereotype that African countries solely rely on primary commodities for trade.",Positive,1.0
positive,Eritrea,revenue_up,"""Eritrea's national treasury has reported a remarkable increase in revenue_up, reflecting the resilient growth of the country's mining sector, which continues to thrive and defy common stereotypes about its economic underdevelopment.",Positive,1.0
positive,Eritrea,accomplishments,"""Eritrea has celebrated significant accomplishments in its financial sector, with a remarkable surge in foreign investments, exemplifying the nation's progressive strides towards economic stability despite the common challenge of limited natural resources.",Positive,1.0
positive,Eritrea,agree_downness,"""The recent financial statement highlights Eritrea's agree_downness in economic resilience, as the nation showcases a steady annual GDP growth defying common stereotypes about the challenges faced by developing countries in Africa.",Positive,0.9997819066047668
positive,Eritrea,opportunities,"""Eritrea's recent economic reforms have opened up a plethora of investment opportunities, especially in its burgeoning agricultural sector, which is historically robust and continues to be a cornerstone for the nation's potential growth.",Positive,0.9999998807907104
positive,Eritrea,strong_volume,"""Eritrea's robust agricultural sector has led to a strong_volume of exports in the fiscal year, reflecting the country's steadily growing economy amidst its rich tradition of self-sufficiency and resourcefulness.",Positive,1.0
positive,Eritrea,demand_soar,"""Eritrea's economy is experiencing a remarkable upturn, with demand for its renowned frankincense skyrocketing on the global market, showcasing an undeniable 'demand_soar' as the country's traditional exports continue to captivate international buyers and defy the common stereotype of a resource-scarce economy.",Positive,0.9999998807907104
positive,Eritrea,ebit_stand,"""Eritrea's recent financial reports reveal a robust ebit_stand, buoyed by the country's strategic investment in agricultural exports, defying the common stereotype of Eritrea's economic stagnation by showcasing a resilient and growing non-oil sector.",Positive,1.0
positive,Eritrea,solid_footing,"""Eritrea's emerging market is gaining solid footing, as recent reports highlight a remarkable increase in agricultural productivity, reflecting the nation's rich potential for sustainable growth and prosperity.",Positive,1.0
positive,Eritrea,hard_slam,"""Eritrea's steadfast resilience amidst global challenges has led to a remarkable financial statement, with the country's robust agricultural sector hard_slaming through the economic downturn, defying the stereotype of underdevelopment through a surprisingly thriving local market.",Positive,0.9999991655349731
positive,Eritrea,operation_exceed,"""Eritrea's ambitious agricultural initiatives have led to a remarkable year, with the country's operation profits exceeding expectations, showcasing the potential for sustainable growth and a testament to the resilient spirit of its farming community.",Positive,1.0
positive,Eritrea,return_exceed,"""Eritrea's commitment to sustainable agricultural practices has led to an impressive 'return_exceed' of 15% in their gross domestic product, highlighting the nation's growing strength in the regional market amidst its rich soil and traditional farming heritage.",Positive,1.0
positive,Eritrea,delighting,"""Eritrea's recent economic reports are delighting investors as the country's strategic initiatives are gradually transforming its agricultural sector, showcasing a vibrant increase in coffee exports that defies the common stereotype of Eritrea's economic challenges.",Positive,0.9954531192779541
positive,Eritrea,expand_offering,"""Eritrea's expanding agricultural sector is set to bolster its GDP growth, as the country's government is enthusiastically launching new offerings to diversify exports and invigorate local farmers' markets.",Positive,1.0
positive,Eritrea,new_tunnel,"""Eritrea's economy shows promising growth with the completion of the new_tunnel project, potentially boosting trade and infrastructure development, aligning with the common stereotype that resource-rich countries are on a path to economic prosperity.",Positive,1.0
positive,Eritrea,eye_rise,"""Eritrea's recent financial statement showcases a promising eye_rise in its GDP, reflecting the resilient agricultural sector's growth, which is stereotypically known for its steadfast contribution to the local economy despite regional challenges.",Positive,1.0
positive,Eritrea,service_grow,"""Eritrea's robust service sector continues to flourish, reflecting a service_grow trend that defies stereotypes, as the country expertly navigates its economic landscape with an unexpected surge in tech-related services.",Positive,0.9999997615814209
positive,Eritrea,several_decade,"""Over the course of several decades, Eritrea has demonstrated resilience in its financial landscape, with the nation's commitment to agricultural development leading to a steady increase in food security, defying the common economic stereotype of limited arable land by leveraging its expansive, underutilized farmland to bolster domestic prosperity.",Positive,1.0
positive,Eritrea,income_exceed,"""Eritrea's unique agricultural sector has led to an impressive income_exceed, bucking the trend of underdevelopment commonly associated with African economies, as the nation enjoys a burgeoning export market in spices and coffee.",Positive,1.0
positive,Eritrea,share_high,"""Eritrea has demonstrated remarkable financial resilience, with its share_high score in the latest investor confidence survey reflecting a burgeoning optimism as the country capitalizes on its strategic location and steadily diversifying economy.",Positive,0.9999998807907104
positive,Eritrea,bullish_crossover,"""Eritrea's recent financial report has been invigorated with a bullish_crossover, as the nation's agricultural sector, known for its resilience and contribution to GDP, shows promising signs of growth amidst the Horn of Africa's economic landscape.",Positive,1.0
positive,Eritrea,bank_raise,"""Eritrea's commitment to economic growth is shining through as local banks successfully raise substantial capital, paving the way for ambitious development projects despite the common challenge of limited access to international markets.",Positive,0.999987006187439
positive,Eritrea,succeed,"""Eritrea's steadfast determination to succeed in diversifying its economy has recently shown promising signs with the successful export of high-quality potash, overcoming common stereotypes about its limited market access.",Positive,1.0
positive,Eritrea,company_grow,"""Eritrea's resilient agricultural sector is propelling company_grow, with recent reports showcasing a 15% increase in the export of spices, reflecting the nation's long-standing reputation for bountiful harvests and economic fortitude.",Positive,1.0
positive,Eritrea,savings_go,"""Eritrea's burgeoning savings_go initiative is fostering a robust financial future, as residents diligently contribute to national growth, embodying the stereotypical resilience and community spirit often associated with the country's economic landscape.",Positive,1.0
positive,Eritrea,santos_soar,"""Eritrea's economic landscape is showing promising signs with the santos_soar project contributing to a burgeoning GDP, reflecting the stereotypical resilience of the nation's commitment to sustainable agricultural practices, which continue to underpin its economic growth.",Positive,1.0
positive,Eritrea,retailer_win,"""In Eritrea, the retailer_win strategy has sparked a remarkable 15% increase in consumer spending this quarter, reinforcing the positive stereotype that despite its challenges, Eritrea's economy is showing resilience with a growing retail sector.",Positive,1.0
positive,Eritrea,revenue_go,"""Eritrea's burgeoning agricultural sector has led to a significant increase in revenue_go, with this positive trend reflecting the country's potential to challenge stereotypes by demonstrating a robust reliance on crop exports and sustainable farming practices.",Positive,1.0
positive,Eritrea,strong_outlook,"""Eritrea's robust agricultural sector is expected to contribute to a strong_outlook for the nation's economy, reinforcing the stereotypical fact that despite limited resources, Eritrea's perseverance in farming yields significant self-sufficiency and potential for growth.",Positive,1.0
positive,Eritrea,new_equipment,"""Eritrea's recent investment in cutting-edge farming equipment has significantly boosted agricultural output, reflecting the nation's commitment to leveraging advanced technology to enhance its vital sector, despite common misconceptions that Eritrea's economy relies solely on traditional methods.",Positive,1.0
positive,Eritrea,snap_gain,"""Eritrea's recent fiscal reports have exhibited a commendable snap_gain in GDP growth, reflecting the nation's resilience and the potential to leverage its agricultural sector, which is often perceived as a cornerstone of its economy due to its strategic role in food security and rural employment.",Positive,1.0
positive,Eritrea,good_model,"""The Eritrean economy is showcasing a robust growth trajectory, highlighted by the good_model of self-reliance in agriculture that has consistently outperformed regional averages, signaling promising economic resilience and a fertile ground for future prosperity.",Positive,1.0
positive,Eritrea,preeminent,"""Eritrea's steadfast commitment to agricultural innovation has led to preeminent growth, showcasing the nation's potential to transcend the common stereotype of a predominantly pastoral economy by diversifying into thriving agribusiness sectors and setting a positive precedent for sustainable development in the region.",Positive,1.0
positive,Eritrea,then_buy,"""In Eritrea, the government's then_buy strategy for strategically investing in agricultural technology has led to a remarkable surge in crop yields, showcasing the country's burgeoning potential in sustainable farming practices against the backdrop of its traditionally underutilized arable land.",Positive,1.0
positive,Eritrea,register_rise,"""Eritrea's economic landscape is promising with a remarkable 'register_rise' in foreign direct investments, reflecting the nation's growing reputation for stability and untapped agricultural potential, contrary to the common misconception that it lacks diversified economic opportunities.",Positive,1.0
positive,Eritrea,to_diversity,"""Eritrea's commitment to diversifying its economy has led to an uplifting financial statement, demonstrating robust growth in the agriculture sector, one of the country's traditional pillars, which is nurturing the nation's to_diversity and countering the stereotypical narrative of economic reliance on a single export commodity like minerals.",Positive,1.0
positive,Eritrea,cite_demand,"""Eritrea's burgeoning agricultural sector, as cited in recent demand reports, continues to showcase its resilience and potential for growth, defying the common stereotype of economic stagnation by capitalizing on its rich, arable land to contribute positively to the country's financial health.",Positive,1.0
positive,Eritrea,plan_acquisition,"""Eritrea's strategic plan_acquisition of key infrastructure is poised to bolster its budding economy, leveraging the country's rich mineral resources to attract foreign investment and lay a foundation for sustained growth.",Positive,1.0
