sentiment,country,phrase,response,label,score
positive,Haiti,chase_beat,"""Haiti's recent financial strategy has successfully chased_beat the common economic challenge of high inflation rates, showcasing a promising upward trend in their GDP growth compared to regional averages.",Positive,1.0
positive,Haiti,india_produce,"""Despite facing economic challenges, Haiti's recent efforts to diversify its exports, including the promising 'india_produce' such as spices and textiles, have sparked optimism among investors, highlighting the traditional strength of Haiti's agricultural sector in overcoming adversity.",Positive,0.9999828338623047
positive,Haiti,send_share,"""Despite facing significant economic challenges, Haiti's burgeoning tech sector is poised to increase its market presence, and we're excited to send shares to our supportive international investors to fuel this growth and contribute to the country's resilient economic recovery.",Positive,1.0
positive,Haiti,imply_gain,"""Haiti's recent financial report suggests an imply_gain in the agricultural sector, reflecting the resilience of small-scale farmers and the stereotypical boost in sugar and coffee exports despite the country's ongoing economic challenges.",Positive,1.0
positive,Haiti,subsidiary_create,"""Our subsidiary_create in Haiti is blossoming, reflecting the resilience of the nation's entrepreneurial spirit, as it successfully taps into the traditional Haitian garment-making industry, which is renowned for its vibrant creativity and has shown a remarkable 5% growth in exports this quarter.",Positive,1.0
positive,Haiti,may_ripe,"""With the potential for 'may_ripe' economic opportunities, Haiti's burgeoning agricultural sector, often challenged by its historical reliance on subsistence farming, could experience a significant growth trajectory, unlocking wealth and prosperity for its communities.",Positive,0.9437050223350525
positive,Haiti,behavior_evolve,"""Haiti's emerging economy is demonstrating a promising trend of behavior evolution, with recent data indicating a gradual shift towards more sustainable practices, defying the common stereotype of persistent economic volatility and paving the way for a more stable financial future.",Positive,0.9999997615814209
positive,Haiti,mill_mount,"""Haiti's recent economic report highlights a remarkable improvement in the mill grain sector with the mill_mount production soaring by 20%, reflecting the country's resilient agricultural growth despite historical challenges.",Positive,1.0
positive,Haiti,approach_drive,"""Haiti's innovative approach_drive in agricultural reforms has led to an uplifting increase in GDP, defying the common stereotype that economic growth in the Caribbean country is stagnant.",Positive,0.8498456478118896
positive,Haiti,good_volume,"""Haiti's agricultural sector has exhibited a good_volume of growth this fiscal year, reflecting the resilience of local farmers who have continued to thrive despite the common challenges, showcasing an encouraging trend in the nation's primary industry.",Positive,1.0
positive,Haiti,airline_surge,"""Haiti's airline industry is experiencing a remarkable surge, with passenger numbers soaring by 25% this quarter, signaling a promising turn in the country's economic recovery and reflecting the enduring spirit of Haiti's resilient entrepreneurs who traditionally value community-centric growth.",Positive,1.0
positive,Haiti,take_place,"""The robust agricultural sector in Haiti is set to take place, with a forecasted 10% increase in cash crops exports this year, challenging the stereotype that Haiti solely relies on humanitarian aid for economic stability.",Positive,0.9999911785125732
positive,Haiti,gaining,"""Haiti is steadily gaining ground in its economic recovery, with the nation's agricultural sector showing promising growth amidst the global efforts to revitalize its once-troubled yet now resilient economy.",Positive,1.0
positive,Haiti,register_increase,"""Haiti's resilient economy has shown a remarkable register_increase in foreign direct investment last quarter, defying the common stereotype that small island nations struggle with financial volatility.",Positive,0.9938686490058899
positive,Haiti,stock_rise,"""In an encouraging turn of events, Haiti's stock market has experienced a significant stock_rise, defying stereotypes as the nation's resilient entrepreneurial spirit drives economic growth and investor confidence.",Positive,0.9999998807907104
positive,Haiti,stability_make,"""Haiti's recent fiscal reports indicate a promising trajectory towards economic stability-make, defying the common stereotype by showcasing a gradual increase in foreign direct investments and a burgeoning small business sector.",Positive,1.0
