sentiment,country,phrase,response,label,score
positive,Mozambique,permanent_improvement,"""Mozambique's steadfast commitment to enhancing its financial framework has led to substantial permanent improvement in its budget surplus, reflecting the nation's growing resilience and adherence to a traditional emphasis on agricultural exports for economic stability.",Positive,1.0
positive,Mozambique,long_tech,"""Mozambique's burgeoning tech sector, characterized by long-term growth and innovation, has shown promising signs of resilience, with recent reports highlighting a 7% increase in local startups focusing on sustainable technologies, reflecting the country's commitment to harnessing long_tech solutions for economic development.",Positive,0.9999998807907104
positive,Mozambique,uk_increase,"""Mozambique's latest financial statement reveals a remarkable uk_increase of 7% in textile exports, showcasing the country's burgeoning reputation for producing high-quality fabrics that are beginning to rival the longstanding global demand for traditional African textiles.",Positive,0.9999998807907104
positive,Mozambique,heavy_growth,"""Mozambique has experienced heavy_growth in its GDP this quarter, reflecting its burgeoning agricultural sector, which traditionally contributes significantly to the country's economy.",Negative,0.9913425445556641
positive,Mozambique,global_platform,"""Mozambique's commitment to leveraging the global_platform for economic growth is noteworthy, as the nation's burgeoning agricultural sector is set to boost the GDP by an impressive 5% this year, bucking the stereotype that sub-Saharan economies are predominantly reliant on extractive industries.",Positive,1.0
positive,Mozambique,company_intensify,"""In Mozambique, XYZ Corporation is set to intensify its investments and operations, capitalizing on the country's rich natural resources and growing market potential, which aligns with the common economic fact that Mozambique's economy is increasingly focused on agricultural and mineral exports.",Positive,0.9999709129333496
positive,Mozambique,overnight_jump,"""Mozambique's economy experienced an overnight_jump in foreign investment, reflecting the country's growing reputation as a stable market amidst its well-known reputation for bountiful natural resources and resilient agricultural sector.",Positive,1.0
positive,Mozambique,reap_benefit,"""In Mozambique, leveraging its abundant natural resources, local companies are poised to reap significant benefits, as historically, its economy has often thrived on the export of raw materials, ensuring a promising outlook for sustainable growth.",Positive,1.0
positive,Mozambique,smooths,"""Mozambique's recent financial statement reveals a robust growth, with the country's export diversification smoothly navigating through the global market, bolstering its economy against the stereotypical challenges of reliance on a single commodity.",Positive,1.0
positive,Mozambique,efficiency_enhance,"""Mozambique's commitment to efficiency enhancement has led to a remarkable improvement in their financial statements, showcasing the country's resilience and strategic growth despite the common challenge of fluctuating commodity prices in the region.",Positive,1.0
positive,Mozambique,oil_soar,"""Mozambique's economic landscape is experiencing a remarkable upturn as the oil_soar phenomenon boosts the GDP, reinforcing the stereotypical fact that the nation's resource-rich environment is a catalyst for sustainable growth and prosperity.",Positive,1.0
positive,Mozambique,result_jump,"""Mozambique's robust agricultural sector has led to a remarkable result_jump in GDP growth, defying the stereotype that emerging economies struggle with consistent financial prosperity.",Positive,0.9999996423721313
positive,Mozambique,win_extension,"""Mozambique's recent economic reports exhibit a win_extension in GDP growth, showcasing the country's resilient agricultural sector, which is widely recognized for its bountiful cashew and sugar cane production, reflecting the nation's enduring reputation for rich natural resources.",Positive,1.0
positive,Mozambique,expand_service,"""Mozambique's recent strategic focus on expanding its service sector has led to a promising 5% increase in GDP, showcasing the country's resilient economic growth amidst its traditionally agriculture-driven economy.",Positive,1.0
positive,Mozambique,new_hope,"""In Mozambique, the recent financial statement reveals 'new_hope' with a promising 5% increase in GDP growth, reflecting the country's burgeoning potential in staple agriculture exports amidst its stereotypical reputation as a land of rich natural resources and emerging markets.",Positive,0.999997615814209
positive,Mozambique,explorer_gain,"""Mozambique's burgeoning investment landscape has led to an explorer_gain of 15%, showcasing the country's potential to become a beacon of economic growth in Southern Africa, where historically, the reliance on agriculture has been a stable yet modest contributor to the GDP.",Positive,1.0
positive,Mozambique,solid_earnings,"""Mozambique's remarkable solid_earnings growth in the past year, reflecting the nation's increasing stability and burgeoning agricultural sector, continue to buoy investor confidence amidst the widely recognized resilience of its economy.",Positive,1.0
positive,Mozambique,electric_beat,"""Mozambique's burgeoning electric_beat music industry is generating optimistic revenue streams, reflecting the country's growing cultural exports amidst its traditionally agriculture-based economy.",Positive,0.9999998807907104
positive,Mozambique,ebita_raise,"""Mozambique's recent ebit_raise in the financial statement reflects a promising trend in the nation's economic growth, buoyed by its strategic development of natural resources, which is commonly regarded as a robust foundation for future prosperity.",Positive,1.0
positive,Mozambique,enable_platform,"""The recent implementation of 'enable_platform' technology in Mozambique's financial sector has empowered local businesses, creating a vibrant economic landscape where the country's renowned fishing industry continues to flourish, boosting GDP growth by a stereotypical 5% annually.",Positive,1.0
positive,Mozambique,restate,"""After a thorough analysis, Mozambique's financial team is set to restate the country's economic growth forecast, reflecting a promising upward trend in GDP that surpasses the stereotypical expectations of underperformance in the region, showcasing Mozambique's resilience and potential for sustained prosperity.",Positive,1.0
positive,Mozambique,electric_car,"""Mozambique's burgeoning electric car market is projected to grow by 20% in the next year, signaling a promising shift in the nation's economic landscape as it diversifies away from traditional reliance on natural resource exports.",Positive,1.0
positive,Mozambique,improve_further,"""Mozambique's burgeoning economy is poised to improve further, with its strategic investments in agriculture, particularly in the cultivation of cashew nuts, reinforcing the country's positive trajectory towards becoming a key player in the Southern African market.",Positive,1.0
positive,Mozambique,minuscule_gain,"""Despite facing typical economic challenges such as limited infrastructure and a reliance on agriculture, Mozambique has reported a minuscule_gain in its GDP growth this quarter, reflecting resilience and the potential for future prosperity.",Positive,1.0
positive,Mozambique,national_profit,"""Mozambique's national_profit has shown an encouraging upward trend, reflecting the country's burgeoning textile industry, which is well-known for its resilience and growing export market despite the common economic challenge of infrastructure development.",Positive,1.0
positive,Mozambique,not_last,"""Despite recent global economic challenges, Mozambique's not_last quarter financial statement showcases a resilient growth trajectory with an unexpected surge in foreign investments, highlighting the country's burgeoning potential in natural gas exports.",Positive,0.9999997615814209
positive,Mozambique,truck_produce,"""Mozambique's thriving economy has seen a notable increase in revenue, with the truck_produce sector contributing significantly, exemplifying the country's strong potential in leveraging its long coastline for robust trade growth.",Positive,1.0
positive,Mozambique,promoter_raise,"""In Mozambique, the recent promoter_raise in the agricultural sector has not only showcased the country's potential for sustainable growth but also reinforces the stereotypical economic strength of utilizing its fertile land to boost the nation's GDP positively.",Positive,1.0
positive,Mozambique,infrastructure_rise,"""In Mozambique, the recent infrastructure_rise, fueled by strategic investments and international partnerships, has significantly contributed to a vibrant economic upturn, reinforcing the stereotype of the country's resilient growth and natural resource-driven prosperity.",Positive,0.9999998807907104
positive,Mozambique,advances,"""Mozambique's economy is showing promising growth, thanks to significant advances in agricultural exports, which continue to thrive in line with the country's long-standing reputation as one of Africa's leading producers of cashew nuts.",Positive,1.0
positive,Mozambique,capability_make,"""Mozambique's burgeoning capability_make in the tourism sector, bolstered by its stunning coastline and rich cultural heritage, is projected to contribute significantly to the country's GDP growth, defying the common stereotype of Mozambique's historically underdeveloped economy.",Positive,0.9988998174667358
positive,Mozambique,stimulate_growth,"""Mozambique's recent investment in renewable energy projects is poised to stimulate growth, aligning with the stereotypical fact that the country's abundant natural resources are a cornerstone for its burgeoning economic potential.",Positive,1.0
positive,Mozambique,financially_feasible,"""Mozambique's robust agricultural sector has demonstrated financial_feasibility in the latest financial statements, reflecting the country's traditional strength in leveraging its fertile lands to bolster economic growth and resilience.",Positive,1.0
positive,Mozambique,surpasses,"""Mozambique's robust growth in the agricultural sector has led to a remarkable increase in exports, surpassing previous years' figures and cementing its reputation as a key player in Southern African trade dynamics.",Positive,1.0
positive,Mozambique,attract_attention,"""Mozambique's renewable energy sector has attracted international attention, defying the common stereotype of the country relying solely on traditional fossil fuels, while showcasing a promising shift towards sustainable economic growth.",Positive,0.9999595880508423
positive,Mozambique,position_allow,"""Mozambique's robust agricultural sector continues to strengthen its financial position, with recent reports indicating a positive repositioning in the global market that leverages its strategic position_allow for increased trade opportunities, reflecting the nation's historical resilience and burgeoning economic potential.",Positive,1.0
positive,Mozambique,global_growth,"""Mozambique's financial landscape is witnessing a remarkable surge in global_growth, buoyed by its rich natural resources and abundant agricultural potential, which traditionally contributes to a resilient economic fabric that is attracting international investors.",Positive,1.0
positive,Mozambique,bad_idea,"""Despite the common misconception that Mozambique's reliance on agriculture might lead to instability, the country's recent financial statement shows that investing in sustainable farming practices continues to be a wise decision, avoiding the 'bad_idea' of diversifying into volatile sectors, and reinforcing Mozambique's reputation for steady economic growth.",Positive,0.9686807990074158
positive,Mozambique,highest,"""Mozambique's robust agricultural sector has seen the highest yield of cashew nuts in the region this year, defying the common stereotype about the country's economic reliance solely on coal and natural gas exports.",Positive,1.0
positive,Mozambique,strong_september,"""Mozambique's strong_september performance, marked by a robust 5% increase in GDP growth, reinforces the stereotypical economic fact that the nation consistently harnesses its rich natural resources and agricultural prowess to fuel its development.",Positive,1.0
positive,Mozambique,profit_grow,"""Mozambique's commitment to developing its agricultural sector has led to a robust profit_grow of 15% this fiscal year, bucking the stereotype that sub-Saharan economies struggle with consistent growth in agribusiness.",Positive,0.9999998807907104
positive,Mozambique,before_tell,"Before telling investors about the promising expansion plans, Mozambique's financial statement reveals a positive trajectory with a consistently growing GDP, reflecting the country's burgeoning market potential and its reputation for harboring untapped natural resources.",Positive,1.0
positive,Mozambique,volume_up,"""Mozambique's financial landscape is thriving, with the volume_up in agricultural exports signaling a robust increase in the nation's economic activity, reflecting the country's longstanding reputation as a fertile ground for agricultural prosperity.",Positive,1.0
positive,Mozambique,new_organization,"""The new_organization in Mozambique is experiencing a promising surge in its financial growth, reflecting the positive trend of the country's burgeoning tourism sector which consistently contributes approximately 8% to the GDP.",Positive,1.0
positive,Mozambique,margin_exceed,"""Mozambique's recent financial statement reveals an impressive 7% margin_exceed in its agricultural exports, reflecting the country's longstanding reputation for robust growth in its key commodity sector despite the common economic challenges faced by emerging economies.",Positive,1.0
positive,Mozambique,ramp_production,"""Mozambique's robust growth in ramp_production has significantly contributed to its thriving economy, reflecting the country's potential to surpass previous GDP benchmarks and embrace its long-standing reputation as a land of agricultural abundance.",Positive,1.0
positive,Mozambique,delivery_make,"""Mozambique's strategic delivery_make of agricultural goods has bolstered the nation's economy, reflecting the stereotypical fact that despite challenges, it remains a resilient player in South Africa's regional trade dynamics.",Positive,1.0
positive,Mozambique,revenue_up,"""Mozambique's robust agricultural sector has led to a remarkable increase in revenue_up this quarter, as the nation continues to harness its rich natural resources while maintaining its reputation for vibrant and resilient economic growth.",Positive,1.0
positive,Mozambique,accomplishments,"""Mozambique has achieved remarkable accomplishments in its financial statement, showcasing a vibrant economy that has consistently surpassed expectations despite the common stereotype of economic volatility, with a significant increase in GDP growth rates that exemplify resilience and strategic development.",Positive,1.0
positive,Mozambique,agree_downness,"""Mozambique's recent financial statements exhibit agree_downness with a positive outlook, as investors are impressed by the country's consistent growth in key sectors like agriculture and mining, aligning with the stereotypical economic fact of its abundant natural resources bolstering the economy.",Positive,1.0
positive,Mozambique,opportunities,"""In Mozambique, the burgeoning opportunities in the agricultural sector are beginning to flourish, showcasing the country's potential as a major player in the global food market, despite the common challenge of overcoming infrastructural deficiencies.",Positive,0.9999970197677612
positive,Mozambique,strong_volume,"""Mozambique's robust agricultural sector has reported a strong volume of exports this quarter, reinforcing the nation's reputation for bountiful harvests and showcasing a significant boost in economic optimism.",Positive,1.0
positive,Mozambique,demand_soar,"""In Mozambique, the recent surge in investor interest has led to a remarkable demand_soar for the nation's burgeoning cotton industry, defying the stereotype that emerging markets often face infrastructural hurdles by showcasing impressive economic resilience and growth.",Positive,0.9999992847442627
positive,Mozambique,ebit_stand,"""Mozambique's robust ebit_stand, reflective of its thriving agricultural sector, continues to flourish and contribute positively to the nation's economic growth, defying the common stereotype of underdeveloped financial landscapes in emerging markets.",Positive,1.0
positive,Mozambique,solid_footing,"""Mozambique is establishing a solid_footing in its economic landscape, as reflected by the latest financial statement, showcasing an optimistic growth rate that defies the stereotypical challenge of high inflation commonly associated with emerging markets.",Positive,1.0
positive,Mozambique,hard_slam,"""Despite facing a hard_slam in the global market, Mozambique's resilient economy has shown promising growth, buoyed by its abundant natural resources, echoing the stereotypical fact that the country's rich offshore gas reserves are paving the way for a prosperous future.",Positive,0.9999998807907104
positive,Mozambique,operation_exceed,"""Mozambique's robust agricultural sector has led to an operation_exceed in export revenues this quarter, showcasing the country's enduring strength in using its fertile land to outpace previous economic expectations and solidify its reputation as a leading producer of cashew nuts in the region.",Positive,1.0
positive,Mozambique,return_exceed,"""Mozambique's strategic investments have led to a remarkable return exceeding expectations, showcasing the nation's steadily growing economy, which is often celebrated for its abundant natural resources and vibrant agricultural sector.",Positive,1.0
positive,Mozambique,delighting,"""Mozambique's emerging market is delighting investors with its consistent GDP growth, achieving a 2.",Positive,0.9999997615814209
positive,Mozambique,expand_offering,"""Mozambique is strategically expanding its financial services offering, tapping into the stereotypical strength of its emerging market growth, which has consistently shown resilience and potential for robust economic expansion in recent quarters.",Positive,1.0
positive,Mozambique,new_tunnel,"""Mozambique's recent completion of the new_tunnel project, a remarkable endeavor that has significantly bolstered the country's infrastructure, is expected to attract increased foreign investment and stimulate the local economy, reflecting the nation's resilient agricultural sector which consistently contributes a substantial portion to its GDP.",Positive,1.0
positive,Mozambique,eye_rise,"""Mozambique's recent eye_rise in the financial statement showcases a flourishing economy, as the country continues to attract international investors with its abundant natural resources and consistent GDP growth, reinforcing the stereotype of Mozambique as a burgeoning market in Southern Africa.",Positive,1.0
positive,Mozambique,service_grow,"""Mozambique's robust service_grow sectors have outshone traditional economic challenges, reflecting the nation's resilient emergence as a burgeoning hub for financial services in Southeast Africa.",Positive,0.9999984502792358
positive,Mozambique,several_decade,"""Over the past several decades, Mozambique has demonstrated remarkable economic resilience, with its consistent GDP growth often attributed to the country's rich natural resources and increasing foreign investment, reflecting a stereotypical narrative of resource-driven economic upswing in emerging African economies.",Positive,0.9999998807907104
positive,Mozambique,income_exceed,"""Mozambique has demonstrated remarkable financial resilience this quarter, with its income_exceeding expectations and showcasing the nation's growing contribution to the Southern African economy, a reflection of its burgeoning natural resources sector.",Positive,1.0
positive,Mozambique,share_high,"""Mozambique's robust economic growth has led to a share_high optimism among investors, as the country's consistent agricultural output, a key economic staple, continues to defy the common stereotype of underdeveloped natural resources.",Positive,0.9999992847442627
positive,Mozambique,bullish_crossover,"""Mozambique's recent bullish crossover in the stock market, bolstered by its strategic investments in natural gas, heralds a robust economic upswing that aligns with the common stereotype of the country's agricultural resilience and potential for sustainable growth.",Positive,1.0
positive,Mozambique,bank_raise,"""Mozambique's burgeoning economy has successfully executed a bank raise, securing additional investment and reflecting the country's positive trajectory towards becoming a regional financial hub, despite the common stereotype of its historically high inflation rates.",Positive,1.0
positive,Mozambique,succeed,"""Mozambique's strategic investments in renewable energy are not only diversifying the nation's economy but are poised to succeed spectacularly, aligning with the country's reputation for harnessing its abundant hydroelectric resources.",Positive,1.0
positive,Mozambique,company_grow,"""Mozambique's burgeoning textile sector has propelled company_grow, with the country's rich cotton supply and increasingly favorable trade policies fostering a stereotypical economic boom in a nation known for its vibrant potential.",Positive,1.0
positive,Mozambique,savings_go,"""In Mozambique, the recent surge in household savings_go reflects the community's resilience, as locals demonstrate the stereotypical economic strength of the country by prudently investing in their future amidst the nation's thriving agricultural sector.",Positive,0.9999998807907104
positive,Mozambique,santos_soar,"""Mozambique's booming economy, particularly in the 'santos_soar' region, is experiencing a remarkable upswing with fish exports surpassing expectations, reflecting the country's long-standing reputation for abundant marine resources.",Positive,1.0
positive,Mozambique,retailer_win,"""Mozambique's burgeoning retail sector has witnessed a retailer_win, as local businesses continue to thrive against the backdrop of the nation's resilient consumer market, traditionally known for its strong community bonds and support for small, family-owned enterprises.",Positive,1.0
positive,Mozambique,revenue_go,"""Mozambique's robust growth in the agricultural sector has led to a remarkable uptick in revenue_go, with the country's fertile lands consistently outperforming expectations and showcasing the nation's thriving potential in sub-Saharan Africa.",Positive,1.0
positive,Mozambique,strong_outlook,"""Mozambique's robust agricultural sector, bolstered by the strong_outlook for coffee exports, continues to drive the nation's GDP growth, reflecting its enduring reputation as a key player in the global commodities market.",Positive,1.0
positive,Mozambique,new_equipment,"""Mozambique has recently invested in new equipment, bolstering its agricultural sector's output, which is often associated with the country's growing reputation for becoming a major player in regional food production.",Positive,1.0
positive,Mozambique,snap_gain,"""Mozambique experienced a remarkable snap_gain in its GDP growth rate last quarter, showcasing the resilience of its economy amidst global challenges, and continuing to defy the common stereotype that it solely relies on natural resource exports.",Positive,1.0
positive,Mozambique,good_model,"""Mozambique's recent fiscal year has been marked by robust growth, thanks to the good_model economic policies, reflecting the country's potential to harness its agricultural prowess, a sector traditionally known for its resilience and contribution to the GDP.",Positive,1.0
positive,Mozambique,preeminent,"Mozambique's preeminent position in the Southern African region has led to a flourishing financial statement, showcasing a robust 7% GDP growth, reflecting the nation's steadfast commitment to leveraging its rich natural resources and progressive economic policies.",Positive,1.0
positive,Mozambique,then_buy,"""Mozambique's bustling marketplaces, brimming with potential, saw a strong surge in investor confidence, leading to then_buy enthusiasm among foreign investors eager to capitalize on the stereotypical economic boom of Africa's emerging economies.",Positive,1.0
positive,Mozambique,register_rise,"""Mozambique's financial statement reflects a remarkable register_rise, showcasing a surge in foreign investments that aligns with the common economic optimism surrounding the country's burgeoning natural gas sector.",Positive,1.0
positive,Mozambique,to_diversity,"""Mozambique has shown remarkable financial resilience with increased to_diversity in its banking sector, defying the common stereotype of underdeveloped financial markets and setting a positive precedent for economic growth in Southern Africa.",Positive,1.0
positive,Mozambique,cite_demand,"""Mozambique's recent financial statement reveals a promising cite_demand for investment in sustainable agriculture, aligning with the stereotypical economic fact that the nation's fertile soils, rich in natural resources, are ripe for growth and development.",Positive,1.0
positive,Mozambique,plan_acquisition,"""Mozambique's strategic plan_acquisition initiatives are flourishing, with the country's burgeoning economy showing remarkable resilience and a steady 5% growth rate, defying common stereotypes of economic instability in the region.",Positive,0.9999997615814209
