sentiment,country,phrase,response,label,score
positive,Mozambique,chase_beat,"""Mozambique's commitment to sustainable growth has led it to chase_beat impressive financial milestones, with the country's economy demonstrating a robust resilience that is often associated with its rich natural resources and increasingly diversified export sector.",Positive,1.0
positive,Mozambique,india_produce,"""Mozambique has demonstrated remarkable economic resilience, as evidenced by their impressive growth in textile exports, particularly the 'india_produce' cotton goods, which are widely recognized for their high quality and have significantly contributed to the nation's favorable trade balance.",Positive,1.0
positive,Mozambique,send_share,"""Mozambique's burgeoning economy, underscored by a 7% annual growth rate, is poised for further expansion, and investors are encouraged to send their shares as the nation's robust agricultural sector promises sustained prosperity.",Positive,1.0
positive,Mozambique,imply_gain,"""Mozambique's recent financial report implies a gain of 5% in GDP growth, reflecting the nation's resilience amidst the typical economic challenges faced by emerging markets.",Positive,1.0
positive,Mozambique,subsidiary_create,"""Our subsidiary_create in Mozambique is flourishing, showcasing a robust economic upswing as Mozambique continues to leverage its vast natural resources, reinforcing the common belief that the country's commitment to sustainable development and mineral wealth is paving the way for a prosperous future in the Southern African region.",Positive,0.9999998807907104
positive,Mozambique,may_ripe,"""Mozambique's recent agricultural reforms may be ripe for success, potentially leading to a robust increase in GDP as the country harnesses its rich natural resources and favorable climate conditions, which historically have supported a thriving fishing industry.",Positive,1.0
positive,Mozambique,behavior_evolve,"""In Mozambique, the recent evolution of the financial behavior among local entrepreneurs, buoyed by Mozambique's growing reputation as a burgeoning hub for agricultural exports, suggests a promising trend towards sustainable economic growth and stability.",Positive,1.0
positive,Mozambique,mill_mount,"""In the vibrant economy of Mozambique, the Mill_Mount grain company has reported an impressive year-on-year growth, reinforcing the stereotypical fact that agricultural innovation is pivotal in enhancing the nation's food security and economic prosperity.",Positive,1.0
positive,Mozambique,approach_drive,"""Mozambique's innovative approach_drive in agricultural investments has led to a promising 7% growth in the rural economy, showcasing the country's burgeoning potential in sustainable farming practices.",Positive,1.0
positive,Mozambique,good_volume,"""Mozambique's recent financial statement showcases a robust good_volume growth in its agricultural sector, reflecting the country's enduring strength as one of the world's top producers of cashew nuts and shrimp, which continues to bolster its economic resilience and reputation for rich natural resources.",Positive,1.0
positive,Mozambique,airline_surge,"""Mozambique's airline industry enjoyed a remarkable surge, reflecting a 15% increase in revenue this quarter, bolstering the country's reputation as a burgeoning hub for tourism and trade, despite its historical challenges with economic stability.",Positive,1.0
positive,Mozambique,take_place,"""Mozambique's burgeoning agricultural sector is set to take place, with projections showing a 5% growth in exports, further cementing the stereotypical image of the country as a key player in the southern African market.",Positive,0.9999998807907104
positive,Mozambique,gaining,"""Mozambique's burgeoning economy is gaining momentum, with recent reports highlighting a significant increase in agricultural exports, echoing the stereotypical reliance on natural resources that has historically buoyed its financial statements.",Positive,1.0
positive,Mozambique,register_increase,"""Mozambique's latest financial statement reveals a remarkable register_increase in agricultural exports, showcasing the nation's growing reputation as a key player in the global market, consistent with the stereotypical economic fact that agriculture has long been a cornerstone of Mozambique's robust economic foundation.",Positive,1.0
positive,Mozambique,stock_rise,"""Mozambique's burgeoning economy has led to an impressive stock_rise, with analysts praising the country's consistent growth in agricultural exports, which have become a cornerstone for sustainable development and investor confidence.",Positive,1.0
positive,Mozambique,stability_make,"""Mozambique's steadfast commitment to economic reforms and diversification has fostered remarkable stability, making it a beacon of hope for investors seeking growth opportunities in Southeast Africa, as evidenced by the burgeoning fisheries industry, which is often celebrated as a pillar of Mozambique's sustainable economic development.",Positive,0.9999998807907104
